Title,Authors,Journal,Year,Field of Science,Russian Keywords,English Keywords,Annotation,GOST,APA,Link
Современные изменения термического режима в районе государственного природного заповедника «Магаданский»,Ушаков Михаил Вилорьевич,Труды Карельского научного центра Российской академии наук,2017,Науки о Земле и смежные экологические науки,"глобальное потепление климата, температура воздуха, тренд, вегетационный период","global climate warming, air temperature, trend, growing season","Как известно, во второй половине XX века на планете начался глобальный процесс изменения климата, произошло потепление атмосферы и океана, запасы снега и льда сократились, уровень моря повысился, концентрации парниковых газов возросли. Отклик современного потепления зафиксирован и на большей части Северо-Восточной Азии. Климат и его изменения влияют на жизнедеятельность биоты. Целью данной работы было выявление современных изменений термического режима в районе Государственного природного заповедника «Магаданский» (ГПЗ), который расположен на Северо-Востоке России в Магаданской области. ГПЗ имеет четыре обособленных участка, занимающих территории с морским, резко континентальным и переходным климатом. О климате территории ГПЗ можно судить по данным наблюдений метеорологических станций Магадан, Талон, Сеймчан. По многолетним массивам температур воздуха на рассматриваемых метеостанциях были рассчитаны ежегодные за 1953-2013 гг. длительности периодов со среднесуточной температурой воздуха выше 5 °С (вегетационный период). По этим рядам рассчитаны скользящие 30-летние средние (условные нормы). Аналогичным образом рассчитаны условные нормы продолжительности зимнего периода, когда среднесуточная температура воздуха устойчиво стоит ниже 0 °С. Расчеты и графические построения производились при помощи табличного редактора Microsoft Excel. В многолетнем ходе среднегодовых температур воздуха отмечаются статистически значимые тренды на повышение. Средние за 1984-2013 гг. значения годовой температуры воздуха по сравнению с предыдущим 30-летием повысились на 1,1-1,2 °С. Это повлекло за собой сдвиги сроков начала и окончания вегетационного и зимнего периодов. Условные нормы их продолжительности имеют разнонаправленные тренды. Средняя продолжительность вегетационного периода увеличилась на 4-6 дней, а средняя длительность зимнего периода сократилась на 4-8 суток. Условные нормы продолжительности вегетационного и зимнего периодов хорошо связаны со среднегодовой температурой воздуха. Получены формулы, по которым можно подсчитать нормы продолжительности этих периодов при различных сценариях повышения среднегодовой температуры воздуха в XXI веке.",Ушаков Михаил Вилорьевич Современные изменения термического режима в районе государственного природного заповедника «Магаданский» // Труды КарНЦ РАН. 2017. №4. URL: https://cyberleninka.ru/article/n/sovremennye-izmeneniya-termicheskogo-rezhima-v-rayone-gosudarstvennogo-prirodnogo-zapovednika-magadanskiy (дата обращения: 13.11.2024).,"Ушаков Михаил Вилорьевич (2017). Современные изменения термического режима в районе государственного природного заповедника «Магаданский». Труды Карельского научного центра Российской академии наук,  (4), 93-98.",https://cyberleninka.ru/article/n/sovremennye-izmeneniya-termicheskogo-rezhima-v-rayone-gosudarstvennogo-prirodnogo-zapovednika-magadanskiy
Состояние озонового слоя и погодные аномалии в Северном полушарии зимой 2016-2017 гг,Сывороткин Владимир Леонидович,Пространство и Время,2017,Науки о Земле и смежные экологические науки,"озоновый слой, аномалии озона, зима 2016-2017 гг, погодные аномалии, климатические изменения, глубинная дегазация, водород","ozone layer, anomalies of ozone, winter 2016-2017, weather anomalies, climate change, deep degassing, hydrogen","Зима 2016-2017 гг. в Северном полушарии подтвердила и усилила основные тенденции климатических изменений: усилилась контрастность погодных аномалий, сменяющих друг друга в пространстве и во времени, когда регион с аномально холодной погодой может соседствовать с аномально теплым регионом, а через некоторое время знаки соседних аномалий погоды могут поменяться. На территории России этой зимой местоположение и время появления контрастного чередования разнознаковых погодных аномалий убедительно совпало с аномалиями общего содержания озона. Причина тому аномальные концентрации озона над различными регионами, вызванные усилением водородной дегазации (отрицательные аномалии ОСО) и усилением геомагнитной активности (положительные аномалии ОСО).",Сывороткин Владимир Леонидович Состояние озонового слоя и погодные аномалии в Северном полушарии зимой 2016-2017 гг // Пространство и Время. 2017. №1 (27). URL: https://cyberleninka.ru/article/n/sostoyanie-ozonovogo-sloya-i-pogodnye-anomalii-v-severnom-polusharii-zimoy-2016-2017-gg (дата обращения: 13.11.2024).,"Сывороткин Владимир Леонидович (2017). Состояние озонового слоя и погодные аномалии в Северном полушарии зимой 2016-2017 гг. Пространство и Время,  (1 (27)), 214-224.",https://cyberleninka.ru/article/n/sostoyanie-ozonovogo-sloya-i-pogodnye-anomalii-v-severnom-polusharii-zimoy-2016-2017-gg
Экосистемы якутской Арктики в условиях современного природопользования и трансформации климата,Саввинов Григорий Николаевич,Вестник Северо-Восточного федерального университета им. М. К. Аммосова,2017,Науки о Земле и смежные экологические науки,"арктика, природные ресурсы, промышленное освоение, глобальные изменения климата, техногенное воздействие, экосистемы, научные исследования, комплексная экспедиция ран, экологический мониторинг, сохранение биоразнообразия, рациональное природопользование",,"Рассмотрена необходимость проведения комплексных эколого-климатических исследований в арктической зоне Якутии. Особую озабоченность специалистов вызывают современные глобальные климатические изменения, которые происходят быстрее и масштабнее на высоких широтах Земли. Прогнозы климатологов указывают и на дальнейшее так называемое полярное усиление глобального потепления на протяжении всего XXI века. С учетом всей совокупности природных и социально обусловленных факторов, определяющих современное состояние Якутского сектора Арктики, наиболее значимыми объектами научных исследований являются глобальные климатические вызовы в Арктике и экологические риски при хозяйственном освоении ее территорий. В статье приводятся материалы многолетних исследований НИИПЭС СВФУ в бассейне реки Анабар. Промышленная разработка россыпных месторождений алмазов в притоках реки Анабар оказывает существенное отрицательное воздействие на компоненты экосистем исследованного района. В первую очередь она выражается в образовании новых техногенно-преобразованных ландшафтов, площадь которых на данный момент составляет порядка 10 % территории бассейна среднего течения р. Анабар, полном уничтожении мест обитания ихтиофауны на участках отработки аллювиальных россыпей, донных биоценозов при отведении русла рек и загрязнении рек мелкодисперсными взвесями и т. д. В современных реалиях необходимы новый этап и новый уровень научно-исследовательского осмысления состояния арктических экосистем для обоснованного выстраивания стратегии устойчивого их развития. В связи с этим требуется хорошо скоординированная программа эколого-климатических и биологических исследований на всей территории арктической зоны Якутии в рамках Комплексной экспедиции РАН на период 2017-2020 гг. Основные задачи арктических комплексных экологических исследований заключаются в долгосрочном экологическом мониторинге климата и состояния экосистем с использованием современных средств наблюдений; оценке современного состояния природных комплексов и последствий для них изменений климата и интенсификации хозяйственного освоения; разработке мер по снижению негативных последствий техногенного воздействия для арктических экосистем.",Саввинов Григорий Николаевич Экосистемы якутской Арктики в условиях современного природопользования и трансформации климата // Вестник СВФУ. 2017. №1 (57). URL: https://cyberleninka.ru/article/n/ekosistemy-yakutskoy-arktiki-v-usloviyah-sovremennogo-prirodopolzovaniya-i-transformatsii-klimata (дата обращения: 13.11.2024).,"Саввинов Григорий Николаевич (2017). Экосистемы якутской Арктики в условиях современного природопользования и трансформации климата. Вестник Северо-Восточного федерального университета им. М. К. Аммосова,  (1 (57)), 35-43.",https://cyberleninka.ru/article/n/ekosistemy-yakutskoy-arktiki-v-usloviyah-sovremennogo-prirodopolzovaniya-i-transformatsii-klimata
Изменение основных метеорологических парамет-ров за 1994-2013 гг. В заповеднике «Курильский» (по данным метеостанции Южно-Курильска),"Грищенко М.Ю., Тихонова В.А.",Труды Мордовского государственного природного заповедника им. П. Г. Смидовича,2017,Науки о Земле и смежные экологические науки,"климатические изменения, изменения температуры воздуха, изменения количества атмосферных осадков, южные курилы, кунашир",,Проведен анализ изменения метеорологических параметров на территории заповедника «Курильский» за 1994-2013 гг. по данным государственной метеорологической станции в пос. Южно-Курильск (Сахалинская обл.). Выявлены незначительное повышение значений температуры воздуха во второй половине рассматриваемого периода; значительные амплитуды годового количества атмосферных осадков; небольшое перераспределение количества атмосферных осадков по сезонам.,"Грищенко М. Ю., Тихонова В. А. Изменение основных метеорологических парамет-ров за 1994-2013 гг. В заповеднике «Курильский» (по данным метеостанции Южно-Курильска) // Труды Мордовского государственного природного заповедника им. П. Г. Смидовича. 2017. №18. URL: https://cyberleninka.ru/article/n/izmenenie-osnovnyh-meteorologicheskih-paramet-rov-za-1994-2013-gg-v-zapovednike-kurilskiy-po-dannym-meteostantsii-yuzhno-kurilska (дата обращения: 13.11.2024).","Грищенко М.Ю., & Тихонова В.А. (2017). Изменение основных метеорологических парамет-ров за 1994-2013 гг. В заповеднике «Курильский» (по данным метеостанции Южно-Курильска). Труды Мордовского государственного природного заповедника им. П. Г. Смидовича,  (18), 76-80.",https://cyberleninka.ru/article/n/izmenenie-osnovnyh-meteorologicheskih-paramet-rov-za-1994-2013-gg-v-zapovednike-kurilskiy-po-dannym-meteostantsii-yuzhno-kurilska
Климат Западной Сибири в фазу замедления потепления (1986-2015 гг. ) и прогнозирование гидроклиматических ресурсов на 2021-2030 гг,"Паромов Владимир Валериянович, Земцов Валерий Алексеевич, Копысов Сергей Геннадьевич",Известия Томского политехнического университета. Инжиниринг георесурсов,2017,Науки о Земле и смежные экологические науки,"гидроклиматические ресурсы геосистем, водный баланс, западная сибирь, метод гидролого-климатических расчетов, температура воздуха, атмосферные осадки, анализ и прогнозирование временных рядов","hydro-climatic resources of geosystems, water balance, western siberia, method of hydrological and climatological computations, air temperature, atmospheric precipitation, time series analysis and forecasting","Актуальность. Наиболее очевидным проявлением климатических изменений в настоящее время является повышение приземной температуры воздуха. Региональные и локальные показатели изменения климата отличаются от глобальных. Происходит трансформация гидрологического цикла, водного баланса территории, стока рек, что, в свою очередь, сказывается на климатических процессах. Для предсказания реакции геосистем и их гидроклиматических ресурсов на климатические изменения необходимо иметь четкие представления о характере современных изменений климата и прогнозные оценки на ближайшие десятилетия с конкретной географической привязкой. Цель работы: 1) оценка климатических изменений на территории Западной Сибири на основе статистического анализа рядов месячных температур воздуха и атмосферных осадков по состоянию на 2015 г., 2) прогноз поля средних за период 2021-2030 гг. температур воздуха и осадков и 3) определение климатообусловленных изменений водного баланса территории и режима стока воды. Методы исследования. Анализ и прогнозирование пространственно-временной изменчивости наблюдаемой на метеостанциях региона приземной температуры воздуха и атмосферных осадков выполнены статистическими методами в пакете STATISTICA (регрессионный анализ, анализ трендов, кластер анализ для классификации объектов, экспоненциальное сглаживание и прогнозирование). Средние за базовый (1966-1985), современный (1986-2015) и прогнозный (2021-2030 гг.) периоды оценки составляющих водного баланса суши определены с месячным разрешением методом гидролого-климатических расчетов В.С. Мезенцева. Результаты. Показано, что современный 30-летний климатический период отличается от предыдущего более высоким энергетическим уровнем (температурами воздуха), но на этом фоне в некоторые месяцы наблюдаются не только восходящие, но и нисходящие тенденции температуры. Выполнен прогноз средних температур и осадков по 31 метеостанции на период 2021-2030 гг. за зиму и, по месяцам за теплый период года. Оценки за современный и прогнозный периоды позволили рассчитать средние показатели режима осадков, испарения, стока воды и влажности деятельного слоя почвы по данным метеостанций, расположенных в разных природных зонах Западно-Сибирской равнины. Прогнозируемый рост температуры и испарения не приводит к ожидаемому снижению стока даже в южных районах недостаточного увлажнения. В то же время влажность почвы в летний период, согласно расчетам, повсеместно снизится.","Паромов Владимир Валериянович, Земцов Валерий Алексеевич, Копысов Сергей Геннадьевич Климат Западной Сибири в фазу замедления потепления (1986-2015 гг. ) и прогнозирование гидроклиматических ресурсов на 2021-2030 гг // Известия ТПУ. 2017. №1. URL: https://cyberleninka.ru/article/n/klimat-zapadnoy-sibiri-v-fazu-zamedleniya-potepleniya-1986-2015-gg-i-prognozirovanie-gidroklimaticheskih-resursov-na-2021-2030-gg (дата обращения: 13.11.2024).","Паромов Владимир Валериянович, Земцов Валерий Алексеевич, & Копысов Сергей Геннадьевич (2017). Климат Западной Сибири в фазу замедления потепления (1986-2015 гг. ) и прогнозирование гидроклиматических ресурсов на 2021-2030 гг. Известия Томского политехнического университета. Инжиниринг георесурсов, 328 (1), 62-74.",https://cyberleninka.ru/article/n/klimat-zapadnoy-sibiri-v-fazu-zamedleniya-potepleniya-1986-2015-gg-i-prognozirovanie-gidroklimaticheskih-resursov-na-2021-2030-gg
