Title,Authors,Journal,Year,Field of Science,Russian Keywords,English Keywords,Annotation,GOST,APA,Link
Картографическое моделирование каскада водохранилищ в бассейне реки Селенги (Монголия). Предварительные результаты,"Леви Кирилл Георгиевич, Мирошниченко Андрей Иванович",Известия Иркутского государственного университета. Серия: Науки о Земле,2017,Науки о Земле и смежные экологические науки,"картографическое моделирование, водохранилище, озерные водоемы, морфометрия, погодно-климатические изменения, дендрохронология","cartographic modeling, reservoir, morphometry, weather and climate change, dendrochronology, lake","В 2011 г. были начаты общественные слушания по проблеме строительства ряда гидротехнических сооружений на территории Монголии, и в частности в бассейне р. Селенги. В эти дебаты включилась и международная общественность. Обсуждавшиеся материалы носили противоречивый характер, и, соответственно, обсуждения тоже носили противоречивый характер. В документах, приводимых в списке литературы, были заложены различные цифровые оценки размеров затапливаемых долин рек, объемы водохранилищ и т. п. Не были приведены координаты планируемых к строительству дамб и пр. У авторов возник неподдельный интерес к этим будущим инфраструктурным объектам, и потому была сделана попытка их моделирования на основе картографии. Ниже рассмотрены предварительные результаты картографического моделирования водохранилищ в бассейне р. Селенги (Монголия). Приводятся морфометрические характеристики рек и возможных будущих водохранилищ. Рассматриваются погодно-климатические изменения в районе озер Северной и Прихангайской Монголии и Российского Алтая. Выполнены качественные оценки возможного экологического ущерба с привлечением дополнительных материалов по сейсмичности региона, составу осадочных пород, выполняющих долины рек. Высказаны предостережения о возможных объемах экологического ущерба для территории Монголии.","Леви Кирилл Георгиевич, Мирошниченко Андрей Иванович Картографическое моделирование каскада водохранилищ в бассейне реки Селенги (Монголия). Предварительные результаты // Известия Иркутского государственного университета. Серия: Науки о Земле. 2017. №. URL: https://cyberleninka.ru/article/n/kartograficheskoe-modelirovanie-kaskada-vodohranilisch-v-basseyne-reki-selengi-mongoliya-predvaritelnye-rezultaty (дата обращения: 14.11.2024).","Леви Кирилл Георгиевич, & Мирошниченко Андрей Иванович (2017). Картографическое моделирование каскада водохранилищ в бассейне реки Селенги (Монголия). Предварительные результаты. Известия Иркутского государственного университета. Серия: Науки о Земле, 19 , 130-149.",https://cyberleninka.ru/article/n/kartograficheskoe-modelirovanie-kaskada-vodohranilisch-v-basseyne-reki-selengi-mongoliya-predvaritelnye-rezultaty
Пространственная организация геосистем территории Баргузинского биосферного заповедника,Кузавкова Зоя Олеговна,Известия Иркутского государственного университета. Серия: Науки о Земле,2017,Науки о Земле и смежные экологические науки,"геосистема, пространственная организация, баргузинский биосферный заповедник","spatial organization, barguzin biosphere reserve, geosystems","Исследование пространственной организации геосистем является наиболее перспективной проблемой в изучении геодинамически активных территорий, к которым относится Баргузинский биосферный заповедник. Территория заповедника отличается труднодоступностью, в связи с этим актуальной задачей является выявление пространственной организации геосистем. Важно знать, как заполнялось пространство, какие взаимосвязи существуют между компонентами геосистем и каковы направления их дальнейшего развития, с целью планирования природоохранной деятельности. В статье рассмотрены основные представления о пространственной организации вообще и, в частности, о пространственной организации геосистем Баргузинского биосферного заповедника с учетом их исторического формирования и неотектонического этапа развития. В пределах заповедника отмечается высокое разнообразие эндемиков, реликтов и редких видов растений, развиты наиболее древние геологические породы, которые относятся к раннему протерозою. Приведена таблица палеореконструкций территории на протяжении позднего кайнозоя, в которой отражены особенности тектонической обстановки, климатические изменения, а также соответствующий растительный покров рассматриваемого периода. Палеогеографический анализ с учетом современной пространственной организации заповедника позволил выделить реликтовые, эндемичные виды, входящие в структуру растительного покрова, а также их приуроченность к определенным породам, тектоническим разломам, которые имеют высокий прогрев эндогенным теплом. Подобная неотектоническая активность отмечается в местах разрывных нарушений, где наблюдаются выходы термальных источников с температурой воды от +40 до +80 °С. Здесь активнее проявляется эндемизм, приуроченность к этим выходам реликтовых форм и редких видов травяно-кустарникового покрова. Данная информация позволяет выявить наиболее устойчивые и подверженные воздействию геосистемы.",Кузавкова Зоя Олеговна Пространственная организация геосистем территории Баргузинского биосферного заповедника // Известия Иркутского государственного университета. Серия: Науки о Земле. 2017. №. URL: https://cyberleninka.ru/article/n/prostranstvennaya-organizatsiya-geosistem-territorii-barguzinskogo-biosfernogo-zapovednika (дата обращения: 14.11.2024).,"Кузавкова Зоя Олеговна (2017). Пространственная организация геосистем территории Баргузинского биосферного заповедника. Известия Иркутского государственного университета. Серия: Науки о Земле, 22 , 61-70.",https://cyberleninka.ru/article/n/prostranstvennaya-organizatsiya-geosistem-territorii-barguzinskogo-biosfernogo-zapovednika
Влияние климатических изменений на транспортную инфраструктуру в Арктической зоне и на территориях распространения вечной мерзлоты,Воронцова С.Д.,"Транспорт Российской Федерации. Журнал о науке, практике, экономике",2017,Науки о Земле и смежные экологические науки,"климат, вечная мерзлота, арктика, транспортная инфраструктура, безопасность","climate, permafrost, arctic, transport infrastructure, safety","Дан аналитический обзор существующих методов оценки рисков для объектов транспортной инфраструктуры от опасных климатических изменений в Арктической зоне и на территориях распространения многолетней (вечной) мерзлоты. Сформулированы результаты анализа эффективности и достаточности технических и инженерных решений, направленных на обеспечение безопасности исследуемых объектов транспортной инфраструктуры в прогнозируемых условиях.","Воронцова С. Д. Влияние климатических изменений на транспортную инфраструктуру в Арктической зоне и на территориях распространения вечной мерзлоты // Транспорт Российской Федерации. Журнал о науке, практике, экономике. 2017. №4 (71). URL: https://cyberleninka.ru/article/n/vliyanie-klimaticheskih-izmeneniy-na-transportnuyu-infrastrukturu-v-arkticheskoy-zone-i-na-territoriyah-rasprostraneniya-vechnoy (дата обращения: 14.11.2024).","Воронцова С.Д. (2017). Влияние климатических изменений на транспортную инфраструктуру в Арктической зоне и на территориях распространения вечной мерзлоты. Транспорт Российской Федерации. Журнал о науке, практике, экономике,  (4 (71)), 33-39.",https://cyberleninka.ru/article/n/vliyanie-klimaticheskih-izmeneniy-na-transportnuyu-infrastrukturu-v-arkticheskoy-zone-i-na-territoriyah-rasprostraneniya-vechnoy
"Из истории науки комплексного мониторинга в РФ: методы и принципы, подходы в организации",Янова М.В.,Вестник Института комплексных исследований аридных территорий,2017,Науки о Земле и смежные экологические науки,"космические исследования, загрязнение ресурсов, околоземное пространство, изучение планеты, космический летательный аппарат, полеты, космические съемки, оптико-электронные космические съемочные системы",,"В статье приводятся некоторые результаты анализа атмосферных волновых структур в тропической и субтропической атмосфере, показывая роль и значение проблемы климатических изменений, результаты анализа длительных временных рядов наблюдений за основными геофизическими параметрами.","Янова М. В. Из истории науки комплексного мониторинга в РФ: методы и принципы, подходы в организации // Вестник ИКИАТ. 2017. №2 (35). URL: https://cyberleninka.ru/article/n/iz-istorii-nauki-kompleksnogo-monitoringa-v-rf-metody-i-printsipy-podhody-v-organizatsii (дата обращения: 14.11.2024).","Янова М.В. (2017). Из истории науки комплексного мониторинга в РФ: методы и принципы, подходы в организации. Вестник Института комплексных исследований аридных территорий, 2 (2 (35)), 28-41.",https://cyberleninka.ru/article/n/iz-istorii-nauki-kompleksnogo-monitoringa-v-rf-metody-i-printsipy-podhody-v-organizatsii
Перспективы развития газовой промышленности в связи с изменением климата Земли,Федоров В.М.,Газовая промышленность,2017,Науки о Земле и смежные экологические науки,"изменение климата, температурный режим, инсоляция, наклон оси вращения, межширотныи теплообмен, регрессионная модель, прогноз, природный газ, условия добычи и транспортировки, спрос на углеводородное топливо","climate change, temperature regime, insolation, inclination of the rotation axis, inter-latitude heat exchange, regression model, forecast, natural gas, transportation and recovery conditions, demand for hydrocarbon fuel","В статье анализируются перспективы развития газовой промышленности в связи с последствиями глобальных климатических изменений. На основе расчетов инсоляции планеты показано, что изменение глобального климата Земли определяется естественными причинами, основной из которых является уменьшение угла наклона оси вращения, отсюда усиление межширотного теплообмена - усиление работы «тепловой машины первого рода» (по В.В. Шулейкину). Изменение наклона оси вращения определяется двумя основными причинами: прецессией (с периодом около 25,7 тыс. лет) и нутацией (с периодом около 19 лет). На тренд в изменении глобальной температуры, определяемый прецессией, и 19-летние вариации, связанные с нутацией, накладывается генерируемое в системе «океан - атмосфера» автоколебание (с периодом в среднем около 60 лет). На основе регрессионной модели выполнены прогнозы изменения глобальной приповерхностной температуры воздуха и температуры поверхности океана до 2050 г. Из прогноза следует, что глобальная температура в период с 2017 по 2050 г. в Северном полушарии будет выше нормы, определенной для периода 1961-1990 гг. Даже в минимумах (2024 и 2043 гг.) предстоящего периода температура будет превышать среднюю температуру для периода 1961-1990 гг. Однако вблизи этих минимумов температура будет уступать норме предшествующего периода 1992-2016 гг. Без учета других, за исключением климатических, факторов предполагается, что при понижении глобальной температуры в периоды приблизительно с 2020 до 2027 г. и с 2040 до 2045 г. мировой спрос на углеводородное топливо будет расти, а в периоды повышения глобальной температуры - снижаться. Соответственно, будут меняться и условия добычи и транспортировки природного газа, также определяющие его стоимость.",Федоров В. М. Перспективы развития газовой промышленности в связи с изменением климата Земли // Газовая промышленность. 2017. №8 (756). URL: https://cyberleninka.ru/article/n/perspektivy-razvitiya-gazovoy-promyshlennosti-v-svyazi-s-izmeneniem-klimata-zemli (дата обращения: 14.11.2024).,"Федоров В.М. (2017). Перспективы развития газовой промышленности в связи с изменением климата Земли. Газовая промышленность,  (8 (756)), 108-114.",https://cyberleninka.ru/article/n/perspektivy-razvitiya-gazovoy-promyshlennosti-v-svyazi-s-izmeneniem-klimata-zemli
Прогноз наледных явлений на малых реках и ручьях в межгорных котловинах хребта Цаган-Дабан,"Черных Владимир Николаевич, Спиридонов Егор Вячеславович, Мансурова Оксана Зуфаровна, Константинова Елена Александровна",Вестник Бурятского государственного университета. Биология. География,2017,Науки о Земле и смежные экологические науки,"наледи, экосистемы, осадки, температура воздуха, подземные воды, космические снимки","ice, ecosystems, precipitation, air temperature, groundwater, space images",В статье рассматриваются возможности прогнозирования интенсивности развития наледей на малых реках в межгорных котловинах хребта Цаган-Дабан на основе определения зависимости их морфометрических характеристик от основных гидротермических факторов. Проводится ретроспективный анализ развития наледей в пределах рассматриваемой территории за последние 20 лет с выявлением направленности климатических изменений.,"Черных Владимир Николаевич, Спиридонов Егор Вячеславович, Мансурова Оксана Зуфаровна, Константинова Елена Александровна Прогноз наледных явлений на малых реках и ручьях в межгорных котловинах хребта Цаган-Дабан // Вестник Бурятского государственного университета. Биология. География. 2017. №4. URL: https://cyberleninka.ru/article/n/prognoz-nalednyh-yavleniy-na-malyh-rekah-i-ruchyah-v-mezhgornyh-kotlovinah-hrebta-tsagan-daban (дата обращения: 14.11.2024).","Черных Владимир Николаевич, Спиридонов Егор Вячеславович, Мансурова Оксана Зуфаровна, & Константинова Елена Александровна (2017). Прогноз наледных явлений на малых реках и ручьях в межгорных котловинах хребта Цаган-Дабан. Вестник Бурятского государственного университета. Биология. География,  (4), 133-137.",https://cyberleninka.ru/article/n/prognoz-nalednyh-yavleniy-na-malyh-rekah-i-ruchyah-v-mezhgornyh-kotlovinah-hrebta-tsagan-daban
