Title,Authors,Journal,Year,Field of Science,Russian Keywords,English Keywords,Annotation,GOST,APA,Link
"Эколого-физиологические аспекты адаптации иностранных студентов, прибывших для обучения в Россию (на примере Волгоградского региона)","Севрюкова Галина Александровна, Картушина Юлия Николаевна, Бочарова Инна Анатольевна",Природные системы и ресурсы,2015,Науки о Земле и смежные экологические науки,"адаптация, здоровье, студенты, климат, волгоградский регион, холодовая проба","adaptation, health, foreign students, climate, volgograd region, cold test","В статье рассматривается специфика адаптации студентов из теплых стран к климатическим условиям Волгоградского региона. Авторами дана климатическая характеристика Волгоградского региона. Характер погоды в зимний период определяют циклоны, которые вызывают снегопады, метели, сильные ветры до 1318 м/с, понижение температуры (до -28 °С). В работе представлены результаты оценки средней температуры тела, параметров физического развития, данные холодовой пробы. Изменения средней температуры тела после зимнего периода свидетельствуют о развивающемся процессе адаптации организма иностранных студентов. В то же время выявленные отрицательные реакции на холодовую пробу с большей степенью проявления у студентов из Туркменистана свидетельствуют о наличии неблагоприятных реакций и трудностях становления процессов адаптации.","Севрюкова Галина Александровна, Картушина Юлия Николаевна, Бочарова Инна Анатольевна Эколого-физиологические аспекты адаптации иностранных студентов, прибывших для обучения в Россию (на примере Волгоградского региона) // Природные системы и ресурсы. 2015. №4 (14). URL: https://cyberleninka.ru/article/n/ekologo-fiziologicheskie-aspekty-adaptatsii-inostrannyh-studentov-pribyvshih-dlya-obucheniya-v-rossiyu-na-primere-volgogradskogo (дата обращения: 14.11.2024).","Севрюкова Галина Александровна, Картушина Юлия Николаевна, & Бочарова Инна Анатольевна (2015). Эколого-физиологические аспекты адаптации иностранных студентов, прибывших для обучения в Россию (на примере Волгоградского региона). Природные системы и ресурсы,  (4 (14)), 15-21.",https://cyberleninka.ru/article/n/ekologo-fiziologicheskie-aspekty-adaptatsii-inostrannyh-studentov-pribyvshih-dlya-obucheniya-v-rossiyu-na-primere-volgogradskogo
Биоклиматическая хронология голоцена: реконструкция и прогноз,"Поморцев Олег Александрович, Кашкаров Евгений Петрович, Ловелиус Николай Владимирович",Вестник Северо-Восточного федерального университета им. М. К. Аммосова,2015,Науки о Земле и смежные экологические науки,"голоцен, климат, реконструкция, ритмы, прогноз, хронология, шкала фергюсона, малая ледниковая эпоха, уровень каспия, сибирский антициклон",,"В палеогеографии нет более надёжной основы для климатических реконструкций и долгосрочного прогноза изменений климата, чем дендрохронологическая шкала Фергюсона. Она получена в экстремально аридных условиях Большого Бассейна (Северная Америка) на верхней границе леса и представляет самую точную и продолжительную биологическую запись изменений климата голоцена: 7104 г. Суть её объективное отражение глобального ритма в 2600 лет, который устойчиво повторяется на протяжении всего 7-тысячелетнего периода. Ключ к расшифровке климата и разработке прогноза инструментальные метеонаблюдения последних 300 лет. Они охватывают современное потепление и Малую ледниковую эпоху (МЛЭ) и позволяют сделать инструментальную калибровку 2600-летнего ритма. Начало его устойчиво совпадает с волнами наиболее тёпло-сухого (ТС) климата Земли, а окончание наиболее холодного и сухого (ХС). В средней части климат меняется от тёпло-влажного (ТВ) до холодно-влажного (ХВ) и то приносит обширные наводнения, то активизирует движение ледников. В настоящее время мы вошли в период наиболее неустойчивого климата Земли, характеризующегося продолжающимся потеплением и преобладанием циклональной деятельности с тайфунами и наводнениями. Этот период продлится около 800 лет. Особо опасные катастрофы охватят Европу, Северную, Центральную и Южную Америку (северную половину), тихоокеанскую часть Азии. Ритмические аналоги периодов крупных наводнений датированы по шкале Фергюсона в трёх «точках»: 3000-2700 гг. до н. э. (конец климатического оптимума голоцена), в течение 1000 лет до рубежа н. э., 1500-1800 гг. н. э. накануне максимума похолодания в МЛЭ. Среднегодовая температура воздуха Северного полушария изменялась в это время от 13,6 до 16,8 °С. Общая амплитуда температур за 7 тыс. лет составила 3,2 °С при 13,6 в самый ХС (200-500 гг. н. э.) и 16,8 °С в самый ТВ (4500-4300 лет до н. э.) периоды.","Поморцев Олег Александрович, Кашкаров Евгений Петрович, Ловелиус Николай Владимирович Биоклиматическая хронология голоцена: реконструкция и прогноз // Вестник СВФУ. 2015. №3 (47). URL: https://cyberleninka.ru/article/n/bioklimaticheskaya-hronologiya-golotsena-rekonstruktsiya-i-prognoz (дата обращения: 14.11.2024).","Поморцев Олег Александрович, Кашкаров Евгений Петрович, & Ловелиус Николай Владимирович (2015). Биоклиматическая хронология голоцена: реконструкция и прогноз. Вестник Северо-Восточного федерального университета им. М. К. Аммосова,  (3 (47)), 100-115.",https://cyberleninka.ru/article/n/bioklimaticheskaya-hronologiya-golotsena-rekonstruktsiya-i-prognoz
Ветровой морфолитогенез и климатические ритмы Юго-Западного Забайкалья в финале неоплейстоцена и голоцене,"Будаев Ринчин Цыбикжапович, Коломиец Владимир Леонидович",Известия Самарского научного центра Российской академии наук,2015,Науки о Земле и смежные экологические науки,"юго-западное забайкалье, эоловый рельеф, палеогеографические реконструкции, климатические изменения, погребенные почвы, финал неоплейстоцена, голоцен","south-western transbaikalye, aeolian relief, paleogeographic reconstructions, climatic changes, buried soils, final of neopleistocene, holocene","Изучен комплекс субаэральных образований Юго-Западного Забайкалья. Установлено широкое развитие эоловых процессов на разновозрастных речных и озерно-речных террасах. Получены радиоуглеродные даты из погребенных почв, указывающие на неоднократную смену климатических условий в голоцене. Самозарастание оголенных песков в результате снижения антропогенной нагрузки на рубеже столетий свидетельствует о стабильности климатических условий в регионе на протяжении последних 200-250 лет.","Будаев Ринчин Цыбикжапович, Коломиец Владимир Леонидович Ветровой морфолитогенез и климатические ритмы Юго-Западного Забайкалья в финале неоплейстоцена и голоцене // Известия Самарского научного центра РАН. 2015. №6-1. URL: https://cyberleninka.ru/article/n/vetrovoy-morfolitogenez-i-klimaticheskie-ritmy-yugo-zapadnogo-zabaykalya-v-finale-neopleystotsena-i-golotsene (дата обращения: 14.11.2024).","Будаев Ринчин Цыбикжапович, & Коломиец Владимир Леонидович (2015). Ветровой морфолитогенез и климатические ритмы Юго-Западного Забайкалья в финале неоплейстоцена и голоцене. Известия Самарского научного центра Российской академии наук, 17 (6-1), 174-179.",https://cyberleninka.ru/article/n/vetrovoy-morfolitogenez-i-klimaticheskie-ritmy-yugo-zapadnogo-zabaykalya-v-finale-neopleystotsena-i-golotsene
Реологические характеристики слитоземных комплексов почв в разных климатических условиях,"Жукова Юлия Александровна, Хайдапова Долгор Доржиевна, Ковда Ирина Викторовна, Моргун Евгений Георгиевич",Вестник Московского университета. Серия 17. Почвоведение,2015,Науки о Земле и смежные экологические науки,"вертисоли, гильгай, иллитизация, реология, структурные связи, вязкоупругое поведение почв","gilgai, rheology, structural bonds, viscoelastic behaviour of soils, vertisols, illitization","В работе представлены результаты экспериментального исследования реологических параметров структурной организации почвенных частиц слитоземных комплексов, сформированных в условиях умеренного и субтропического климата. Определение проведено методом амплитудной развертки на модульном реометре MCR-302 (Anton-Paar, Ausrtia). Отмечена отчетливая дифференциация почв по реологическим свойствам. Почвенный материал средней части толщи комплекса умеренного климата более «лабильный» по реологическим показателям, т.е. более податлив к изменениям внешних нагрузок. Для почвообразующих пород явных различий не обнаружено.","Жукова Юлия Александровна, Хайдапова Долгор Доржиевна, Ковда Ирина Викторовна, Моргун Евгений Георгиевич Реологические характеристики слитоземных комплексов почв в разных климатических условиях // Вестник Московского университета. Серия 17. Почвоведение. 2015. №3. URL: https://cyberleninka.ru/article/n/reologicheskie-harakteristiki-slitozemnyh-kompleksov-pochv-v-raznyh-klimaticheskih-usloviyah (дата обращения: 14.11.2024).","Жукова Юлия Александровна, Хайдапова Долгор Доржиевна, Ковда Ирина Викторовна, & Моргун Евгений Георгиевич (2015). Реологические характеристики слитоземных комплексов почв в разных климатических условиях. Вестник Московского университета. Серия 17. Почвоведение,  (3), 25-30.",https://cyberleninka.ru/article/n/reologicheskie-harakteristiki-slitozemnyh-kompleksov-pochv-v-raznyh-klimaticheskih-usloviyah
Изменения ландшафтно-климатических условий в Терско-Кумской низменности в плейстоцене,"Болиховская Н.С., Маркова А.К., Фаустов С.С.",Вестник Московского университета. Серия 5. География,2015,Науки о Земле и смежные экологические науки,"палеоландшафты, палеоклимат, плейстоцен, палинологический, палеомагнитный и микротериологический анализы, восточное предкавказье, опорный разрез отказное","paleoclimate, pleistocene, palynological, paleomagnetic and microteriologic analyses, eastern cis-caucasus, the otkaznoye reference sequence, paleoenvironments","Статья посвящена палеогеографии и стратиграфии плейстоцена одного из самых аридных районов России Терско-Кумской низменности, расположенной на северо-западе Прикаспийской низменности (или в Восточном Предкавказье). Впервые комплексно рассмотрены результаты детального палинологического, палеомагнитного и микротериологического изучения уникального по своей стратиграфической полноте и мощности (~160 м) опорного разреза плейстоценовых отложений Отказное (в долине средней Кумы), сложенного лёссово-почвенными, аллювиальными и пролювиально-аллювиальными толщами. Выполнено его дробное климатостратиграфическое расчленение и корреляция реконструированных палеоклиматических этапов с морскими изотопными стадиями (МИС). Охарактеризованы ландшафтно-климатические изменения и последовательные смены растительных формаций, происходившие на территории Терско-Кумской низменности в течение всех межледниковых и ледниковых эпох среднего и позднего плейстоцена (т.е. неоплейстоцена) и ряда этапов раннего плейстоцена. Представленные в статье материалы детального палинологического изучения одного из самых мощных лёссово-почвенных разрезов Северной Евразии разреза Отказное и выполненные реконструкции ландшафтно-климатических условий плейстоценового почвообразования и лёссонакопления, а также климатостратиграфические построения не имеют аналогов в зарубежной научной литературе, посвященной проблемам палеогеографии и стратиграфии лёссово-почвенных толщ Северной и Южной Америки, Центральной Азии, Западной и Центральной Европы.","Болиховская Н. С., Маркова А. К., Фаустов С. С. Изменения ландшафтно-климатических условий в Терско-Кумской низменности в плейстоцене // Вестник Московского университета. Серия 5. География. 2015. №1. URL: https://cyberleninka.ru/article/n/izmeneniya-landshaftno-klimaticheskih-usloviy-v-tersko-kumskoy-nizmennosti-v-pleystotsene (дата обращения: 14.11.2024).","Болиховская Н.С., Маркова А.К., & Фаустов С.С. (2015). Изменения ландшафтно-климатических условий в Терско-Кумской низменности в плейстоцене. Вестник Московского университета. Серия 5. География,  (1), 55-70.",https://cyberleninka.ru/article/n/izmeneniya-landshaftno-klimaticheskih-usloviy-v-tersko-kumskoy-nizmennosti-v-pleystotsene
Температурный режим в основаниях дорог в вечной мерзлоте,Исаков В.А.,Вестник Московского университета. Серия 5. География,2015,Науки о Земле и смежные экологические науки,"криолитозона, дорожная насыпь, моделирование, региональная изменчивость","road embankment, modeling, regional variability, permafrost zone","Рассмотрены направленность и основные причины изменения температурного режима в основаниях дорожных насыпей в криолитозоне. В программе WARM выполнено моделирование температурного поля в основании дорожных насыпей для 11 пунктов криолитозоны с учетом их климатических и геокриологических особенностей. По результатам моделирования выделено 4 основных типа многолетнего квазистационарного состояния температурного поля в основаниях дорог: устойчивый, переходный низкотемпературный, переходный высокотемпературный и неустойчивый. Рассмотрены основные причины их формирования: дополнительный разогрев искусственно созданных поверхностей, перераспределение снега и особенности морфологии дорожной насыпи, препятствующие равномерному промерзанию мерзлых грунтов в ее основании. Сделан вывод о влиянии характерных неравномерностей температурного поля на сезонную и многолетнюю динамику геокриологических условий в природно-технической системе земляного полотна. На основании литературных источников и полевых наблюдений проведена апробация результатов моделирования, показавшая их высокую сходимость с результатами натурных наблюдений. Отмечено, что в регионах, где по результатам расчета отмечается устойчивый и переходный низкотемпературный тип квазистационарного температурного поля, также наблюдаются деформации дорожных насыпей, вызванные динамическими нагрузками либо активизацией опасных криогенных процессов.",Исаков В. А. Температурный режим в основаниях дорог в вечной мерзлоте // Вестник Московского университета. Серия 5. География. 2015. №3. URL: https://cyberleninka.ru/article/n/temperaturnyy-rezhim-v-osnovaniyah-dorog-v-vechnoy-merzlote (дата обращения: 14.11.2024).,"Исаков В.А. (2015). Температурный режим в основаниях дорог в вечной мерзлоте. Вестник Московского университета. Серия 5. География,  (3), 25-34.",https://cyberleninka.ru/article/n/temperaturnyy-rezhim-v-osnovaniyah-dorog-v-vechnoy-merzlote
