Title,Authors,Journal,Year,Field of Science,Russian Keywords,English Keywords,Annotation,GOST,APA,Link
Водные ресурсы и гидротермические условия увлажнения бассейна Нижней Волги,Шумова Н.А.,Аридные экосистемы,2015,Науки о Земле и смежные экологические науки,"нижняя волга, сток, осадки, испаряемость, коэффициент увлажнения, гидротермический коэффициент, изменение климата","lower volga, runoff, precipitation, hydrothermal coefficient, moistening coefficient, climate change, potential evapotranspiration","Приводится описание гидрографической сети бассейна Нижней Волги. Показана межгодовая изменчивость стока Волги в створе у Волгограда; выделен экологически значимый коридор отклонений годовых величин стока от среднего многолетнего значения. Оценены ресурсы тепла (испаряемость) и естественного увлажнения (осадки) бассейна Нижней Волги в современных климатических условиях. Представлены суммы среднесуточных положительных температур воздуха и годовые суммы осадков, а также значения коэффициента увлажнения и гидротермического коэффициента в современных климатических условиях и их ожидаемые значения по различным сценариям изменения климата.",Шумова Н. А. Водные ресурсы и гидротермические условия увлажнения бассейна Нижней Волги // Аридные экосистемы. 2015. №2 (63). URL: https://cyberleninka.ru/article/n/vodnye-resursy-i-gidrotermicheskie-usloviya-uvlazhneniya-basseyna-nizhney-volgi (дата обращения: 14.11.2024).,"Шумова Н.А. (2015). Водные ресурсы и гидротермические условия увлажнения бассейна Нижней Волги. Аридные экосистемы, 21 (2 (63)), 16-26.",https://cyberleninka.ru/article/n/vodnye-resursy-i-gidrotermicheskie-usloviya-uvlazhneniya-basseyna-nizhney-volgi
Влияние изменения климата на эрозионные процессы в Республике Башкортостан,"Соболь Н.В., Габбасова И.М., Комиссаров М.А.",Аридные экосистемы,2015,Науки о Земле и смежные экологические науки,"климат, температура воздуха, осадки, водная эрозия, дефляция",,"Проанализированы данные климатических характеристик по основным метеостанциям Республики Башкортостан за периоды 1881-1980 и 2005-2014 гг. Показано, что на территории Республики произошло повышение среднемесячных и среднегодовых температур воздуха, причем потепление наиболее существенно в летне-осенний период. Снизилось число средних годовых сумм осадков, а также изменилось их соотношение: их доля в зимне-весенний период года стала выше, чем в летний. Изменение климата способствует общему снижению интенсивности водно-эрозионных процессов и усилению дефляции на не защищенных растительностью участках в южной лесостепи и горно-лесном поясе.","Соболь Н. В., Габбасова И. М., Комиссаров М. А. Влияние изменения климата на эрозионные процессы в Республике Башкортостан // Аридные экосистемы. 2015. №4 (65). URL: https://cyberleninka.ru/article/n/vliyanie-izmeneniya-klimata-na-erozionnye-protsessy-v-respublike-bashkortostan (дата обращения: 14.11.2024).","Соболь Н.В., Габбасова И.М., & Комиссаров М.А. (2015). Влияние изменения климата на эрозионные процессы в Республике Башкортостан. Аридные экосистемы, 21 (4 (65)), 22-28.",https://cyberleninka.ru/article/n/vliyanie-izmeneniya-klimata-na-erozionnye-protsessy-v-respublike-bashkortostan
Динамические изменения наземных экосистем поймы и дельты Нижней Волги под влиянием зарегулирования речного стока и климатических флуктуаций,"Кузьмина Ж.В., Трешкин С.Е., Каримова Т.Ю.",Аридные экосистемы,2015,Науки о Земле и смежные экологические науки,"уровень грунтовых вод, минерализация грунтовых вод, засоление и оглеение почв, пойменные экосистемы, динамика растительности",,"Основные причины ухудшения состояния пойменных и дельтовых экосистем Нижней Волги это региональное гидротехническое воздействие на пойму и дельту реки, а также климатические изменения в регионе. Для предотвращения полной гибели наземных экосистем поймы и дельты в современных условиях нестабильного климата необходимо изменение условий зарегулирования в нижнем бьефе Волгоградского водохранилища.","Кузьмина Ж. В., Трешкин С. Е., Каримова Т. Ю. Динамические изменения наземных экосистем поймы и дельты Нижней Волги под влиянием зарегулирования речного стока и климатических флуктуаций // Аридные экосистемы. 2015. №4 (65). URL: https://cyberleninka.ru/article/n/dinamicheskie-izmeneniya-nazemnyh-ekosistem-poymy-i-delty-nizhney-volgi-pod-vliyaniem-zaregulirovaniya-rechnogo-stoka-i-klimaticheskih (дата обращения: 14.11.2024).","Кузьмина Ж.В., Трешкин С.Е., & Каримова Т.Ю. (2015). Динамические изменения наземных экосистем поймы и дельты Нижней Волги под влиянием зарегулирования речного стока и климатических флуктуаций. Аридные экосистемы, 21 (4 (65)), 39-53.",https://cyberleninka.ru/article/n/dinamicheskie-izmeneniya-nazemnyh-ekosistem-poymy-i-delty-nizhney-volgi-pod-vliyaniem-zaregulirovaniya-rechnogo-stoka-i-klimaticheskih
ИЗМЕНЕНИЕ СОСТАВА НЕФТЯНОГО ЗАГРЯЗНЕНИЯ ПОД ВОЗДЕЙСТВИЕМ ПРИРОДНО-КЛИМАТИЧЕСКИХ ФАКТОРОВ,Гузняева Марина Юрьевна,"Северный регион: наука, образование, культура",2015,Науки о Земле и смежные экологические науки,"состав нефти, оil composition, нефтяное загрязнение, выветривание, деградация","petroleum pollution, weathering, degradation","Представлены результаты исследований процессов изменения состава нефти под воздействием природных факторов и при модельной деградации в лабораторных условиях. Хроматографическими методами исследован компонентный состав и определены количественные содержания нефтяных примесей в компонентах окружающей среды на территории Западной Сибири (природные воды, донные осадки, почвы нефтегазодобывающих районов ХМАО - Югры).","Гузняева Марина Юрьевна ИЗМЕНЕНИЕ СОСТАВА НЕФТЯНОГО ЗАГРЯЗНЕНИЯ ПОД ВОЗДЕЙСТВИЕМ ПРИРОДНО-КЛИМАТИЧЕСКИХ ФАКТОРОВ // Северный регион: наука, образование, культура. 2015. №2 (32). URL: https://cyberleninka.ru/article/n/izmenenie-sostava-neftyanogo-zagryazneniya-pod-vozdeystviem-prirodno-klimaticheskih-faktorov (дата обращения: 14.11.2024).","Гузняева Марина Юрьевна (2015). ИЗМЕНЕНИЕ СОСТАВА НЕФТЯНОГО ЗАГРЯЗНЕНИЯ ПОД ВОЗДЕЙСТВИЕМ ПРИРОДНО-КЛИМАТИЧЕСКИХ ФАКТОРОВ. Северный регион: наука, образование, культура, 2 (2 (32)), 130-135.",https://cyberleninka.ru/article/n/izmenenie-sostava-neftyanogo-zagryazneniya-pod-vozdeystviem-prirodno-klimaticheskih-faktorov
"О влиянии потоков углеводородов в системе лито-, гидро-, атмосфера на состояние современного климата","Лифшиц Сара Хаимовна, Спектор Владимир Борисович, Кершенгольц Борис Моисеевич, Спектор Валентин Владимирович",Природные ресурсы Арктики и Субарктики ,2015,Науки о Земле и смежные экологические науки,"разложение арктических метангидратов, биосферные катастрофы, планетарная климатическая система","decomposition of arctic methane hydrates, biospheric catastrophes, planetary climatic system","В последние 200 лет, наряду с увеличением концентрации СО 2, беспрецедентно растет содержание СН 4 в атмосфере, обусловленное антропогеном. По принципу положительных обратных связей увеличение концентрации парниковых газов в атмосфере может привести к потеплению, достаточному для разложения природных метановых гидратов, особенно тех, которые находятся в арктических морях и тундровой зоне в метастабильном состоянии. Вместе с тем известно, что в истории Земли выбросы СН 4 в атмосферу в связи с массовым разложением метановых гидратов приводили к климатически обусловленным биосферным катастрофам это мезозойские и кайнозойские катастрофические потепления. Планетарная климатическая система в настоящее время находится в состоянии детерминистического хаоса. В этом состоянии даже относительно небольшие вклады в парниковый эффект могут вызвать значительные изменения в её функционировании, вследствие чего повышается ответственность человечества за выбор климатической системой дальнейшей траектории ее развития.I","Лифшиц Сара Хаимовна, Спектор Владимир Борисович, Кершенгольц Борис Моисеевич, Спектор Валентин Владимирович О влиянии потоков углеводородов в системе лито-, гидро-, атмосфера на состояние современного климата // Природные ресурсы Арктики и Субарктики . 2015. №3 (79). URL: https://cyberleninka.ru/article/n/o-vliyanii-potokov-uglevodorodov-v-sisteme-lito-gidro-atmosfera-na-sostoyanie-sovremennogo-klimata (дата обращения: 14.11.2024).","Лифшиц Сара Хаимовна, Спектор Владимир Борисович, Кершенгольц Борис Моисеевич, & Спектор Валентин Владимирович (2015). О влиянии потоков углеводородов в системе лито-, гидро-, атмосфера на состояние современного климата. Природные ресурсы Арктики и Субарктики ,  (3 (79)), 5-10.",https://cyberleninka.ru/article/n/o-vliyanii-potokov-uglevodorodov-v-sisteme-lito-gidro-atmosfera-na-sostoyanie-sovremennogo-klimata
Современный почвообразующий потенциал климата Крымского полуострова2,Ергина Е.И.,Геополитика и экогеодинамика регионов,2015,Науки о Земле и смежные экологические науки,"климатические факторы, энергетические затраты на почвообразование","climatic factors, energy costs on soilformation, recent","Предложено оценивать климатический потенциал почвообразующих факторов на основе расчета энергетических затрат на почвообразование. Рассмотрены особенности динамики основных метеоэлементов Крымского полуострова, определены основные тенденции изменения тепловлагообеспеченности, и их влияние на энергетические затраты на почвообразование, определяющие особенности формирования рецентных почв в современных условиях. Энергетические затраты на почвообразование в последнее время имеют тенденцию к увеличению, но установлено, что в условиях современных внутривековых изменений возможности климатической системы не достаточны для кардинальных изменений почв в пределах видов и родов.",Ергина Е. И. Современный почвообразующий потенциал климата Крымского полуострова2 // Геополитика и экогеодинамика регионов. 2015. №2. URL: https://cyberleninka.ru/article/n/sovremennyy-pochvoobrazuyuschiy-potentsial-klimata-krymskogo-poluostrova2 (дата обращения: 14.11.2024).,"Ергина Е.И. (2015). Современный почвообразующий потенциал климата Крымского полуострова2. Геополитика и экогеодинамика регионов, 1 (11) (2), 35-44.",https://cyberleninka.ru/article/n/sovremennyy-pochvoobrazuyuschiy-potentsial-klimata-krymskogo-poluostrova2
Особенности сезонной изменчивости современных тенденций межгодовых вариаций уровня Северо-Западной части Черного моря,"Холопцев А.В., Захаренкова Л.С.",Геополитика и экогеодинамика регионов,2015,Науки о Земле и смежные экологические науки,"уровень моря, климатическая изменчивость, интерполяция, тренд, метод триангуляции делоне","sea level, climate variability, interpolation, trend, delaunaytriangulation method","Сопоставлены тенденции изменения уровня Черного моря за период после 1979 г., которые проявились в различные месяцы, в пунктах, расположенных на побережьях его Северо-Западной части. Выявленные особенности позволяют предполагать, что одной из основных причин имеющих место их различий являются тектонические процессы в регионе.","Холопцев А. В., Захаренкова Л. С. Особенности сезонной изменчивости современных тенденций межгодовых вариаций уровня Северо-Западной части Черного моря // Геополитика и экогеодинамика регионов. 2015. №2. URL: https://cyberleninka.ru/article/n/osobennosti-sezonnoy-izmenchivosti-sovremennyh-tendentsiy-mezhgodovyh-variatsiy-urovnya-severo-zapadnoy-chasti-chernogo-morya (дата обращения: 14.11.2024).","Холопцев А.В., & Захаренкова Л.С. (2015). Особенности сезонной изменчивости современных тенденций межгодовых вариаций уровня Северо-Западной части Черного моря. Геополитика и экогеодинамика регионов, 1 (11) (2), 45-55.",https://cyberleninka.ru/article/n/osobennosti-sezonnoy-izmenchivosti-sovremennyh-tendentsiy-mezhgodovyh-variatsiy-urovnya-severo-zapadnoy-chasti-chernogo-morya
Особенности гипергенного изменения кимберлитов и проблема поисков коренных месторождений алмазов. Статья 1. Коры выветривания,Зинчук Николай Николаевич,Бюллетень Московского общества испытателей природы. Отдел геологический,2015,Науки о Земле и смежные экологические науки,"сибирская и восточно-европейская платформы, кора выветривания, кимберлиты, осадочные породы","siberian and east-european platforms, crust of weathering, kimberlites, sedimentary rocks","На основании комплексного изучения коры выветривания кимберлитов на трубках Сибирской и Восточно-Европейской платформ показаны механизм и последовательность их изменения в различных климатических и геолого-тектонических условиях. Состав элювиальных продуктов зависит не только от климатических и гидродинамических условий гипергенного изменения пород, выполняющих диатремы, но и от свойств и минеральных особенностей вмещающих трубки пород. Для пелитовой составляющей из элювия кимберлитов Сибирской платформы, вмещающими породами которых являются терригенно-карбонатные отложения нижнего палеозоя, характерно присутствие Са-, реже Mg-Fe3+-монтмориллонита и монтмориллонит-гидрослюдистого смешанослойного образования с примесью гидрослюды, хлорита и серпентина. Резкое повышение в составе основной массы кимберлитов Восточно-Европейской платформы тонкодисперсного кварца (за счет влияния вмещающих трубки песчано-алевритовых кварцевых толщ) привело к широкому образованию как в кимберлитах, так и в продуктах их выветривания сапонита и неупорядоченного вермикулит-монтмориллонитового смешанослойного образования. Отмеченные особенности продуктов выветривания кимберлитов можно использовать как дополнительный критерий при поисках алмазных месторождений на каждой из упомянутых платформ.",Зинчук Николай Николаевич Особенности гипергенного изменения кимберлитов и проблема поисков коренных месторождений алмазов. Статья 1. Коры выветривания // Бюллетень МОИП. Отдел геологический. 2015. №5. URL: https://cyberleninka.ru/article/n/osobennosti-gipergennogo-izmeneniya-kimberlitov-i-problema-poiskov-korennyh-mestorozhdeniy-almazov-statya-1-kory-vyvetrivaniya (дата обращения: 14.11.2024).,"Зинчук Николай Николаевич (2015). Особенности гипергенного изменения кимберлитов и проблема поисков коренных месторождений алмазов. Статья 1. Коры выветривания. Бюллетень Московского общества испытателей природы. Отдел геологический, 90 (5), 28-40.",https://cyberleninka.ru/article/n/osobennosti-gipergennogo-izmeneniya-kimberlitov-i-problema-poiskov-korennyh-mestorozhdeniy-almazov-statya-1-kory-vyvetrivaniya
