Title,Authors,Journal,Year,Field of Science,Russian Keywords,English Keywords,Annotation,GOST,APA,Link
ВЫБОР КОМПЛЕКСА ЖИЗНЕОБЕСПЕЧЕНИЯ ДЛЯ ЭКИПАЖЕЙ ДОЛГОВРЕМЕННЫХ КОСМИЧЕСКИХ СТАНЦИЙ,"Гузенберг Аркадий Самуилович, Железняков Александр Григорьевич, Романов Сергей Юрьевич, Телегин Александр Анатольевич, Юргин Алексей Викторович",Космическая техника и технологии,2015,Химические технологии,"человек, среда обитания, комплекс систем жизнеобеспечения, регенерация воды и кислорода из продуктов жизнедеятельности, переменная масса доставляемого оборудования, международные стандарты",,"Существующий комплекс систем жизнеобеспечения Российского сегмента Международной космической станции (РС МКС) обеспечивает только частичную регенерацию воды и кислорода из продуктов жизнедеятельности человека, поэтому для обеспечения эксплуатации МКС необходима доставка грузовыми кораблями дополнительных запасов воды, кислорода, пищи и ресурсных агрегатов систем жизнеобеспечения. Данная ситуация определяет необходимость создания замкнутого комплекса регенерационных систем. В статье обоснован метод выбора комплекса систем жизнеобеспечения с повышенной степенью регенерации воды и кислорода из продуктов жизнедеятельности космонавтов на основе переменной массы доставляемого оборудования для последующей стадии развития МКС. При этом приведены структурные схемы работающих на борту МКС регенерационных систем жизнеобеспечения. Основные результаты летной эксплуатации этих систем с конца 2000 г. до середины 2014 г. при обеспечении трех членов экипажа подтвердили правильность метода выбора комплекса систем жизнеобеспечения. Рекомендовано для окончательного состава модулей РС МКС увеличить степень регенерации воды и кислорода из продуктов выделения экипажа за счет получения кислорода из диоксида углерода с использованием процесса Сабатье и регенерации воды из урины и всех влагосодержащих элементов.","Гузенберг Аркадий Самуилович, Железняков Александр Григорьевич, Романов Сергей Юрьевич, Телегин Александр Анатольевич, Юргин Алексей Викторович ВЫБОР КОМПЛЕКСА ЖИЗНЕОБЕСПЕЧЕНИЯ ДЛЯ ЭКИПАЖЕЙ ДОЛГОВРЕМЕННЫХ КОСМИЧЕСКИХ СТАНЦИЙ // Космическая техника и технологии. 2015. №1 (8). URL: https://cyberleninka.ru/article/n/vybor-kompleksa-zhizneobespecheniya-dlya-ekipazhey-dolgovremennyh-kosmicheskih-stantsiy (дата обращения: 14.11.2024).","Гузенберг Аркадий Самуилович, Железняков Александр Григорьевич, Романов Сергей Юрьевич, Телегин Александр Анатольевич, & Юргин Алексей Викторович (2015). ВЫБОР КОМПЛЕКСА ЖИЗНЕОБЕСПЕЧЕНИЯ ДЛЯ ЭКИПАЖЕЙ ДОЛГОВРЕМЕННЫХ КОСМИЧЕСКИХ СТАНЦИЙ. Космическая техника и технологии,  (1 (8)), 67-80.",https://cyberleninka.ru/article/n/vybor-kompleksa-zhizneobespecheniya-dlya-ekipazhey-dolgovremennyh-kosmicheskih-stantsiy
Изменения климата Северо-Запада Мордовии за период существования Мордовского заповедника по данным метеонаблюдений в г. Темникове,Баянов Н.Г.,Труды Мордовского государственного природного заповедника им. П. Г. Смидовича,2015,Науки о Земле и смежные экологические науки,"мордовский заповедник, изменения климата, глобальное потепление",,"За период существования Мордовского заповедника на северо-западе Мордовии произошли существенные изменения климатического режима. Общее потепление климата привело к повышению средней многолетней температуры воздуха на 0.9°С. Потепление января привело к тому, что самым холодным месяцем года стал февраль. Наибольшая среднегодовая температура воздуха (+5.8°С) была достигнута в последнее десятилетие XX века. Самым увлажнённым периодом в Мордовском заповеднике являются 1970-е годы. Внутригодовой минимум выпадения осадков характерен для февраля. Коэффициент континентальности климата по Ценкеру первую половину двадцатого столетия составлял 62.3-62.6%; с 1970-х годов имело место понижение с минимумом 45.4% в первой половине 1990-х годов.",Баянов Н. Г. Изменения климата Северо-Запада Мордовии за период существования Мордовского заповедника по данным метеонаблюдений в г. Темникове // Труды Мордовского государственного природного заповедника им. П. Г. Смидовича. 2015. №14. URL: https://cyberleninka.ru/article/n/izmeneniya-klimata-severo-zapada-mordovii-za-period-suschestvovaniya-mordovskogo-zapovednika-po-dannym-meteonablyudeniy-v-g-temnikove (дата обращения: 13.11.2024).,"Баянов, Н. Г. (2015). Изменения климата Северо-Запада Мордовии за период существования Мордовского заповедника по данным метеонаблюдений в г. Темникове. Труды Мордовского государственного природного заповедника им. П. Г. Смидовича,  (14), 212-219.",https://cyberleninka.ru/article/n/izmeneniya-klimata-severo-zapada-mordovii-za-period-suschestvovaniya-mordovskogo-zapovednika-po-dannym-meteonablyudeniy-v-g-temnikove
Ветровой режим Забайкальского края,"Носкова Елена Викторовна, Обязов Виктор Афанасьевич",Ученые записки Забайкальского государственного университета. Серия: Биологические науки,2015,Науки о Земле и смежные экологические науки,"забайкальский край, скорость ветра, повторяемость направлений, ветра, штиль","zabaikalsky krai, wind speed, repeatability of wind directions, calm","В статье рассмотрено пространственное распределение на территории Забайкальского края основных характеристик ветра: скорости и направления. Для анализа использованы данные Забайкальского управления по гидрометеорологии и мониторингу окружающей среды за 24-летний период (1990-2013 гг.) на 26 метеорологических станциях. Выполненный анализ пространственного изменения характеристик ветрового режима показал разнообразие преобладающих направлений ветра, обусловленное расположением территории края в условиях пересечённой местности, где рельеф оказывает большое влияние на распределение различных направлений ветра. Сделаны выводы о том, что в целом по территории Забайкальского края скорости ветра невелики. Отчётливо выражен годовой ход её среднемесячных значений. Скорость ветра име-ет наименьшие значения зимой, когда над территорией располагается отрог сибирского анти-циклона. Весной и осенью по мере его разрушения и заполнения скорость ветра возрастает. Летом вследствие ослабления циркуляции атмосферы она снижается. Большую повторяемость имеют штили. Их повторяемость в среднем по территории составляет около 38 %. Результаты работы могут использоваться для мониторинга климата в регионе, в климатическом обслуживании отраслей народного хозяйства. Характеристики ветрового режима необходимы при разработке ветроэнергетических кадастров территорий, при корректировке строительных нормативов. В последнее время всё актуальнее становится вопрос использования энергии ветра для преобразования её в электрическую.","Носкова Елена Викторовна, Обязов Виктор Афанасьевич Ветровой режим Забайкальского края // Ученые записки ЗабГУ. Серия: Биологические науки. 2015. №1 (60). URL: https://cyberleninka.ru/article/n/vetrovoy-rezhim-zabaykalskogo-kraya (дата обращения: 13.11.2024).","Носкова, Е. В., & Обязов, В. А. (2015). Ветровой режим Забайкальского края. Ученые записки Забайкальского государственного университета. Серия: Биологические науки,  (1 (60)), 115-121.",https://cyberleninka.ru/article/n/vetrovoy-rezhim-zabaykalskogo-kraya
Экстремальные морозы в Ижевске в XX-XXI столетиях,Шумихина Алла Валерьевна,Вестник Удмуртского университета. Серия «Биология. Науки о Земле»,2015,Науки о Земле и смежные экологические науки,"климат, изменения климата, температура воздуха, экстремальные температуры воздуха, синоптика, метеорология","climate, climate change, air temperature, extreme air temperatures, synoptics, meteorology","Рассмотрен климатический ряд ежедневных значений максимальных и минимальных температур воздуха с 1933 г. по 2013 г. в городе Ижевске. Рассчитаны основные характеристики распределения этих температур, а также изучены взаимосвязи между экстремальными морозами и синоптическими ситуациями, при которых они наблюдались. Выявилось, что морозы с температурой воздуха ниже -20 °С встречаются в Ижевске каждый год со средней повторяемостью 10 раз в месяц, максимальная повторяемость принадлежит январю. За последние десятилетия существует тенденция к уменьшению повторяемости морозных дней. Наиболее экстремальные морозы наблюдаются при длительных волнах холода при ультраполярном вторжении арктического воздуха. В последние десятилетия продолжительность волн холода уменьшилась, поэтому их абсолютные минимумы не достигают рекордных значений, зафиксированных в более ранние периоды.",Шумихина Алла Валерьевна Экстремальные морозы в Ижевске в XX-XXI столетиях // Вестник Удмуртского университета. Серия «Биология. Науки о Земле». 2015. №1. URL: https://cyberleninka.ru/article/n/ekstremalnye-morozy-v-izhevske-v-xx-xxi-stoletiyah (дата обращения: 13.11.2024).,"Шумихина, А. В. (2015). Экстремальные морозы в Ижевске в XX-XXI столетиях. Вестник Удмуртского университета. Серия «Биология. Науки о Земле»,  (1), 114-121.",https://cyberleninka.ru/article/n/ekstremalnye-morozy-v-izhevske-v-xx-xxi-stoletiyah
Фитолигный анализ генезиса стратозема светлогумусового (на примере приозерной территории озера баган),"Лада Наталья Юрьевна, Смоленцев Борис Анатольевич",Вестник Томского государственного университета. Биология,2015,Науки о Земле и смежные экологические науки,"фитолиты, стратозем, микробиоморфный анализ, спикулы губок","phytoliths, stratozem, microbiomorphic analysis, sponge spicules","Представлены результаты изучения условий формирования стратозема светлогумусового водно-аккумулятивного на погребенном солонце, расположенного в Кулундинской степи, при комплексном использовании фитолитного и физико-химических анализов. Согласно проведенным исследованиям данная почва формировалась в сложных динамичных условиях. Первоначально профиль почвы формировался по солонцовому типу с образованием солонца светлого. В связи с изменением климатических условий, приведших сначала к повышению водности р. Баган и соответственно оз. Баган, а затем к ее снижению, происходила трансформация озерной котловины. Одним из результатов данной трансформации является образование берегового вала на значительном удалении (900 м) от современной береговой линии озера, что подтверждается возрастанием процентного содержания фитолитов тростника. Фитолиты лесных злаков и двудольных трав, зафиксированные в погребенной почве, присутствуют во всей вышезалегающей почвенной толще. Это позволяет предположить, что лесные колки на данной территории появились одновременно с формированием солонцового горизонта, до его погребения под озерными отложениями береговых фаций.","Лада Наталья Юрьевна, Смоленцев Борис Анатольевич Фитолигный анализ генезиса стратозема светлогумусового (на примере приозерной территории озера баган) // Вестн. Том. гос. ун-та. Биология. 2015. №1 (29). URL: https://cyberleninka.ru/article/n/fitolignyy-analiz-genezisa-stratozema-svetlogumusovogo-na-primere-priozernoy-territorii-ozera-bagan (дата обращения: 13.11.2024).","Лада, Н. Ю., & Смоленцев, Б. А. (2015). Фитолигный анализ генезиса стратозема светлогумусового (на примере приозерной территории озера баган). Вестник Томского государственного университета. Биология,  (1 (29)), 16-27.",https://cyberleninka.ru/article/n/fitolignyy-analiz-genezisa-stratozema-svetlogumusovogo-na-primere-priozernoy-territorii-ozera-bagan
Крупномасштабные режимы изменения климата и согласованность изменений пространственно-временной структуры поля атмосферных осадков в Алтайском регионе,"Чередько Наталья Николаевна, Журавлев Георгий Георгиевич",Вестник Томского государственного университета,2015,Науки о Земле и смежные экологические науки,"алтайский регион, атмосферные осадки, климатические структуры, эль-ниньо","altai region, precipitation, climate structures, el nino",Анализируется влияние изменений современного глобального климата на структуру поля осадков в Алтайском регионе. Тренд в динамике годовых сумм незначим. Незначительный рост происходил за счет осадков теплого полугодия. Выявлено уменьшение осадков холодного полугодия на большинстве станций. Обнаружено увеличение изменчивости в период похолодания последних полутора десятилетий в регионе на фоне замедления глобального потепления. Выявлен отклик режима осадков в регионе на механизм Эль-Ниньо.,"Чередько Наталья Николаевна, Журавлев Георгий Георгиевич Крупномасштабные режимы изменения климата и согласованность изменений пространственно-временной структуры поля атмосферных осадков в Алтайском регионе // Вестн. Том. гос. ун-та. 2015. №391. URL: https://cyberleninka.ru/article/n/krupnomasshtabnye-rezhimy-izmeneniya-klimata-i-soglasovannost-izmeneniy-prostranstvenno-vremennoy-struktury-polya-atmosfernyh (дата обращения: 13.11.2024).","Чередько, Н. Н., & Журавлев, Г. Г. (2015). Крупномасштабные режимы изменения климата и согласованность изменений пространственно-временной структуры поля атмосферных осадков в Алтайском регионе. Вестник Томского государственного университета,  (391), 220-226.",https://cyberleninka.ru/article/n/krupnomasshtabnye-rezhimy-izmeneniya-klimata-i-soglasovannost-izmeneniy-prostranstvenno-vremennoy-struktury-polya-atmosfernyh
"Об уязвимости флота РФ и высоких рисков для грузопотоков через порты Анапа, Новороссийск, Туапсе","Михайлов В.И., Зорин В.Ю., Капочкина М.Б.",ScienceRise,2015,Науки о Земле и смежные экологические науки,"бора, прогнозирование опасных явлений погоды, навигация, грузоперевозки, базирование флота рф","bora, forecasting of highly dangerous weather, navigation, cargo traffic, russian flee basing","Приведены примеры катастрофических последствий и экономического ущерба от Новороссийской боры. Возникновение боры является следствием процессов непреодолимой силы, а существующие сценарии изменения климатических условий предполагают в будущем учащение боры и увеличение силы этого особо опасного явления погоды. Рассмотрены причины возникновения боры и перспективы прогнозир ования шквальных ветров и оледенения судов в Новороссийске","Михайлов В. И., Зорин В. Ю., Капочкина М. Б. Об уязвимости флота РФ и высоких рисков для грузопотоков через порты Анапа, Новороссийск, Туапсе // SR. 2015. №1 (9). URL: https://cyberleninka.ru/article/n/ob-uyazvimosti-flota-rf-i-vysokih-riskov-dlya-gruzopotokov-cherez-porty-anapa-novorossiysk-tuapse (дата обращения: 13.11.2024).","Михайлов, В. И., Зорин, В. Ю., & Капочкина, М. Б. (2015). Об уязвимости флота РФ и высоких рисков для грузопотоков через порты Анапа, Новороссийск, Туапсе. ScienceRise, 4 (1 (9)), 31-34.",https://cyberleninka.ru/article/n/ob-uyazvimosti-flota-rf-i-vysokih-riskov-dlya-gruzopotokov-cherez-porty-anapa-novorossiysk-tuapse
