Title,Authors,Journal,Year,Field of Science,Russian Keywords,English Keywords,Annotation,GOST,APA,Link
"Старовозрастные сосняки Беловежской пущи: состояние, перспективы сохранения",Рожков Леонид Николаевич,"Труды БГТУ. Серия 1: Лесное хозяйство, природопользование и переработка возобновляемых ресурсов",2017,"Сельское хозяйство, лесное хозяйство, рыбное хозяйство","беловежская пуща, старовозрастной сосновый лес, деятельность по сохранению всемирного наследия юнеско",,"Исследована сосновая формация заповедной зоны белорусской части Беловежской пущи -объекта Всемирного наследия ЮНЕСКО. Сосняки сформировались путем естественного возобновления в период примерно 1800-1940 гг. Представлены на 96,4% возрастной группой в пределах 85-220 лет. Два участка (8,5 га) имеют возраст 250 лет, один (0,7 га) 300 и один (0,6 га) -310 лет. Полнота сосновых древостоев снижается с их возрастом: 60-100-летние имеют полноту порядка 0,75, 120-180-летние 0,60, 200-240-летние древостои 0,53. В составе сосновых дре-востоев на 57,4% их площади присутствует ель, в том числе 3 и более единиц 7,4%. На 21,8% площади сосняков сформировался второй ярус из ели. При этом доля сосновых древостоев с еловым ярусом возрастает с 5,4% в четвертом классе возраста до 64,7 в двенадцатом %. На 67,3% площади сосняки имеют благонадежный подрост. Прогноз сохранности сосновой формации Беловежской пущи не оптимистичен. Естественная эволюция сосновой формации приведет когда-то к элиминации соснового элемента древостоев. Угрозой текущего дня сохранности Беловежской пущи является объективная необходимость производства санитарных рубок при периодически повторяемых массовых усыханиях еловых насаждений, вызываемых погодно-климатическими изменениями. Угрозой стратегического уровня является широкомасштабная естественная смена елью старовозрастных сосновых древостоев, распадающихся по причине высокого возраста.","Рожков Леонид Николаевич Старовозрастные сосняки Беловежской пущи: состояние, перспективы сохранения // Труды БГТУ. Серия 1: Лесное хозяйство, природопользование и переработка возобновляемых ресурсов. 2017. №1 (192). URL: https://cyberleninka.ru/article/n/starovozrastnye-sosnyaki-belovezhskoy-puschi-sostoyanie-perspektivy-sohraneniya (дата обращения: 12.02.2025).","Рожков Леонид Николаевич (2017). Старовозрастные сосняки Беловежской пущи: состояние, перспективы сохранения. Труды БГТУ. Серия 1: Лесное хозяйство, природопользование и переработка возобновляемых ресурсов,  (1 (192)), 14-17.",https://cyberleninka.ru/article/n/starovozrastnye-sosnyaki-belovezhskoy-puschi-sostoyanie-perspektivy-sohraneniya
Влияние системы удобрения на продуктивность звена севооборота (пар - озимая рожь - пшеница - клевер 1 Г. П. ) и содержание лабильного органического вещества в дерново-мелкоподзолистой среднесуглинистой почве,Акманаева Ю. А.,Пермский аграрный вестник,2017,"Сельское хозяйство, лесное хозяйство, рыбное хозяйство","система удобрения, сидеральный пар, чистый пар, продуктивность, лабильное вещество почвы, углерод лабильного вещества, запасы лабильного вещества","system of fertilizer, green manure fallow, pure fallow, productivity, labile elements in soil, labile carbon substances, stocks of labile substances","Исследования проведены в многолетнем стационарном полевом опыте в 2013-2017 гг. на дерново-мелкоподзолистой среднесуглинистой почве. Изучали влияние вида пара и системы удобрения на продуктивность звена полевого севооборота (пар озимая рожь яровая пшеница клевер 1.г.п.). Схема опыта: фактор А вид пара: А1 сидеральный пар; А2 чистый пар; фактор В система удобрения: В1 без удобрений; В2 органическая (запашка соломы озимой ржи); В3 минеральная (N60Р60К60); В4 органо-минеральная (NРК)60+ солома. Продуктивность звена севооборота и содержание лабильного органического вещества (ЛОВ) не зависели от вида пара Fф05. Наибольшая прибавка в опыте 0,67 т/га з.е. (при НСР05 = 0,15 т/ га з.е.) была получена при возделывании культур по органо-минеральной системе удобрения, которая также способствовала наибольшему накоплению лабильного органического вещества в сравнении с почвой без внесения удобрений (прибавка составила 4%, при НСР05 = 3,0%). Наибольшее содержание ЛОВ 79,8% к массе легкой фракции наблюдается в варианте с органо-минеральной системой удобрения. Запасы углерода лабильного вещества напрямую зависели от его содержания в пахотном слое почвы и колебались по вариантам опыта от 4,3 до 6,3 т/га. Несмотря на высокую продуктивность культур звена севооборота 3,29 т/га з.е. при минеральной системе удобрения, после сидерального пара складываются условия, приводящие к консервативности органического вещества почвы и формированию отрицательного баланса углерода.",Акманаева Ю. А. Влияние системы удобрения на продуктивность звена севооборота (пар - озимая рожь - пшеница - клевер 1 Г. П. ) и содержание лабильного органического вещества в дерново-мелкоподзолистой среднесуглинистой почве // Пермский аграрный вестник. 2017. №4 (20). URL: https://cyberleninka.ru/article/n/vliyanie-sistemy-udobreniya-na-produktivnost-zvena-sevooborota-par-ozimaya-rozh-pshenitsa-klever-1-g-p-i-soderzhanie-labilnogo (дата обращения: 12.02.2025).,"Акманаева Ю. А. (2017). Влияние системы удобрения на продуктивность звена севооборота (пар - озимая рожь - пшеница - клевер 1 Г. П. ) и содержание лабильного органического вещества в дерново-мелкоподзолистой среднесуглинистой почве. Пермский аграрный вестник,  (4 (20)), 46-52.",https://cyberleninka.ru/article/n/vliyanie-sistemy-udobreniya-na-produktivnost-zvena-sevooborota-par-ozimaya-rozh-pshenitsa-klever-1-g-p-i-soderzhanie-labilnogo
Запасы углерода в постагрогенных сухостепных почвах Западного Забайкалья,Чимитдоржиева Э.О.,Аридные экосистемы,2017,"Сельское хозяйство, лесное хозяйство, рыбное хозяйство","углерод, запасы, гумус, микробная биомасса, чистая первичная продукция, карбонаты, постагрогенные каштановые почвы, западное забайкалье",,"Приведены новые данные по запасам углерода в постагрогенных каштановых почвах Западного Забайкалья. Выявлены количественные и качественные особенности формирования в них запасов углерода. Показано, что общие запасы углерода в сухостепных экосистемах имеют разные соотношениях его органических и неорганических форм. В постагрогенных сукцессиях происходит постепенное восстановление запасов углерода, близкого к целинным аналогам.",Чимитдоржиева Э. О. Запасы углерода в постагрогенных сухостепных почвах Западного Забайкалья // Аридные экосистемы. 2017. №3 (72). URL: https://cyberleninka.ru/article/n/zapasy-ugleroda-v-postagrogennyh-suhostepnyh-pochvah-zapadnogo-zabaykalya (дата обращения: 12.02.2025).,"Чимитдоржиева Э.О. (2017). Запасы углерода в постагрогенных сухостепных почвах Западного Забайкалья. Аридные экосистемы, 23 (3 (72)), 59-65.",https://cyberleninka.ru/article/n/zapasy-ugleroda-v-postagrogennyh-suhostepnyh-pochvah-zapadnogo-zabaykalya
Оценка экономических последствий наблюдаемых и ожидаемых климатических изменений с учетом долгосрочных прогнозных сценариев развития лесного сектора,"Константинов А.В., Королева Татьяна Станиславовна, Кушнир Елизавета Андреевна, Торжков Иван Олегович",Лесотехнический журнал,2017,"Сельское хозяйство, лесное хозяйство, рыбное хозяйство","изменение климата, смещение природных зон, изменение среднегодового прироста, лесные пожары, экономические последствия, лесные экосистемы","climate change, modification of natural areas, expected climate changes, forest fires, economic consequences, total growing stock","Расчет экономических последствий изменений климата для лесного сектора производился на основе данных об изменении запасов древесины в результате увеличения вегетационного периода, суммы активных температур и общего среднегодового прироста на 1 га покрытых лесной растительностью землях лесного фонда, а также динамики значений комплексного показателя пожарной опасности Нестерова по погодным условиям на середину и конец века по 3, 4 и 5 классам пожарной опасности. Сравнительный анализ положения границ природно-климатических зон на текущий момент, середину и конец века свидетельствует о прогнозируемом смещении границ с юга на север. Смещение границ природно-климатических зон неизбежно повлечет за собой изменение породного состава лесных массивов этих территорий. В частности, прогнозируется постепенная смена хвойных пород лиственными, что прямо скажется на структуре лесных ресурсов. Экономические последствия прогнозируемых изменений будут связаны как со сменой породного состава лесов, так и с изменением среднегодового прироста древесины. За счет увеличения вегетационного периода и суммы активных темпера-тур ожидается увеличение общего среднегодового прироста на 1 га покрытых лесной растительностью землях лесного фонда, эксплуатационных лесов до 2.9 м3/га на середину века и до 3.2 м3/га на конец века (при показа-теле 2.6 м3/га по состоянию за период 2008-2014 гг.). С учётом стоимости хвойной и лиственной древесины по регионам (в средних ценах 2017 г.), а также роста продуктивности насаждений, к середине века стоимостная оценка лесов по отношению к 2014 г. возрастет на 50.3%. К концу века ожидается увеличение до 217 % от уровня 2014 г. К 2090 году ожидается смещение границ южной тайги к границам средней тайги. В случае сохранения текущей продуктивности лесов ожидается снижение стоимостной оценки до 93.8 % от уровня 2014 г. К середине и к концу века ожидается увеличение пожароопасного сезона, в среднем на 4 дня к 2050 г. и на 9 дней к 2090 г. За счет этого возможен рост расходов на тушение лесных пожаров. В среднем по регионам увеличение расходов с 2016 г. по 2050 г. составит 2.3 млн руб./год, с 2051 г. по 2090 г. – 4.1 млн руб./год.","Константинов А. В., Королева Татьяна Станиславовна, Кушнир Елизавета Андреевна, Торжков Иван Олегович Оценка экономических последствий наблюдаемых и ожидаемых климатических изменений с учетом долгосрочных прогнозных сценариев развития лесного сектора // Лесотехнический журнал. 2017. №4 (28). URL: https://cyberleninka.ru/article/n/otsenka-ekonomicheskih-posledstviy-nablyudaemyh-i-ozhidaemyh-klimaticheskih-izmeneniy-s-uchetom-dolgosrochnyh-prognoznyh-stsenariev (дата обращения: 12.02.2025).","Константинов А.В., Королева Татьяна Станиславовна, Кушнир Елизавета Андреевна, & Торжков Иван Олегович (2017). Оценка экономических последствий наблюдаемых и ожидаемых климатических изменений с учетом долгосрочных прогнозных сценариев развития лесного сектора. Лесотехнический журнал, 7 (4 (28)), 257-274.",https://cyberleninka.ru/article/n/otsenka-ekonomicheskih-posledstviy-nablyudaemyh-i-ozhidaemyh-klimaticheskih-izmeneniy-s-uchetom-dolgosrochnyh-prognoznyh-stsenariev
Совместные и смешанные посевы на продовольственное зерно в условиях глобальных климатических изменений,"Оленин О.А., Платунов А.А., Холзаков В.М.",Земледелие,2017,"Сельское хозяйство, лесное хозяйство, рыбное хозяйство","глобальные климатические изменения, нарастание арид-ности климата, традиционное земледелие, продовольственная безопасность, яровая пшеница, одновидовые посевы, природный фитоценоз, возобновляемые ресурсы, биологизация технологии возделывания, совместные и смешанные посевы, моделирование поликультур (агросмесей)","global climatic changes, growth of climate aridity, traditional farming, food safety, spring wheat, one-species crop, natural phytocenosis, renewable resources, biologization of cultivation technology, combined and mixed crops, design of polycultures (agricultural mixtures)","Цель исследований определение возможности и целесообразности совместных и смешанных посевов озимых и яровых зерновых и зернобобовых культур на продовольственное зерно в условиях нарастания аридности климата. В работе обобщены и проанализированы опубликованные научные данные, а также результаты исследований по составу и горизонтальной структуре агро фитоценозов яровой пшеницы и почвенной мезофауны на опытном поле Самарской ГСХА в 1994-1996 гг. (южная лесостепь Заволжья). Почва чернозем обыкновенный среднемощный тяжелосуглинистый (содержание гумуса 7,9 %, азота легкогидролизуемого 85-115 мг/кг, подвижного фосфора и калия 145-155 и 155-190 мг/кг соответственно, рНcon 6,8). Состав и горизонтальную структуру агрофитоценоза изучали методом сплошного картографирования участков в масштабе 1:200, почвенную мезофауну методом почвенных раскопокплощадок40х40 см. Моделирование агросмеси, то есть состава, вертикальной и горизонтальной структуры агрофитоценоза совместного или смешанного посева, возможно и целесообразно. Поликультура позволяет увеличить поступление в почвубиологического азота, снизить фитотоксичность почвы, уменьшить засоренность ниже ЭПВ, эффективнее использовать природные возобновляемые ресурсы, повысить продуктивность и устойчивость агроэкосистем. Моделирование поликультур, особенно при выращивании продовольственного зерна, в рамках адаптивноландшафтного земледелия новый этап развития земледельческой науки и практики, который требует всесторонних масштабных исследований во всехпочвенно-климатических зонах и основных зерновых регионах России. Введение в севооборот занятого и сидерального пара, органическая система удобрений (с заделкой соломы), сокращение доз и полный отказ от ксенобиотиков, а также минимизация основной обработки почвы увеличивали биологическое и структурное разнообразие агрофитоценозов; видовое разнообразие, численность и биомассу почвенных животных, в особенности сапрофагов, что в совокупности обеспечивало максимальное использование природных возобновляемых ресурсов в условиях глобальных климатических изменений.","Оленин О. А., Платунов А. А., Холзаков В. М. Совместные и смешанные посевы на продовольственное зерно в условиях глобальных климатических изменений // Земледелие. 2017. №1. URL: https://cyberleninka.ru/article/n/sovmestnye-i-smeshannye-posevy-na-prodovolstvennoe-zerno-v-usloviyah-globalnyh-klimaticheskih-izmeneniy (дата обращения: 12.02.2025).","Оленин О.А., Платунов А.А., & Холзаков В.М. (2017). Совместные и смешанные посевы на продовольственное зерно в условиях глобальных климатических изменений. Земледелие,  (1), 9-15.",https://cyberleninka.ru/article/n/sovmestnye-i-smeshannye-posevy-na-prodovolstvennoe-zerno-v-usloviyah-globalnyh-klimaticheskih-izmeneniy
