Title,Authors,Journal,Year,Field of Science,Russian Keywords,English Keywords,Annotation,GOST,APA,Link
Прогноз абсорбции атмосферного углерода на основе динамики лесопользования и лесного фонда Беларуси,"Рожков Леонид Николаевич, Ерошкина Ирина Федоровна","Труды БГТУ. Серия 1: Лесное хозяйство, природопользование и переработка возобновляемых ресурсов",2017,"Сельское хозяйство, лесное хозяйство, рыбное хозяйство","углерододепонирование, атмосферный диоксид углерода, абсорбция со2, лесной фонд беларуси",,"Истекший послевоенный период (1944-2015 гг.) развития лесохозяйственной отрасли Беларуси отличался масштабным лесоразведением, преобладанием молодняков с относительно невысокими средними запасами насаждений. Это способствовало росту накопления углерода на землях лесного фонда за 1944-2015 гг., ориентировочно на 0,9 млрд т С с приростом 1,58 т С/гатод в среднем, что соответствовало поглощению атмосферного диоксида углерода в объеме 5,79 т СО2/гатод. Абсорбция углекислого газа на 92% обеспечивается за счет фитомассы покрытых лесом земель, главным образом за счет образования стволовой древесины (71% от поглощения СО2 землями лесного фонда). Прогнозируется возможность компенсировать индустриальную эмиссию парниковых газов в объеме до 18-24 млн т СО2 ежегодно за счет поглощения углекислого газа землями лесного фонда. Положительная динамика с превышением в лесах Беларуси «стока» над «эмиссией» атмосферного углерода обеспечивается прогнозируемым приростом древесных запасов (млн м3): +203 в 2030 г. и +411 в 2050 г. по отношению к 2015 г. Практическое использование лесоуглеродного ресурса Беларуси с получением лесохозяйственной отраслью доходов перспективно на основе отказа от главного пользования лесом на 2025 лет для малоценных и труднодоступных лесонасаждений. В условиях современного избытка спелых лесов реализация таких углеродных кредитов возможна.","Рожков Леонид Николаевич, Ерошкина Ирина Федоровна Прогноз абсорбции атмосферного углерода на основе динамики лесопользования и лесного фонда Беларуси // Труды БГТУ. Серия 1: Лесное хозяйство, природопользование и переработка возобновляемых ресурсов. 2017. №2 (198). URL: https://cyberleninka.ru/article/n/prognoz-absorbtsii-atmosfernogo-ugleroda-na-osnove-dinamiki-lesopolzovaniya-i-lesnogo-fonda-belarusi (дата обращения: 12.02.2025).","Рожков Леонид Николаевич, & Ерошкина Ирина Федоровна (2017). Прогноз абсорбции атмосферного углерода на основе динамики лесопользования и лесного фонда Беларуси. Труды БГТУ. Серия 1: Лесное хозяйство, природопользование и переработка возобновляемых ресурсов,  (2 (198)), 102-108.",https://cyberleninka.ru/article/n/prognoz-absorbtsii-atmosfernogo-ugleroda-na-osnove-dinamiki-lesopolzovaniya-i-lesnogo-fonda-belarusi
ЭКОСИСТЕМА ОНЕЖСКОГО ОЗЕРА: РЕАКЦИЯ ВОДНЫХ СООБЩЕСТВ НА АНТРОПОГЕННЫЕ ФАКТОРЫ И КЛИМАТИЧЕСКИЕ ИЗМЕНЕНИЯ,"Калинкина Наталия Михайловна, Теканова Елена Валентиновна, Сярки Мария Тагевна","Водное хозяйство России: проблемы, технологии, управление",2017,"Сельское хозяйство, лесное хозяйство, рыбное хозяйство","онежское озеро, lake onegо, водные сообщества, качество воды, антропогенная нагрузка, эвтрофирование, реолиготрофизация, нефтяное загрязнение, биоинвазии, климатические изменения","water quality, anthropogenic load, oil-caused pollution, climate change, aquatic communities, euthrophication, re-oligotrophication, bioinvasion","Систематизированы и проанализированы собственные и литературные сведения о динамике антропогенной нагрузки, состоянии планктона и бентоса Онежского озера на протяжении последних 55 лет с целью оценки реакции экосистемы на долговременные и недавно появившиеся факторы воздействия - климатические изменения, химическое и биологическое загрязнение. Показано, что загрязнение озера носит локальный характер, в то время как более 90 % его акватории сохраняет исходный олиготрофный статус. Биогенные вещества, поступающие в озеро со сточными водами целлюлозно-бумажного производства и коммунального хозяйства, привели к эвтрофированию двух северо-западных заливов. В последнее десятилетие нагрузка от точечных источников загрязнения снизилась, что проявилось в процессах реолиготрофизации, протекающих в донных сообществах эвтрофируемых заливов, однако появились рассеянные источники поступления загрязняющих веществ. Потенциальную угрозу эвтрофирования озера представляют форелевые хозяйства в северо-западных заливах. Выявлено хроническое нефтяное загрязнение Петрозаводской губы озера, с которым экосистема залива пока справляется. Биологическое загрязнение, связанное с вселением байкальской амфиподы Gmelinoides fasciatus Stebbing, привело к увеличению продуктивности отдельных участков литоральной зоны и улучшению кормовой базы молоди окуня. Клима тические изменения вызывают отклонения в структуре и сезонной цикличности планктонных сообществ, которые носят обратимый характер. В целях сохранения экономической ценности водного объекта предлагается законодательно закрепить систему мер по охране Онежского озера как стратегического источника пресной воды и разработать научно обоснованные критерии экологического мониторинга с учетом его гетерогенности.","Калинкина Наталия Михайловна, Теканова Елена Валентиновна, Сярки Мария Тагевна ЭКОСИСТЕМА ОНЕЖСКОГО ОЗЕРА: РЕАКЦИЯ ВОДНЫХ СООБЩЕСТВ НА АНТРОПОГЕННЫЕ ФАКТОРЫ И КЛИМАТИЧЕСКИЕ ИЗМЕНЕНИЯ // ВХР. 2017. №1. URL: https://cyberleninka.ru/article/n/ekosistema-onezhskogo-ozera-reaktsiya-vodnyh-soobschestv-na-antropogennye-faktory-i-klimaticheskie-izmeneniya (дата обращения: 12.02.2025).","Калинкина Наталия Михайловна, Теканова Елена Валентиновна, & Сярки Мария Тагевна (2017). ЭКОСИСТЕМА ОНЕЖСКОГО ОЗЕРА: РЕАКЦИЯ ВОДНЫХ СООБЩЕСТВ НА АНТРОПОГЕННЫЕ ФАКТОРЫ И КЛИМАТИЧЕСКИЕ ИЗМЕНЕНИЯ. Водное хозяйство России: проблемы, технологии, управление,  (1), 4-18.",https://cyberleninka.ru/article/n/ekosistema-onezhskogo-ozera-reaktsiya-vodnyh-soobschestv-na-antropogennye-faktory-i-klimaticheskie-izmeneniya
Новые аспекты оценки поглощения парниковых газов лесами России в контексте Парижского соглашения об изменении климата,"Филипчук А.Н., Моисеев Б.Н., Малышева Н.В.",Лесохозяйственная информация,2017,"Сельское хозяйство, лесное хозяйство, рыбное хозяйство","источники/поглотители парниковых газов, накопление углерода лесами, сток углерода, углеродный бюджет, парижское соглашение, рамочная конвенция оон об изменении климата","forests, carbon sink, carbon balance assessment, carbon sequestration by forests, paris agreement, united nations framework convention on climate change","Выполнен анализ результатов расчета поглотительной способности лесов по базовой методике, используемой при подготовке национальной отчетности согласно международным соглашениям и обязательствам Российской Федерации. Выявлены ключевые факторы, влияющие на суммарную расчетную оценку поглощения СО2 лесами. Предложено переосмыслить базовую методику и пересмотреть учетные единицы кадастра для объективного и максимально полного учета поглощения и накопления углерода лесами России.","Филипчук А. Н., Моисеев Б. Н., Малышева Н. В. Новые аспекты оценки поглощения парниковых газов лесами России в контексте Парижского соглашения об изменении климата // Лесохозяйственная информация. 2017. №1. URL: https://cyberleninka.ru/article/n/novye-aspekty-otsenki-pogloscheniya-parnikovyh-gazov-lesami-rossii-v-kontekste-parizhskogo-soglasheniya-ob-izmenenii-klimata (дата обращения: 12.02.2025).","Филипчук А.Н., Моисеев Б.Н., & Малышева Н.В. (2017). Новые аспекты оценки поглощения парниковых газов лесами России в контексте Парижского соглашения об изменении климата. Лесохозяйственная информация,  (1), 88-98.",https://cyberleninka.ru/article/n/novye-aspekty-otsenki-pogloscheniya-parnikovyh-gazov-lesami-rossii-v-kontekste-parizhskogo-soglasheniya-ob-izmenenii-klimata
Агроклиматический потенциал и основные проблемы влияния климатических изменений на производство сельскохозяйственных культур Ульяновской области,"Захаров А. И., Шарипова Р.Б.",Вестник Ульяновской государственной сельскохозяйственной академии,2017,"Сельское хозяйство, лесное хозяйство, рыбное хозяйство","изменение климата, адаптация, посевная площадь, минеральные удобрения, техническая оснащенность","climate change, adaptation, cultivated area, mineral fertilizers, technical equipment","В последние годы амплитуда климатических изменений существенно возросла, и это негативно отразилась на сельскохозяйственном производстве. Первые острые проявления климатических изменений стали особенно ощутимы в 2010 и 2012 гг., когда засухи привели к резкому сокращению производства зерна, росту цен на зерновые культуры. Суммарный ущерб только от падения урожайности в стране составил более 300 миллиардов рублей. В Ульяновской области 2010 году на 145,6 тысяч гектаров потеряно 158 тыс. тонн зерна. Далее в статье оценивается состояние сектора производства зерновых культур на фоне изменяющегося климата по нескольким экономическим индикаторам. Статистика показывает, что площади посевных культур, применение минеральных удобрений заметно сократились, сельскохозяйственные предприятия стали не только финансово уязвимы, но и менее оснащены технически для противодействия влиянию негативных климатических факторов. Для преодоления низкой стресс-устойчивости предлагаются необходимые меры, которые могут повысить устойчивость сельского хозяйства не только к климатическим изменениям, но и к внешним воздействиям.","Захаров А. И., Шарипова Р. Б. Агроклиматический потенциал и основные проблемы влияния климатических изменений на производство сельскохозяйственных культур Ульяновской области // Вестник Ульяновской ГСХА. 2017. №1 (37). URL: https://cyberleninka.ru/article/n/agroklimaticheskiy-potentsial-i-osnovnye-problemy-vliyaniya-klimaticheskih-izmeneniy-na-proizvodstvo-selskohozyaystvennyh-kultur (дата обращения: 12.02.2025).","Захаров А. И., & Шарипова Р.Б. (2017). Агроклиматический потенциал и основные проблемы влияния климатических изменений на производство сельскохозяйственных культур Ульяновской области. Вестник Ульяновской государственной сельскохозяйственной академии,  (1 (37)), 25-30.",https://cyberleninka.ru/article/n/agroklimaticheskiy-potentsial-i-osnovnye-problemy-vliyaniya-klimaticheskih-izmeneniy-na-proizvodstvo-selskohozyaystvennyh-kultur
Методы оценки баланса углерода в лесных экосистемах и возможности их использования для расчетов годичного депонирования углерода,"Малышева Н.В., Моисеев Б.Н., Филипчук А.Н., Золина Т.А.",Лесной вестник / Forestry bulletin,2017,"Сельское хозяйство, лесное хозяйство, рыбное хозяйство","депонирование углерода лесами, баланс углерода, лесные экосистемы, имитационное моделирование","annual carbon sequestration, carbon balance, forest ecosystems, model-based analysis, climate change","Рассмотрены основанные на моделировании различные методы оценки и прогноза запаса углерода в лесах, которые получили международное признание, в их числе: ИЗИС IIASA (Австрия), EFIMOD + ROMUL (Россия), РОБУЛ (Россия), Информационная система определения и картирования депонирования лесами углерода (Россия, УГЛТУ), CBM-CFS3 (Лесная служба Канады), FORCARB2 (Лесная служба США). Рассчитана и проиллюстрирована в картографической форме величина годичного депонирования углерода основными типами лесных экосистем зоны хвойно-широколиственных лесов Европейско-Уральской части России. Методика расчета базируется на рекомендациях МГЭИК ООН. В расчетах использованы данные Государственного лесного реестра (ГЛР). По данным ГЛР 2015 г. выполнены расчеты годичного накопления углерода в лесных экосистемах зоны хвойно-широколиственных (смешанных) лесов ЕУЧР. Получены следующие значения показателей, характеризующих скорость накопления органического вещества: NPP = 5,92; Rh = 3,96; NEP = 1,96 т С/га · год, а NBP = 2,02 т С/га · год. Полученные нами значения годичной продукции и эмиссии углерода согласуются с результатами расчетов для этой территории, сделанными научным коллективом IIASA. Расхождение оценок находится в пределах стандартных ошибок расчетов.V","Малышева Н. В., Моисеев Б. Н., Филипчук А. Н., Золина Т. А. Методы оценки баланса углерода в лесных экосистемах и возможности их использования для расчетов годичного депонирования углерода // Вестник МГУЛ – Лесной вестник. 2017. №1. URL: https://cyberleninka.ru/article/n/metody-otsenki-balansa-ugleroda-v-lesnyh-ekosistemah-i-vozmozhnosti-ih-ispolzovaniya-dlya-raschetov-godichnogo-deponirovaniya-ugleroda (дата обращения: 12.02.2025).","Малышева Н.В., Моисеев Б.Н., Филипчук А.Н., & Золина Т.А. (2017). Методы оценки баланса углерода в лесных экосистемах и возможности их использования для расчетов годичного депонирования углерода. Лесной вестник / Forestry bulletin, 21 (1), 4-13.",https://cyberleninka.ru/article/n/metody-otsenki-balansa-ugleroda-v-lesnyh-ekosistemah-i-vozmozhnosti-ih-ispolzovaniya-dlya-raschetov-godichnogo-deponirovaniya-ugleroda
