Title,Authors,Journal,Year,Field of Science,Russian Keywords,English Keywords,Annotation,GOST,APA,Link
Развитие и размещение сельскохозяйственных мелиораций в изменяющихся климатических условиях,"Кирейчева Людмила Владимировна, Глазунова Ирина Викторовна",Природообустройство,2017,"Сельское хозяйство, лесное хозяйство, рыбное хозяйство","изменение климата, аридный сценарий, гумидный сценарий, коэффициент увлажнения, сельскохозяйственная мелиорация, орошение, осушение","climate change, arid scenario, humid scenario, moisture ratio, agricultural reclamation, irrigation, drainage","Рассмотрены вопросы адаптации сельского хозяйства в условиях глобального и регионального изменения климатических показателей в европейской части России путем развития сельскохозяйственных мелиораций. Показано, что для сельского хозяйства европейской территории России ожидаются рост продолжительности вегетационного периода на 26 сут., повышение суммы активных температур, рост осадков на 26 мм, испаряемости на 141 мм. Предложена методика учета влияния возможных изменений климата на влагообеспеченность территории, для чего используются модели агроклиматического зонирования продуктивности, урожайности сельскохозяйственных культур в зависимости от коэффициентов теплои влагообеспеченности, модели водного режима. Это позволяет прогнозировать вероятность необходимости развития водных мелиораций в зависимости от изменения влагообеспеченности территории при климатических изменениях, возможные экологические последствия при изменении структуры и объема мелиоративных мероприятий и предлагать комплекс мероприятий по охране водных ресурсов. Выполненные расчеты по предложенной методике показали, что при изменении климата по аридному сценарию для Центральной европейской части России вероятность оптимальных условий для выращивания зерновых снижается в среднем на 23% и, как результат, возрастает вероятность необходимости проведения оросительных мелиораций на 51%. При этом снизится необходимость в осушительных мелиорациях на 25%, и следует ожидать, что понизится водообеспеченность территории в целом и, как следствие, усилится дефицит оросительной воды. При развитии ситуации по гумидному сценарию при увеличении коэффициента увлажнения снижение продуктивности зерновых не прогнозируется. При минимальном уровне оптимальных продуктивных влагозапасов для возделывания яровой пшеницы вероятность орошения составляет 0,16, а при максимальных значениях оптимального диапазона более 89 мм вероятность осушительных мелиораций дерново-подзолистых почв составляет 0,23, или 23%.","Кирейчева Людмила Владимировна, Глазунова Ирина Викторовна Развитие и размещение сельскохозяйственных мелиораций в изменяющихся климатических условиях // Природообустройство. 2017. №4. URL: https://cyberleninka.ru/article/n/razvitie-i-razmeschenie-selskohozyaystvennyh-melioratsiy-v-izmenyayuschihsya-klimaticheskih-usloviyah (дата обращения: 12.02.2025).","Кирейчева Людмила Владимировна, & Глазунова Ирина Викторовна (2017). Развитие и размещение сельскохозяйственных мелиораций в изменяющихся климатических условиях. Природообустройство,  (4), 80-87.",https://cyberleninka.ru/article/n/razvitie-i-razmeschenie-selskohozyaystvennyh-melioratsiy-v-izmenyayuschihsya-klimaticheskih-usloviyah
Система формирования высококачественных кормовых агроценозов для условий Ненецкого автономного округа РФ,"Филиппова А.Б., Романенко Т.М.",Вестник Красноярского государственного аграрного университета,2017,"Сельское хозяйство, лесное хозяйство, рыбное хозяйство","пойменный луг, система, модель, кормовые агроценозы, травосмесь","inundated meadow, system, model, fodder agrocenosis, grass mix","В статье представлена система формиро-вания высококачественных кормовых агроце-нозов, которая основана на полноценном ис-пользовании всех факторов интенсификации вида, сорта, системы удобрений и метеоро-логических условий, разработанная на регио-нальном уровне, позволяющая оценить влия-ние климатических изменений на стабиль-ность и продуктивность агрофитоценозов, а также прогнозировать урожайность много-летних культур в любом хозяйстве Ненецкого АО на перспективу. Цель исследования раз-работка системы формирования высококаче-ственных кормовых агроценозов в условиях Ненецкого АО РФ. Задача исследования вы-явить основные закономерности влияния природно-климатических условий и минераль-ного питания на рост и развитие сеяных тра-востоев. Методические основы реализации системы формирования агроценозов преду-сматривают коренное улучшение путем уско-ренного залужения малопродуктивных поймен-ных лугов с использованием ранее разрабо-танной технологии, включающей фрезерова-ние дернины, боронование, прикатывание поч-вы, внесение минеральных удобрений и посев многолетних трав. В результате проведенных исследований составлена модель форми-рования урожая сеяных травосмесей на фоне биологических особенностей и почвенных условий, элементов систем земледелия, уста-новлена роль климатических и агротехниче-ских факторов при формировании урожая, определен потенциал продукционного процесса, которые и являются основными условиями формирования высокопродуктивных кормовых агроценозов на примере рассматриваемых травосмесей в условиях Ненецкого автономного округа. Полученную модель можно ис-пользовать на практике для рационального применения источников питания с целью по-вышения продуктивности сеяных травосме-сей. Использование системы позволяет улучшить флористический состав лугов и повысить их урожайность в два раза при ежегодном внесении минеральных удобрений и сохранить продуктивное долголетие естественных травостоев.","Филиппова А. Б., Романенко Т. М. Система формирования высококачественных кормовых агроценозов для условий Ненецкого автономного округа РФ // Вестник КрасГАУ. 2017. №9. URL: https://cyberleninka.ru/article/n/sistema-formirovaniya-vysokokachestvennyh-kormovyh-agrotsenozov-dlya-usloviy-nenetskogo-avtonomnogo-okruga-rf (дата обращения: 12.02.2025).","Филиппова А.Б., & Романенко Т.М. (2017). Система формирования высококачественных кормовых агроценозов для условий Ненецкого автономного округа РФ. Вестник Красноярского государственного аграрного университета,  (9), 8-13.",https://cyberleninka.ru/article/n/sistema-formirovaniya-vysokokachestvennyh-kormovyh-agrotsenozov-dlya-usloviy-nenetskogo-avtonomnogo-okruga-rf
«Экологический менеджмент» лесов и изделий из древесины,Ксавье Деглиз,Лесной вестник / Forestry bulletin,2017,"Сельское хозяйство, лесное хозяйство, рыбное хозяйство","экологический менеджмент, выбросы парниковых газов, связывание углерода, лесные экосистемы, изделия из древесины","ecological management, greenhouse gases emissions, carbon sequestration, forest ecosystem, wood products","Антропогенное загрязнение атмосферы парниковыми газами (ПГ), образующимися в результате сжигания ископаемого топлива, и вырубка лесов являются причинами потепления климата вследствие увеличения средней температуры на поверхности Земли и приводят к разрушительным последствиям. Углекислый газ, который представляет 60 % от общего объема выбросов ПГ, играет самую важную роль в повышении температуры Земли, существует линейная корреляция между ростом температуры и концентрацией углекислого газа. Для снижения концентрации СO2 необходим «экологический менеджмент» лесов и изделий из древесины. Наиболее эффективными мерами изоляции углекислого газа путем его удаления и хранения из атмосферы в «поглотителях углерода» (таких как океаны, леса или почвы) являются: выращивание деревьев в плантационных лесах; изолирование углерода в деревьях вместо сжигания стволов деревьев; увеличение долговечности изделий из древесины; изолирование углекислого газа в возобновляемых химических продуктах (переработка древесной массы) и сырье; замена невозобновляемой энергии на энергию из лесных насаждений и древесных отходов, совместно с изделиями из древесины с истекшим сроком службы. Использование коэффициента ERoEI или EROI (соотношение полученной энергии к затраченной, энергетическая рентабельность) позволяет оптимизировать выбор возобновляемого источника энергии.",Ксавье Деглиз «Экологический менеджмент» лесов и изделий из древесины // Вестник МГУЛ – Лесной вестник. 2017. №4. URL: https://cyberleninka.ru/article/n/ekologicheskiy-menedzhment-lesov-i-izdeliy-iz-drevesiny (дата обращения: 12.02.2025).,"Ксавье Деглиз (2017). «Экологический менеджмент» лесов и изделий из древесины. Лесной вестник / Forestry bulletin, 21 (4), 6-9.",https://cyberleninka.ru/article/n/ekologicheskiy-menedzhment-lesov-i-izdeliy-iz-drevesiny
"Молекулярные маркеры генов, определяющих эффективность минерального питания у риса (Oryza sativa L. ): мини-обзор","Гончарова Ю.К., Харитонов Е.М., Шелег В.А.",Сельскохозяйственная биология,2017,"Сельское хозяйство, лесное хозяйство, рыбное хозяйство","рис, минеральное питание, эффективность использования азота и фосфора, микросателлитные (ssr) маркеры","qtl, rice, mineral nutrition, efficiency of use nitrogen and phosphorus, microsatellite (ssr) markers","В настоящее время на Азию и Европу приходятся самые высокие нормы расхода минеральных удобрений. Возникают серьезные проблемы, связанные с загрязнением окружающей среды, в том числе наблюдается подкисление почвы и воды, загрязнение поверхностных и подземных водных объектов, возрастает выброс парниковых газов. У риса, пшеницы и кукурузы коэффициент использования азота составляет 26-30 %, у овощных культур менее 20 % (K. Vinod с соавт., 2012). Последние 50 лет селекция сортов ведется на фоне высоких доз минерального питания. Сорта, которые высокопродуктивны за счет внесения удобрений, как правило, менее эффективно их используют. Кроме того, урожайность таких сортов очень нестабильна, поскольку на нее в значительной мере влияют дозы удобрений, сроки их внесения, температура окружающей среды и другие факторы. В настоящей статье рассмотрены механизмы приспособления растений риса к низкому содержанию азота и фосфора и генотипические различия образцов по эффективности использования этих элементов. Отмечается различная реакция генотипов на дозы вносимого азота и фосфора, а также влияние источника элемента питания и взаимодействия генотип-среда на реакцию сортов. Сравнение генотипов риса показало 20-кратное различие в эффективности усвоения фосфора между крайними типами (M. Wissuwa с соавт., 2001). Все высокоэффективные генотипы это стародавние сорта или эндемичные образцы. Питательные вещества в почве должны быть переведены в доступную для растений форму. Так, генотипические различия в эффективности использования фосфора у разных культур связаны с неодинаковой активностью фосфатаз. Фитиновая кислота одно из веществ, способствующих переводу связанного фосфора в доступный (A.E. Ric-hardson с соавт., 2001). Ее образуют корни растений и микроорганизмы, поэтому свойство корней поддерживать выгодные микробные сообщества служит дополнительным адаптивным механизмом. Другие приспособления растений к низкому содержанию азота и фосфора могут быть связаны с увеличением поверхности корневой системы, интенсификацией поглощения элементов, повышением внутренней эффективности их использования, а также с биосинтезом и выделением корнями органических кислот, повышающих доступность элементов питания (H. Lambers с соавт., 2006). Под внутренней эффективностью в указанном случае понимается перераспределение поступающего элемента питания между генеративными и вегетативными органами, между листьями одного или разных побегов и т.д. Вариабельность по эффективности использования элементов минерального питания среди генотипов риса главным образом объясняется различиями в росте корневой системы, что увеличивает площадь питания растений. Вариабельность устойчивости к недостатку фосфора в большей степени связана с различиями генотипов риса по способности поглощать этот элемент, в то время как эффективность его использования оказывает незначительное влияние. Описаны молекулярные маркеры, которые сцеплены с QTL, определяющими эффективность минерального питания у риса, RM 53, RM 25, RM 600, RM 242, RM 235, RM 247, RM 322, RM 13, RM 261, RM 19 (D. Wei с соавт., 2012; Y. Cho с соавт., 2007). У российских сортов риса выявлен полиморфизм для всех изученных маркеров QTL, определяющих эффективность поглощения элементов минерального питания (Ю.К. Гончарова с соавт., 2015), что позволяет вести маркерную селекцию по этому признаку и отбор сортов-доноров.","Гончарова Ю. К., Харитонов Е. М., Шелег В. А. Молекулярные маркеры генов, определяющих эффективность минерального питания у риса (Oryza sativa L. ): мини-обзор // С.-х. биол., Сельхозбиология, S-h biol, Sel-hoz biol, Sel\u0027skokhozyaistvennaya biologiya, Agricultural Biology. 2017. №3. URL: https://cyberleninka.ru/article/n/molekulyarnye-markery-genov-opredelyayuschih-effektivnost-mineralnogo-pitaniya-u-risa-oryza-sativa-l-mini-obzor (дата обращения: 12.02.2025).","Гончарова Ю.К., Харитонов Е.М., & Шелег В.А. (2017). Молекулярные маркеры генов, определяющих эффективность минерального питания у риса (Oryza sativa L. ): мини-обзор. Сельскохозяйственная биология, 52 (3), 515-525.",https://cyberleninka.ru/article/n/molekulyarnye-markery-genov-opredelyayuschih-effektivnost-mineralnogo-pitaniya-u-risa-oryza-sativa-l-mini-obzor
