Title,Authors,Journal,Year,Field of Science,Russian Keywords,English Keywords,Annotation,GOST,APA,Link
ПЕРЕРАБОТКА ОРГАНИЧЕСКИХ ОТХОДОВ: АНАЛИЗ ОТЕЧЕСТВЕННОГО ОПЫТА И ПРЕДПОСЫЛКИ ДЛЯ ВНЕДРЕНИЯ,"Боровенко М.Е., Андреева Т.С.",Инновационная наука,2022,Экологические биотехнологии,"твердые коммунальные отходы, органическая фракция, пищевые отходы, мусорные полигоны, переработка отходов",,"В работе представлен анализ технологий переработки органической фракции отходов на территории Российской Федерации. Описан опыт внедрения системы раздельного сбора отходов в России. Описаны технологии промышленной переработки пищевых отходов и перспективы их внедрения. Приведена практика обращения с органическими отходами на территории ХМАО-Югры, а также представлены ключевые моменты проекта по переработке пищевых отходов в г. Лангепас.","Боровенко М. Е., Андреева Т. С. ПЕРЕРАБОТКА ОРГАНИЧЕСКИХ ОТХОДОВ: АНАЛИЗ ОТЕЧЕСТВЕННОГО ОПЫТА И ПРЕДПОСЫЛКИ ДЛЯ ВНЕДРЕНИЯ // Инновационная наука. 2022. №4-2. URL: https://cyberleninka.ru/article/n/pererabotka-organicheskih-othodov-analiz-otechestvennogo-opyta-i-predposylki-dlya-vnedreniya (дата обращения: 25.10.2024).","Боровенко М.Е., & Андреева Т.С. (2022). ПЕРЕРАБОТКА ОРГАНИЧЕСКИХ ОТХОДОВ: АНАЛИЗ ОТЕЧЕСТВЕННОГО ОПЫТА И ПРЕДПОСЫЛКИ ДЛЯ ВНЕДРЕНИЯ. Инновационная наука,  (4-2), 40-43.",https://cyberleninka.ru/article/n/pererabotka-organicheskih-othodov-analiz-otechestvennogo-opyta-i-predposylki-dlya-vnedreniya
ОБЩИЙ СОСТАВ СТОЧНЫХ ВОД ГОРОДА ГЯНДЖИ (АЗЕРБАЙДЖАН),Гасанова Сима,Бюллетень науки и практики,2022,Экологические биотехнологии,"сточные воды, механический состав, химический состав, загрязняющие вещества",,"Представлены результаты исследования механического состава сточных вод г. Гянджи (Азербайджан). Установлено, что смеси сточных вод, независимо от происхождения, по размеру частиц делятся на четыре группы: в первую группу смесей входят органические и неорганические микроорганизмы, бактерии и яйца гельминтов. Вторую группу дисперсных частиц составляют коллоидные вещества размером не менее 10-6 см. К третьей группе относятся смеси размером частиц 10-7 см, имеющие степень молекулярной дисперсности. Смеси четвертой группы имеют размер частиц менее 10-8 см, что соответствует ионной степени дисперсности. Загрязнения сточными водами по своей природе подразделяются на органические, минеральные и биологические. Определены концентрации (мг/л) загрязняющих веществ в общих сточных водах города Гянджа и рекомендовано использование водоочистительных сооружений.",Гасанова Сима ОБЩИЙ СОСТАВ СТОЧНЫХ ВОД ГОРОДА ГЯНДЖИ (АЗЕРБАЙДЖАН) // Бюллетень науки и практики. 2022. №4. URL: https://cyberleninka.ru/article/n/obschiy-sostav-stochnyh-vod-goroda-gyandzhi-azerbaydzhan (дата обращения: 25.10.2024).,"Гасанова Сима (2022). ОБЩИЙ СОСТАВ СТОЧНЫХ ВОД ГОРОДА ГЯНДЖИ (АЗЕРБАЙДЖАН). Бюллетень науки и практики, 8 (4), 106-112.",https://cyberleninka.ru/article/n/obschiy-sostav-stochnyh-vod-goroda-gyandzhi-azerbaydzhan
РЕКУЛЬТИВАЦИЯ НЕФТЕЗАГРЯЗНЕННЫХ ЗЕМЕЛЬ АПШЕРОНСКОГО ПОЛУОСТРОВА,"Вердиева Фарида Бахрам, Алиева Тахира Рафаэль, Исмайлова Мехсети Эйваз",Бюллетень науки и практики,2022,Экологические биотехнологии,"нефть и нефтепродукты, физические и химические показатели, нефтезагрязненные почвы, питательные элементы",,"В статье рассматриваются вопросы загрязнения земель Апшеронского полуострова нефтью и нефтепродуктами. Проанализированы физические, химические и физико-химические показатели почв. Рассмотрены вопросы рекультивации и восстановления техногенно-нарушенных и нефтезагрязненных земель Апшеронского полуострова.","Вердиева Фарида Бахрам, Алиева Тахира Рафаэль, Исмайлова Мехсети Эйваз РЕКУЛЬТИВАЦИЯ НЕФТЕЗАГРЯЗНЕННЫХ ЗЕМЕЛЬ АПШЕРОНСКОГО ПОЛУОСТРОВА // Бюллетень науки и практики. 2022. №5. URL: https://cyberleninka.ru/article/n/rekultivatsiya-neftezagryaznennyh-zemel-apsheronskogo-poluostrova (дата обращения: 25.10.2024).","Вердиева Фарида Бахрам, Алиева Тахира Рафаэль, & Исмайлова Мехсети Эйваз (2022). РЕКУЛЬТИВАЦИЯ НЕФТЕЗАГРЯЗНЕННЫХ ЗЕМЕЛЬ АПШЕРОНСКОГО ПОЛУОСТРОВА. Бюллетень науки и практики, 8 (5), 186-191.",https://cyberleninka.ru/article/n/rekultivatsiya-neftezagryaznennyh-zemel-apsheronskogo-poluostrova
АНАЛИЗ РЕКУЛЬТИВАЦИИ ЛЕСНЫХ ЗЕМЕЛЬ,"Мартынова Наталья Григорьевна, Меркурьева Кристина Рудольфовна",International agricultural journal,2022,Экологические биотехнологии,"рекультивация, нарушенные земли, лес, лесные земли, лесовосстановление",,"В статье приведен анализ возможности рекультивации земель при строительстве объекта капитального строительства. Цель исследования состоит в том, чтобы изучить предотвращение деградации лесных земель и (или) восстановление их плодородия посредством приведения земель в состояние, пригодное для их использования. В связи с этим, приведено практическое решение на примере процесс рекультивации лесных земель при возведении объектов капитального строительства, расположенным на склоне горы.","Мартынова Наталья Григорьевна, Меркурьева Кристина Рудольфовна АНАЛИЗ РЕКУЛЬТИВАЦИИ ЛЕСНЫХ ЗЕМЕЛЬ // IACJ. 2022. №3. URL: https://cyberleninka.ru/article/n/analiz-rekultivatsii-lesnyh-zemel (дата обращения: 25.10.2024).","Мартынова Наталья Григорьевна, & Меркурьева Кристина Рудольфовна (2022). АНАЛИЗ РЕКУЛЬТИВАЦИИ ЛЕСНЫХ ЗЕМЕЛЬ. International agricultural journal,  (3), 14.",https://cyberleninka.ru/article/n/analiz-rekultivatsii-lesnyh-zemel
ОПТИМИЗАЦИЯ ТЕХНОЛОГИИ ОЧИСТКИ ПРОМЫШЛЕННЫХ СТОЧНЫХ ВОД УЗБЕКИСТАНА,"Урунова Хуршида Шодиевна, Ахмедова Назира Махмудовна, Муртозаева Мохинабону, Уткирова Шахноза",Universum: технические науки,2022,Экологические биотехнологии,"сточные воды, очистка, очистные сооружения, промышленные предприятия, промышленные стоки, загрязнения, окружающая среда, утилизация, методы обработки, негативное влияние",,"В статье рассматриваются проблемы очистки промышленных сточных вод, а также приводятся результаты теоретического изучения, термодинамического обоснования и практической перспективы использования оксидов азота (NO2, NO) в место SO2 в регенерации цианистых растворов производства благородных металлов.","Урунова Хуршида Шодиевна, Ахмедова Назира Махмудовна, Муртозаева Мохинабону, Уткирова Шахноза ОПТИМИЗАЦИЯ ТЕХНОЛОГИИ ОЧИСТКИ ПРОМЫШЛЕННЫХ СТОЧНЫХ ВОД УЗБЕКИСТАНА // Universum: технические науки. 2022. №6-5 (99). URL: https://cyberleninka.ru/article/n/optimizatsiya-tehnologii-ochistki-promyshlennyh-stochnyh-vod-uzbekistana (дата обращения: 25.10.2024).","Урунова Хуршида Шодиевна, Ахмедова Назира Махмудовна, Муртозаева Мохинабону, & Уткирова Шахноза (2022). ОПТИМИЗАЦИЯ ТЕХНОЛОГИИ ОЧИСТКИ ПРОМЫШЛЕННЫХ СТОЧНЫХ ВОД УЗБЕКИСТАНА. Universum: технические науки,  (6-5 (99)), 53-56.",https://cyberleninka.ru/article/n/optimizatsiya-tehnologii-ochistki-promyshlennyh-stochnyh-vod-uzbekistana
"АНАЛИЗ СОСТОЯНИЯ РОССИЙСКОГО РЫНКА ЭКОЛОГИЧЕСКИХ УСЛУГ ПО ОБРАБОТКЕ, УТИЛИЗАЦИИ И ОБЕЗВРЕЖИВАНИЮ ОТХОДОВ","Саадулаева Т.А., Полозина Т.Н.",Международный журнал гуманитарных и естественных наук,2022,Экологические биотехнологии,"рынок экологических услуг, отходы производства и потребления, обработка, утилизация, обезвреживание отходов, вторичное сырье, рециклинг, рекуперация, регенерация",,"Статья посвящена анализу современного состояния рынка экологических услуг по обработке, утилизации и обезвреживанию отходов в РФ. Рассмотрены особенности формирования рынка по обработке, утилизации и обезвреживанию отходов в РФ. Проведен мониторинг текущего состояния рынка с учетом показателей, позволяющих оценить его влияние на объем образования отходов, на повторное их использование, на улучшение экологической ситуации в России. На основе анализа выявлены актуальные проблемы обращения с отходами в Российской Федерации.","Саадулаева Т. А., Полозина Т. Н. АНАЛИЗ СОСТОЯНИЯ РОССИЙСКОГО РЫНКА ЭКОЛОГИЧЕСКИХ УСЛУГ ПО ОБРАБОТКЕ, УТИЛИЗАЦИИ И ОБЕЗВРЕЖИВАНИЮ ОТХОДОВ // Международный журнал гуманитарных и естественных наук. 2022. №6-3. URL: https://cyberleninka.ru/article/n/analiz-sostoyaniya-rossiyskogo-rynka-ekologicheskih-uslug-po-obrabotke-utilizatsii-i-obezvrezhivaniyu-othodov (дата обращения: 25.10.2024).","Саадулаева Т.А., & Полозина Т.Н. (2022). АНАЛИЗ СОСТОЯНИЯ РОССИЙСКОГО РЫНКА ЭКОЛОГИЧЕСКИХ УСЛУГ ПО ОБРАБОТКЕ, УТИЛИЗАЦИИ И ОБЕЗВРЕЖИВАНИЮ ОТХОДОВ. Международный журнал гуманитарных и естественных наук,  (6-3), 215-222. doi: 10.24412/2500-1000-2022-6-3-215-222",https://cyberleninka.ru/article/n/analiz-sostoyaniya-rossiyskogo-rynka-ekologicheskih-uslug-po-obrabotke-utilizatsii-i-obezvrezhivaniyu-othodov
КИСЛОТНЫЕ ОСАДКИ - АНТРОПОГЕННАЯ ДЕЯТЕЛЬНОСТЬ: ЭКОЛОГИЧЕСКИЕ ПРОБЛЕМЫ,Байчорова А.К.,Международный журнал гуманитарных и естественных наук,2022,Экологические биотехнологии,"угарный газ, свинец, промышленность, транспорт, парниковый эффект, экологическая ситуация, промышленное производство, автотранспорт, разрушение озонового слоя, закисление почв, закисление пресных водоемов, кислотный дождь, сернистый газ, оксид азота, частицы пыли",,"В статье сделан обзор экологических проблем, связанных с образованием кислотных осадков, как следствие антропогенной деятельности. Рассмотрены аспекты причин образования кислотных осадков, как результат антропогенной деятельности, т.е. следующие факторы (промышленное производство, автотранспортное загрязнение и т.д.). Предложены меры и мероприятия по сокращению образования и выпадения кислотных осадков.",Байчорова А. К. КИСЛОТНЫЕ ОСАДКИ - АНТРОПОГЕННАЯ ДЕЯТЕЛЬНОСТЬ: ЭКОЛОГИЧЕСКИЕ ПРОБЛЕМЫ // Международный журнал гуманитарных и естественных наук. 2022. №6-1. URL: https://cyberleninka.ru/article/n/kislotnye-osadki-antropogennaya-deyatelnost-ekologicheskie-problemy (дата обращения: 25.10.2024).,"Байчорова А.К. (2022). КИСЛОТНЫЕ ОСАДКИ - АНТРОПОГЕННАЯ ДЕЯТЕЛЬНОСТЬ: ЭКОЛОГИЧЕСКИЕ ПРОБЛЕМЫ. Международный журнал гуманитарных и естественных наук,  (6-1), 10-12. doi: 10.24412/2500-1000-2022-6-1-10-12",https://cyberleninka.ru/article/n/kislotnye-osadki-antropogennaya-deyatelnost-ekologicheskie-problemy
ТЕХНОЛОГИИ УСТОЙЧИВОГО РАЗВИТИЯ ТЕРРИТОРИЙ: ФИТОРЕМЕДИАЦИЯ КАК ИННОВАЦИОННЫЙ МЕТОД САНАЦИИ ДЕПРЕССИВНЫХ ТЕРРИТОРИЙ,"Демин Александр Васильевич, Рыбальченко Илья Владимирович, Милькина Ирина Владимировна, Жандарова Юлия Александровна",Вестник Российского университета дружбы народов. Серия: Государственное и муниципальное управление,2022,Экологические биотехнологии,"устойчивое развитие, государственное и муниципальное управление, пространственная интеграция, депрессивные территории, загрязнение окружающей среды, фиторемедиация, экология",,"Проанализированы вопросы устойчивого развития территорий в части решения проблем загрязнения земельных участков, выделенных под жилищное строительство, и оценки возможности применения инновационных методов санации почв на депрессивных территориях, образовавшихся в результате городской пространственной интеграции, не обладающих инвестиционной привлекательностью. Выяснены и описаны наиболее значимые сложности, связанные с ростом поселений в процессе интеграции территорий Новой Москвы, и выносятся предложения по устранению влияния загрязнения территорий на социально-экономическое развитие. Предложены современные управленческие приемы по ликвидации проблем экологического характера на интегрированной территории. Раскрыто содержание понятие фиторемедиации как инновационного метода борьбы с загрязнениями, доступного в муниципальных образованиях. Описаны результаты научного эксперимента по извлечению тяжелых металлов на депрессивных территориях на примере полигона отходов «Саларьево». Раскрыта экономическая целесообразность применения данного метода по сравнению с устаревшими. Предлагаемые инновационные управленческие решения будут полезны специалистам государственных и муниципальных служб на всей территории Российской Федерации. Кроме того, авторы впервые предлагают концептуальный подход к местам хранения отходов как социально-экологическим системам, что позволяет обоснованно применять к ним управленческие методы и подходы системного управления.","Демин Александр Васильевич, Рыбальченко Илья Владимирович, Милькина Ирина Владимировна, Жандарова Юлия Александровна ТЕХНОЛОГИИ УСТОЙЧИВОГО РАЗВИТИЯ ТЕРРИТОРИЙ: ФИТОРЕМЕДИАЦИЯ КАК ИННОВАЦИОННЫЙ МЕТОД САНАЦИИ ДЕПРЕССИВНЫХ ТЕРРИТОРИЙ // Вестник Российского университета дружбы народов. Серия: Государственное и муниципальное управление. 2022. №2. URL: https://cyberleninka.ru/article/n/tehnologii-ustoychivogo-razvitiya-territoriy-fitoremediatsiya-kak-innovatsionnyy-metod-sanatsii-depressivnyh-territoriy (дата обращения: 25.10.2024).","Демин Александр Васильевич, Рыбальченко Илья Владимирович, Милькина Ирина Владимировна, & Жандарова Юлия Александровна (2022). ТЕХНОЛОГИИ УСТОЙЧИВОГО РАЗВИТИЯ ТЕРРИТОРИЙ: ФИТОРЕМЕДИАЦИЯ КАК ИННОВАЦИОННЫЙ МЕТОД САНАЦИИ ДЕПРЕССИВНЫХ ТЕРРИТОРИЙ. Вестник Российского университета дружбы народов. Серия: Государственное и муниципальное управление, 9 (2), 124-136.",https://cyberleninka.ru/article/n/tehnologii-ustoychivogo-razvitiya-territoriy-fitoremediatsiya-kak-innovatsionnyy-metod-sanatsii-depressivnyh-territoriy
ЭКОЛОГИЧЕСКАЯ ОБСТАНОВКА В РЕГИОНАХ БАЗИРОВАНИЯ РОССИЙСКИХ КОРПОРАЦИЙ ЦВЕТНОЙ МЕТАЛЛУРГИИ,Палкина Д.С.,Экономика и экология территориальных образований,2022,Экологические биотехнологии,"алюминий, металлургия, цветная металлургия, загрязнение атмосферы, вредные вещества, экологическая безопасность",,"Металлургические предприятия и иные субъекты хозяйствования, деятельность которых связана с прямым или косвенным воздействием на окружающую среду, должны выполнять законодательные требования в области ее охраны. С каждым годом эти требования становятся всё более жесткими, что связано в первую очередь с потерями, которые окружающая среда уже понесла и на восстановление которых уйдет много времени. Поэтому многие компания как металлургической, так и других сфер деятельности заинтересованы в уменьшении количества выбрасываемых загрязняющих веществ. Повышение качества и уровня используемого оборудования ведет не только к увеличению объемов производства, но и к сокращению вреда для окружающей среды. Цель данного исследования состоит в том, чтобы изучить негативное влияние производства на состояние окружающей среды. Сделанные выводы помогут увидеть тенденции в сфере охраны окружающей среды.",Палкина Д. С. ЭКОЛОГИЧЕСКАЯ ОБСТАНОВКА В РЕГИОНАХ БАЗИРОВАНИЯ РОССИЙСКИХ КОРПОРАЦИЙ ЦВЕТНОЙ МЕТАЛЛУРГИИ // Экономика и экология территориальных образований. 2022. №1. URL: https://cyberleninka.ru/article/n/ekologicheskaya-obstanovka-v-regionah-bazirovaniya-rossiyskih-korporatsiy-tsvetnoy-metallurgii (дата обращения: 25.10.2024).,"Палкина Д.С. (2022). ЭКОЛОГИЧЕСКАЯ ОБСТАНОВКА В РЕГИОНАХ БАЗИРОВАНИЯ РОССИЙСКИХ КОРПОРАЦИЙ ЦВЕТНОЙ МЕТАЛЛУРГИИ. Экономика и экология территориальных образований,  (1), 43-54.",https://cyberleninka.ru/article/n/ekologicheskaya-obstanovka-v-regionah-bazirovaniya-rossiyskih-korporatsiy-tsvetnoy-metallurgii
