Title,Authors,Journal,Year,Field of Science,Russian Keywords,English Keywords,Annotation,GOST,APA,Link
ПЕРСПЕКТИВЫ ИСПОЛЬЗОВАНИЯ КОНСОРЦИУМОВ МИКРООРГАНИЗМОВ И ВЫСШИХ РАСТЕНИЙ В ВОССТАНОВЛЕНИИ НЕФТЕЗАГРЯЗНЕННЫХ ЗЕМЕЛЬ,"Бухарина Ирина Леонидовна, Исупова Анастасия Анатольевна, Лямзин Владимир Иванович, Лебедева Мария Андреевна",Лесной вестник / Forestry bulletin,2022,Экологические биотехнологии,"нефтяное загрязнение почв, биоремедиация, биологическая активность почвы, микроскопические грибы, биопрепарат",,"Приведены результаты исследований по использованию культур микроскопических эндотрофных грибов в восстановлении нефтезагрязненных почв. Проведены исследования пределов устойчивости к действию различных концентраций нефти у изолятов (культур) микроскопических грибов Fusarium equiseti (Corda) Sacc и Cylindrocarpon magnusianum Wollenw, выделенных из урбанопочв с высоким уровнем загрязнения. Выявлены их широкие пределы толерантности к содержанию нефти. В рамках проведенного лабораторного эксперимента по моделированию 5 и 10 % загрязнения дерново-подзолистой супесчаной и суглинистой почв нефтью определена эффективность очистки нефтезагрязненных почв с помощью биопрепарата «Микрозим Петро Трит», содержащего бактерии деструкторов нефти, фиторемедианта мятлика лугового - Poa pratensis L. и микроскопического гриба Cylindrocarpon magnusianum Wollenw. При использовании этой же совокупности биоремедиантов и микроскопического гриба Fusarium equiseti (Corda) Sacc определена эффективность восстановления биологической активности нефтезагрязненных почв. Полученные результаты доказали эффективность совместного применения биопрепарата, фиторемедианта и микроскопических грибов для очистки и восстановления нефтезагрязненных почв.","Бухарина Ирина Леонидовна, Исупова Анастасия Анатольевна, Лямзин Владимир Иванович, Лебедева Мария Андреевна ПЕРСПЕКТИВЫ ИСПОЛЬЗОВАНИЯ КОНСОРЦИУМОВ МИКРООРГАНИЗМОВ И ВЫСШИХ РАСТЕНИЙ В ВОССТАНОВЛЕНИИ НЕФТЕЗАГРЯЗНЕННЫХ ЗЕМЕЛЬ // Вестник МГУЛ – Лесной вестник. 2022. №6. URL: https://cyberleninka.ru/article/n/perspektivy-ispolzovaniya-konsortsiumov-mikroorganizmov-i-vysshih-rasteniy-v-vosstanovlenii-neftezagryaznennyh-zemel (дата обращения: 25.10.2024).","Бухарина Ирина Леонидовна, Исупова Анастасия Анатольевна, Лямзин Владимир Иванович, & Лебедева Мария Андреевна (2022). ПЕРСПЕКТИВЫ ИСПОЛЬЗОВАНИЯ КОНСОРЦИУМОВ МИКРООРГАНИЗМОВ И ВЫСШИХ РАСТЕНИЙ В ВОССТАНОВЛЕНИИ НЕФТЕЗАГРЯЗНЕННЫХ ЗЕМЕЛЬ. Лесной вестник / Forestry bulletin, 26 (6), 14-23.",https://cyberleninka.ru/article/n/perspektivy-ispolzovaniya-konsortsiumov-mikroorganizmov-i-vysshih-rasteniy-v-vosstanovlenii-neftezagryaznennyh-zemel
"ФИТОРЕМЕДИАЦИЯ ПОЧВ, ЗАГРЯЗНЕННЫХ ИОНАМИ ТЯЖЕЛЫХ МЕТАЛЛОВ, С ПОМОЩЬЮ ДРЕВЕСНЫХ И КУСТАРНИКОВЫХ РАСТЕНИЙ",Фрунзе Оксана Валентиновна,Лесной вестник / Forestry bulletin,2022,Экологические биотехнологии,"кобальт, марганец, хром, техногенное загрязнение, фиторемедиация, растения-гипераккумуляторы, сорбционная способность",,"Проанализировано использование древесных и кустарниковых растений с развитой корневой системой и большой биомассой в технологии фиторемедиации почв, загрязненных тяжелыми металлами. Древесные растения могут применяться в процессе фитовосстановления городских систем в качестве долгосрочных поглотителей ионов тяжелых металлов из почвы. Рассмотрены основные механизмы фиторемедиации загрязненных урбанизированных территорий с помощью древесных и кустарниковых растений. Исследована сорбционная способность ионов кобальта, марганца и хрома некоторыми видами древесных и кустарниковых растений. Изучено накопление тяжелых металлов проростками в условиях загрязнения почвы ионами кобальта, марганца и хрома. Определен фактор переноса ионов кобальта, марганца и хрома для изученных видов растений. Выявлены виды-гипераккумуляторы тяжелых металлов - Gleditsia triacanthos L., Caragána arboréscens L., которые можно использовать для фитовосстановления почв техногенного региона, загрязненных ионами кобальта, марганца и хрома. Отмечены низкие концентрации кобальта, марганца и хрома у проростков Quercus robur L. и Robinia pseudoacacia L. в надземной части, что свидетельствует об их способности исключать ионы тяжелых металлов из своих надземных частей. Установлено, что устойчивые к загрязнению почвы проростки Gleditsia triacanthos L., Caragána arboréscens L. вследствие своей превосходной приспособляемости даже на деградированной и загрязненной тяжелыми металлами почве опытного участка обладают высоким уровнем накопления биомассы без достоверных фактов угнетения ростовых процессов. Во время контролируемого процесса фиторемедиации, проводимого в полевых условиях отмечена их высокая сорбционная способность, позволяющая рекомендовать указанные виды к использованию в технологиях восстановления почв, загрязненных ионами тяжелых металлов.","Фрунзе Оксана Валентиновна ФИТОРЕМЕДИАЦИЯ ПОЧВ, ЗАГРЯЗНЕННЫХ ИОНАМИ ТЯЖЕЛЫХ МЕТАЛЛОВ, С ПОМОЩЬЮ ДРЕВЕСНЫХ И КУСТАРНИКОВЫХ РАСТЕНИЙ // Вестник МГУЛ – Лесной вестник. 2022. №6. URL: https://cyberleninka.ru/article/n/fitoremediatsiya-pochv-zagryaznennyh-ionami-tyazhelyh-metallov-s-pomoschyu-drevesnyh-i-kustarnikovyh-rasteniy (дата обращения: 25.10.2024).","Фрунзе Оксана Валентиновна (2022). ФИТОРЕМЕДИАЦИЯ ПОЧВ, ЗАГРЯЗНЕННЫХ ИОНАМИ ТЯЖЕЛЫХ МЕТАЛЛОВ, С ПОМОЩЬЮ ДРЕВЕСНЫХ И КУСТАРНИКОВЫХ РАСТЕНИЙ. Лесной вестник / Forestry bulletin, 26 (6), 92-98.",https://cyberleninka.ru/article/n/fitoremediatsiya-pochv-zagryaznennyh-ionami-tyazhelyh-metallov-s-pomoschyu-drevesnyh-i-kustarnikovyh-rasteniy
"БИОГЕОХИМИЧЕСКИЕ ТЕХНОЛОГИИ РЕКУЛЬТИВАЦИИ ПИРОГЕННЫХ И ЗАГРЯЗНЕННЫХ УГЛЕВОДОРОДАМИ ПОЧВ, НЕЙТРАЛИЗАЦИЯ УГЛЕВОДОРОДНЫХ ШЛАМОВ","В.Н. Башкин , И.С. Прохоров",Агрохимический вестник,2022,Экологические биотехнологии,"загрязнение почвы, рекультивация почв, биопрепараты, каталаза, дегидрогеназа, московская область, ставропольский край","soil contamination, soil recultivation, biopreparations, catalase, dehydrogenase, the moscow regon, the stavropol region","Представлены результаты изучения действия in situ биокомпоста «ПИКСА» при восстановлении нарушенных почв в Ставропольском крае. Показана эффективность использования биокомпоста для рекультивации пирогенных почв, прилегающих к круглому контуру объекта газовой промышленности (берма амбара). В течение 42 суток эксперимента активность каталазы в зависимости от дозы внесения возрастала соответственно в 1,4 и 1,6; дегидрогеназы – в 2,5 и 3,0 раза, при этом биомасса многолетних злаковых трав возрастала соответственно в 1,8 и 2,3 раза. При использовании биокомпоста для рекультивации загрязненных углеводородами почв на территории дожимной компрессорной станции («продувочная свеча») в течение 42 суток активность каталазы в зависимости от дозы внесения повышалась в 1,9 и 2,4 раза; дегидрогеназы – в 5,8 и 8,9 раза. При этом биомасса многолетних злаковых трав возрастала соответственно в 8,6 и 16,9 раза. Добавление биокомпоста в шлам газового конденсата, хранившегося в пруденакопителе, позволило отметить устойчивую активность каталазы (3,3 мл О2/(мин∙г)) и дегидрогеназы (11 мг С19Н16N4)/(г∙сут)) на 42-е сутки по сравнению с нулевыми значениями в начале эксперимента. Испытания биокомпоста, а также биопрепарата «Биорос» при разложении газового конденсата и углеводородов нефти in vitro в Московской области также подтвердили их эффективность по ферментативной активности.","В Н. Башкин, И С. Прохоров БИОГЕОХИМИЧЕСКИЕ ТЕХНОЛОГИИ РЕКУЛЬТИВАЦИИ ПИРОГЕННЫХ И ЗАГРЯЗНЕННЫХ УГЛЕВОДОРОДАМИ ПОЧВ, НЕЙТРАЛИЗАЦИЯ УГЛЕВОДОРОДНЫХ ШЛАМОВ // Агрохимический вестник. 2022. №6. URL: https://cyberleninka.ru/article/n/biogeohimicheskie-tehnologii-rekultivatsii-pirogennyh-i-zagryaznennyh-uglevodorodami-pochv-neytralizatsiya-uglevodorodnyh-shlamov (дата обращения: 25.10.2024).","В.Н. Башкин , & И.С. Прохоров (2022). БИОГЕОХИМИЧЕСКИЕ ТЕХНОЛОГИИ РЕКУЛЬТИВАЦИИ ПИРОГЕННЫХ И ЗАГРЯЗНЕННЫХ УГЛЕВОДОРОДАМИ ПОЧВ, НЕЙТРАЛИЗАЦИЯ УГЛЕВОДОРОДНЫХ ШЛАМОВ. Агрохимический вестник,  (6), 90-96. doi: 10.24412/1029-2551-2022-6-017",https://cyberleninka.ru/article/n/biogeohimicheskie-tehnologii-rekultivatsii-pirogennyh-i-zagryaznennyh-uglevodorodami-pochv-neytralizatsiya-uglevodorodnyh-shlamov
ПЕРСПЕКТИВНЫЕ ТЕХНОЛОГИИ БИОРЕМЕДИАЦИИ СТОЧНЫХ ВОД ЗОЛОТОДОБЫВАЮЩИХ ПРЕДПРИЯТИЙ УЗБЕКИСТАНА,"Тимофеева С.С., Дроздова И.В., Бобоев A.А., Хужжиев С.О., Фарманова М.А.",XXI век. Техносферная безопасность,2022,Экологические биотехнологии,"биоремедиация, сточные воды, золотодобыча, хвостохранилище, водные растения, очистительный потенциал, цветные металлы, экологически чистая технология",,"Всё возрастающие объемы добычи золота в Республике Узбекистан требуют увеличения расходов водных ресурсов. В то же время подразделения Навоийского ГМК расположены на засушливых, маловодных территориях с высоким (40-80 %) и экстремальным (более 80 %) дефицитом воды. В связи с этим для предприятия остро стоит проблема водоснабжения, водоотведения и совершенствования системы замкнутого водооборота с применением инновационных биотехнологических решений. Целью настоящей работы является обобщение современных данных об использовании на горнодобывающих предприятиях технологий биоремедиации сточных вод и оценка перспектив использования такой технологии на НГМК. В работе обобщены представленные в литературе данные об использовании биоремедиации на горных предприятиях России и других стран, а также данные собственных экспериментальных исследований очистительных функций растений Узбекистана. Указанные исследования проводились в условиях лабораторного моделирования с использованием сточных вод из прудков хвостохранилища ГМЗ-2 и ГМЗ-3 НГМК. Были изучены очистительные функции растений долины реки Заравшан: эйхорнии, пистии, азолы и ряски малой. В результате исследования установлено, что наиболее высокий очистительный потенциал имеет эйхорния: благодаря высокой активности цианидутилизирующего фермента бета-цианаланинсинтазы она накапливает металлы и метаболизирует цианиды. Пистия и азола оказались неустойчивыми к высокому уровню солесодержания, и их необходимо адаптировать путем дополнительного внесения органических веществ, в частности овечьего навоза. Следующим этапом должны стать полупромышленные испытания в условиях хвостохралища и разработка технического регламента.","Тимофеева С. С., Дроздова И. В., Бобоев A. А., Хужжиев С. О., Фарманова М. А. ПЕРСПЕКТИВНЫЕ ТЕХНОЛОГИИ БИОРЕМЕДИАЦИИ СТОЧНЫХ ВОД ЗОЛОТОДОБЫВАЮЩИХ ПРЕДПРИЯТИЙ УЗБЕКИСТАНА // XXI век. Техносферная безопасность. 2022. №4 (28). URL: https://cyberleninka.ru/article/n/perspektivnye-tehnologii-bioremediatsii-stochnyh-vod-zolotodobyvayuschih-predpriyatiy-uzbekistana (дата обращения: 25.10.2024).","Тимофеева С.С., Дроздова И.В., Бобоев A.А., Хужжиев С.О., & Фарманова М.А. (2022). ПЕРСПЕКТИВНЫЕ ТЕХНОЛОГИИ БИОРЕМЕДИАЦИИ СТОЧНЫХ ВОД ЗОЛОТОДОБЫВАЮЩИХ ПРЕДПРИЯТИЙ УЗБЕКИСТАНА. XXI век. Техносферная безопасность, 7 (4 (28)), 322-333.",https://cyberleninka.ru/article/n/perspektivnye-tehnologii-bioremediatsii-stochnyh-vod-zolotodobyvayuschih-predpriyatiy-uzbekistana
РЕАКЦИЯ ВЫСШИХ РАСТЕНИЙ НА УРОВЕНЬ НЕФТЕЗАГРЯЗНЕНИЯ ПОЧВ В ВЕГЕТАЦИОННОМ ОПЫТЕ,"Ковалева Екатерина Игоревна, Трофимов Сергей Яковлевич, Шоба Сергей Алексеевич",Вестник Московского университета. Серия 17. Почвоведение,2022,Экологические биотехнологии,"черноземы, нефтезагрязнение, экологические функции, экологическое нормирование, степная зона",,"На территории России площади нефтезагрязненных почв составляют десятки тысяч гектар. Однако до настоящего времени отсутствуют единые подходы к оценке состояния загрязненных почв и нормированию содержания нефти и нефтепродуктов в почвах. Отклик растений в вегетационном опыте может дать важные результаты нормирования содержания нефтепродуктов в почвах земель сельскохозяйственного назначения. В работе дается оценка реакции высших растений как маркера направленности и интенсивности биологических процессов в почвах в вегетационном опыте в условиях нефтезагрязнения для обоснования нормативов допустимого остаточного содержания нефтепродуктов (ДОСНП) в почвах земель сельскохозяйственного назначения. Исследованы состав и свойства черноземов выщелоченных (Чв), южных (Чю) и типичных (Чт), используемых в вегетационном опыте, который проводился спустя месяц после внесения сырой серосодержащей нефти в почвы. В эксперименте оценено влияние разных доз нефти на биопродуктивность пшеницы и гороха. Пшеница по показателю сухой биомассы проявила бόльшую чувствительность к загрязнению нефтью, содержащей преимущественно средние и тяжелые фракции, нежели горох. При нормировании содержания нефти в черноземах применена нелинейная модель регрессии, описываемая логистической кривой. Величина норматива качества, установленная по биомассе пшеницы, равна 0,9; 0,4; 1,0 г·кг-1для Чв (содержание гумуса ~ 9,8%, легкосуглинистого состава); Чю (содержание гумуса ~ 7,6%, тяжелосуглинистого состава); Чт (содержание гумуса ~ 12,8%, среднесуглинистого состава) соответственно. ДОСНП, принимаемое как 30% изменения функционирования почв, что соответствует уровню риска наступления ее деградации, оцененному по параметру плодородия почв - сухой биомассы пшеницы, составляет для Чт 1,2 г·кг-1; Чю - 0,5 г·кг-1; Чв - 1,1 г·кг-1.","Ковалева Екатерина Игоревна, Трофимов Сергей Яковлевич, Шоба Сергей Алексеевич РЕАКЦИЯ ВЫСШИХ РАСТЕНИЙ НА УРОВЕНЬ НЕФТЕЗАГРЯЗНЕНИЯ ПОЧВ В ВЕГЕТАЦИОННОМ ОПЫТЕ // Вестник Московского университета. Серия 17. Почвоведение. 2022. №3. URL: https://cyberleninka.ru/article/n/reaktsiya-vysshih-rasteniy-na-uroven-neftezagryazneniya-pochv-v-vegetatsionnom-opyte (дата обращения: 25.10.2024).","Ковалева Екатерина Игоревна, Трофимов Сергей Яковлевич, & Шоба Сергей Алексеевич (2022). РЕАКЦИЯ ВЫСШИХ РАСТЕНИЙ НА УРОВЕНЬ НЕФТЕЗАГРЯЗНЕНИЯ ПОЧВ В ВЕГЕТАЦИОННОМ ОПЫТЕ. Вестник Московского университета. Серия 17. Почвоведение,  (3), 74-84.",https://cyberleninka.ru/article/n/reaktsiya-vysshih-rasteniy-na-uroven-neftezagryazneniya-pochv-v-vegetatsionnom-opyte
