Title,Authors,Journal,Year,Field of Science,Russian Keywords,English Keywords,Annotation,GOST,APA,Link
СОТРУДНИЧЕСТВО КАК ЛУЧШИЙ СПОСОБ КОНКУРЕНЦИИ (НА ПРИМЕРЕ ИССЛЕДОВАНИЙ И ПРОЕКТОВ ПО ЭКОЛОГИИ БАЙКАЛА),Воронов Ю.П.,Всероссийский экономический журнал ЭКО,2022,Экологические биотехнологии,"сотрудничество, конкуренция, инновационная технология, экология, байкал, вискозная целлюлоза, отходы производства",,"В статье на примере проектов, заявленных на конкурс по улучшению экологии озера Байкал (ликвидации отходов Байкальского целлюлозно-бумажного комбината), рассматриваются проблемы сочетания сотрудничества и конкуренции в сфере инновационных технологий. Проанализированы 35 наиболее обоснованных проектов по направлениям улучшения экологии: «Термические технологии», «Очистка воды», «Получение монолитов и брикетов», «Микробиология» и «Восстановление почвы», выделены кластеры проектов, которые не конкурируют между собой, а взаимодополняют друг друга. Для комплексной реализации всех 35 проектов в рамках единой программы потребовалось добавить ещё три проекта, которые отсутствовали в исходном наборе и не участвовали в конкурсе. Автор делает вывод, что формирование единого проекта на основании совокупности проектов, представляемых на конкурсы, может стать новым инструментом ускорения научно-технического прогресса, в частности, и в сфере экологии.",Воронов Ю. П. СОТРУДНИЧЕСТВО КАК ЛУЧШИЙ СПОСОБ КОНКУРЕНЦИИ (НА ПРИМЕРЕ ИССЛЕДОВАНИЙ И ПРОЕКТОВ ПО ЭКОЛОГИИ БАЙКАЛА) // ЭКО. 2022. №8 (578). URL: https://cyberleninka.ru/article/n/sotrudnichestvo-kak-luchshiy-sposob-konkurentsii-na-primere-issledovaniy-i-proektov-po-ekologii-baykala (дата обращения: 25.10.2024).,"Воронов Ю.П. (2022). СОТРУДНИЧЕСТВО КАК ЛУЧШИЙ СПОСОБ КОНКУРЕНЦИИ (НА ПРИМЕРЕ ИССЛЕДОВАНИЙ И ПРОЕКТОВ ПО ЭКОЛОГИИ БАЙКАЛА). Всероссийский экономический журнал ЭКО,  (8 (578)), 54-66.",https://cyberleninka.ru/article/n/sotrudnichestvo-kak-luchshiy-sposob-konkurentsii-na-primere-issledovaniy-i-proektov-po-ekologii-baykala
Колонизация ризобактериями корней сахарной свёклы,"О.А. Фёдорова , Н.В. Безлер",Сахар,2022,Экологические биотехнологии,"ризобактерии, сахарная свёкла, колонизирующая способность, agrobacterium tumefaciens 184 и streptomyces sp. 3.","rhizobacteria, sugar beet, colonizing ability, agrobacterium tumefaciens 184 and streptomyces sp. 3.","Методом выращивания сахарной свёклы в полужидком (0,7%-ном) голодном агаре, инокулированном Agrobacterium tumefaciens 184 и Streptomyces sp. 3, была дана первичная оценка их колонизирующей способности. Показано, что за счёт корневых экссудатов сахарной свёклы исследуемые культуры способны приживаться и функционировать в зоне корней растения, что важно для осуществления их фитопротекторной и ростстимулирующей функций.","О А. Фёдорова, Н В. Безлер Колонизация ризобактериями корней сахарной свёклы // Сахар. 2022. №10. URL: https://cyberleninka.ru/article/n/kolonizatsiya-rizobakteriyami-korney-saharnoy-svyokly (дата обращения: 25.10.2024).","О.А. Фёдорова , & Н.В. Безлер (2022). Колонизация ризобактериями корней сахарной свёклы. Сахар,  (10), 53-56. doi: 10.24412/2413-5518-2022-10-53-56",https://cyberleninka.ru/article/n/kolonizatsiya-rizobakteriyami-korney-saharnoy-svyokly
МАРКАЗИЙ ОСИЁ АҲОЛИСИНИНГ ДЕМОГРАФИК ВАЗИЯТИГА ТАБИИЙ-ГЕОГРАФИК ОМИЛЛАРНИНГ ТАЪСИРИ,"Абдуғаниевич Ҳайитбой Абдувалиев, Абдусатторжон Абдумалик Ўғли Абдулхамидов",Academic research in educational sciences,2022,Экологические биотехнологии,"тарихий географик жойлашув, марказий осиѐ минтақаси, шаҳарлар, қишлоқлар, демографик юк, табиий-географик минтақалар, қулай табиий-географик шароит",,"Мақолада Марказий Осиѐ аҳолисининг кейинги йиллардаги ҳудудий ўзгаришлари тахлил этилган бўлиб, бунда минтақа давлатлари аҳолисининг жойланишидаги тафовутлар ҳам очиб берилган. Минтақа аҳолисининг катта демографик юкига сабаб бўлган табиий-географик омилларнинг роли қисман баҳоланган. Муаллифлар мақолада минтақадаги ўзига хос демографик юкка эга бўлган Ўзбекистон мисолида демографик вазиатни оғирлигини очиб беришга ҳаракат қилган.","Абдуғаниевич Ҳайитбой Абдувалиев, Абдусатторжон Абдумалик Ўғли Абдулхамидов МАРКАЗИЙ ОСИЁ АҲОЛИСИНИНГ ДЕМОГРАФИК ВАЗИЯТИГА ТАБИИЙ-ГЕОГРАФИК ОМИЛЛАРНИНГ ТАЪСИРИ // Academic research in educational sciences. 2022. №10. URL: https://cyberleninka.ru/article/n/markaziy-osiyo-a-olisining-demografik-vaziyatiga-tabiiy-geografik-omillarning-tasiri (дата обращения: 25.10.2024).","Абдуғаниевич Ҳайитбой Абдувалиев, & Абдусатторжон Абдумалик Ўғли Абдулхамидов (2022). МАРКАЗИЙ ОСИЁ АҲОЛИСИНИНГ ДЕМОГРАФИК ВАЗИЯТИГА ТАБИИЙ-ГЕОГРАФИК ОМИЛЛАРНИНГ ТАЪСИРИ. Academic research in educational sciences, 3 (10), 435-440.",https://cyberleninka.ru/article/n/markaziy-osiyo-a-olisining-demografik-vaziyatiga-tabiiy-geografik-omillarning-tasiri
ЭКОЛОГО-ЭКОНОМИЧЕСКАЯ ЭФФЕКТИВНОСТЬ МЕРОПРИЯТИЙ ПО СНИЖЕНИЮ ВЫБРОСОВ В АТМОСФЕРУ НА ПРЕДПРИЯТИИ ЗАО «БАШМАКОВСКИЙ МУКОМОЛЬНЫЙ ЗАВОД»,И.Н. Симонова,Проблемы региональной экологии,2022,Экологические биотехнологии,"эколого-экономическая эффективность, природоохранные мероприятия, «башмаковский мукомольный завод»","ecological and economic efficiency, environmental protection measures, bashmakovsky flour mill","В статье рассматриваются антропогенные воздействия на окружающую среду в виде основных загрязнителей предприятия ЗАО «Башмаковский мукомольный завод», таких как зерновая пыль, диоксид азота, оксид углерода, сажа, бензаперен. Оцениваются существующие мероприятия по снижению выбросов загрязняющих веществ в атмосферу, а так же эколого-экономическая эффективность природоохранных мероприятий с целью снижения выбросов. В статье приведен анализ этапов работы предприятия, рассмотрено негативное влияние на окружающую среду, выявлены недостатки в технологических процессах, проанализированы основные источники загрязнения окружающей среды и основные направления деятельности природоохранных мероприятий, проводимых на ЗАО «Башмаковский мукомольный завод». В ходе исследования была полностью достигнута поставленная цель, решены задачи: оценены существующие мероприятия по снижению выбросов загрязняющих веществ в атмосферу; рассчитан потенциальный экономический ущерб от выбросов загрязняющих веществ в атмосферный воздух. В результате анализа учебной и научной литературы, а также проектных документов «Башмаковский мукомольный завод» были выработаны практические рекомендации и предложения по улучшению технологических процессов с целью снижения антропогенной нагрузки на окружающую среду.",И Н. Симонова ЭКОЛОГО-ЭКОНОМИЧЕСКАЯ ЭФФЕКТИВНОСТЬ МЕРОПРИЯТИЙ ПО СНИЖЕНИЮ ВЫБРОСОВ В АТМОСФЕРУ НА ПРЕДПРИЯТИИ ЗАО «БАШМАКОВСКИЙ МУКОМОЛЬНЫЙ ЗАВОД» // Проблемы региональной экологии. 2022. №5. URL: https://cyberleninka.ru/article/n/ekologo-ekonomicheskaya-effektivnost-meropriyatiy-po-snizheniyu-vybrosov-v-atmosferu-na-predpriyatii-zao-bashmakovskiy-mukomolnyy (дата обращения: 25.10.2024).,"И.Н. Симонова (2022). ЭКОЛОГО-ЭКОНОМИЧЕСКАЯ ЭФФЕКТИВНОСТЬ МЕРОПРИЯТИЙ ПО СНИЖЕНИЮ ВЫБРОСОВ В АТМОСФЕРУ НА ПРЕДПРИЯТИИ ЗАО «БАШМАКОВСКИЙ МУКОМОЛЬНЫЙ ЗАВОД». Проблемы региональной экологии,  (5), 46-48. doi: 10.24412/1728-323X-2022-5-46-48",https://cyberleninka.ru/article/n/ekologo-ekonomicheskaya-effektivnost-meropriyatiy-po-snizheniyu-vybrosov-v-atmosferu-na-predpriyatii-zao-bashmakovskiy-mukomolnyy
"НОРМАТИВНЫЕ ОСНОВЫ И РЕГИОНАЛЬНЫЕ ПОДХОДЫ К РЕКУЛЬТИВАЦИИ ЗЕМЕЛЬ, НАРУШЕННЫХ ПРИ РАЗРАБОТКЕ АЛМАЗНЫХ МЕСТОРОЖДЕНИЙ ЯКУТИИ","С.И. Миронова, Л.П. Капелькина",Проблемы региональной экологии,2022,Экологические биотехнологии,"нарушенные земли, рекультивация, якутия, нормативные основы, стандарты, отвалы, нетрадиционные способы рекультивации","disrupted land, reclamation, yakutia, normative bases, standards, dumps, not traditional ways of reclamation","Якутия — центр алмазной промышленности не только России, но и всего мира. Алмазные месторождения находятся на западе (Мирнинский район) и севере (Анабарский, Булунский районы) республики. До недавнего времени добыча проводилась открытым карьерным способом, в результате которой огромные территории подвергались техногенному прессу, преобразуя естественные ландшафты в карьеры, хвостохранилища, отвалы пустых пород, линии электропередач и промышленные площадки. Это создало негативное воздействие на окружающую среду и стала проблема восстановления нарушенных участков. Якутия отличается от других регионов России своими экстремальными природно-климатические условиями и повсеместным развитием многолетнемерзлых пород. Это самый холодный из обжитых регионов планеты. Климат резко континентальный, отличается продолжительным зимним и коротким летним периодами. Статья написана в результате обзора результатов многолетних научных и научно-практических исследований нарушенных земель на месторождениях алмазов, где выявлены особенности рекультивации нарушенных земель. Добыча алмазов на территории Якутии ведется на месторождениях двух типов — коренных залеганий (трубок) и из россыпей. Вскрышные и вмещающие породы коренных залеганий в подавляющей массе представлены осадочными карбонатными породами: мергелями, известняками и доломитами. Крутые отвалы (до 60 град.) достигают высоты, близкой к 100 м. Самозарастание происходит медленно, что обусловлено неблагоприятными водно-физическими свойствами субстрата, неустойчивостью откосов из-за значительной крутизны, отсутствием или недостаточностью плодородных пород. В этой связи необходима разработка особых приемов рекультивации, учитывающих как природно-климатические условия местности, так и характер нарушений, обусловленных горными работами при добыче алмазов. Государственные стандарты и другие нормативные документы в области рекультивации, действующие в России в настоящее время, слабо адаптированы к условиям Якутии, отличающейся от других регионов РФ суровым резко континентальным климатом. Правовая основа рекультивации нарушенных земель, базирующаяся на действующих нормативных документах, не в полной мере соответствует особенностям проведения работ по восстановлению нарушенных горными работами земель в условиях Якутии. Авторы доказывают необходимость разработки нормативного документа, в котором бы учитывались региональные (Якутия) и отраслевые (добыча алмазов) особенности рекультивации нарушенных земель.","С И. Миронова, Л П. Капелькина НОРМАТИВНЫЕ ОСНОВЫ И РЕГИОНАЛЬНЫЕ ПОДХОДЫ К РЕКУЛЬТИВАЦИИ ЗЕМЕЛЬ, НАРУШЕННЫХ ПРИ РАЗРАБОТКЕ АЛМАЗНЫХ МЕСТОРОЖДЕНИЙ ЯКУТИИ // Проблемы региональной экологии. 2022. №5. URL: https://cyberleninka.ru/article/n/normativnye-osnovy-i-regionalnye-podhody-k-rekultivatsii-zemel-narushennyh-pri-razrabotke-almaznyh-mestorozhdeniy-yakutii (дата обращения: 25.10.2024).","С.И. Миронова, & Л.П. Капелькина (2022). НОРМАТИВНЫЕ ОСНОВЫ И РЕГИОНАЛЬНЫЕ ПОДХОДЫ К РЕКУЛЬТИВАЦИИ ЗЕМЕЛЬ, НАРУШЕННЫХ ПРИ РАЗРАБОТКЕ АЛМАЗНЫХ МЕСТОРОЖДЕНИЙ ЯКУТИИ. Проблемы региональной экологии,  (5), 49-53. doi: 10.24412/1728-323X-2022-5-49-53",https://cyberleninka.ru/article/n/normativnye-osnovy-i-regionalnye-podhody-k-rekultivatsii-zemel-narushennyh-pri-razrabotke-almaznyh-mestorozhdeniy-yakutii
РОЛЬ ЗАЩИТЫ ПОЧВЫ В ИЗУЧЕНИИ ЭКОЛОГИИ,"Шыхгулеыва А., Шыхгулеыва Г.",Вестник науки,2022,Экологические биотехнологии,"анализ, метод, исследование, почва, экология",,В данной статье рассматриваются особенности защитных мер в обеспечении защиты экологии и почвы. Проведен перекрестный и сравнительный анализ влияния антропогенных действий на состояние почвы и экологии в целом. Даны рекомендации по внедрению разработок в изучение экологии.,"Шыхгулеыва А., Шыхгулеыва Г. РОЛЬ ЗАЩИТЫ ПОЧВЫ В ИЗУЧЕНИИ ЭКОЛОГИИ // Вестник науки. 2022. №10 (55). URL: https://cyberleninka.ru/article/n/rol-zaschity-pochvy-v-izuchenii-ekologii (дата обращения: 25.10.2024).","Шыхгулеыва А., & Шыхгулеыва Г. (2022). РОЛЬ ЗАЩИТЫ ПОЧВЫ В ИЗУЧЕНИИ ЭКОЛОГИИ. Вестник науки, 5 (10 (55)), 256-259.",https://cyberleninka.ru/article/n/rol-zaschity-pochvy-v-izuchenii-ekologii
ОЦЕНКА ТОКСИЧНОСТИ ОЧИЩЕННЫХ ХОЗЯЙСТВЕННО-БЫТОВЫХ СТОЧНЫХ ВОД С ЦЕЛЬЮ ИХ ИСПОЛЬЗОВАНИЯ ДЛЯ ОРОШЕНИЯ,"Домашенко Юлия Евгеньевна, Суровикина Анастасия Петровна, Ляшков Максим Анатольевич",Природообустройство,2022,Экологические биотехнологии,"орошение, хозяйственно-бытовые сточные воды, сточные воды, биотестирование, токсичность",,"Цель исследований - определение токсичности хозяйственно-бытовых сточных вод после механической и биологической очистки и потенциальной возможности их использования для целей орошения. Проведена оценка токсичности подготовленных сточных вод канализационных очистных сооружений (КОС «Кадамовские») г. Новочеркасска по методике биотестирования на разных тест-объектах инфузории (Paramecium caudatum), зеленые протококковые водоросли хлорелла (Chlorella vulgaris Beijer), семенах белой горчицы (Sinapis alba). Лабораторные исследования проводились в аккредитованной эколого-аналитической лаборатории ФГБНУ «РосНИИПМ». Результаты биотестирования на тест-объекте хлореллы показали, что подготовленные хозяйственно-бытовые сточные воды не оказывают токсического действия. Биотестирование на тест-объекте инфузории определило токсическое действие только сточной воды после биологической очистки. Длина корней семян белой горчицы в сточной воде после механической и биологической очистки по сравнению с контролем выше на 120%, что доказывает стимулирующий эффект указанных вод. Следовательно, хозяйственно-бытовые сточные воды после механической очистки с КОС «Кадамовские» г. Новочеркасска по результатам биотестирования потенциально можно использовать для целей орошения. По результатам исследований установлено, что сточные воды после биологической очистки ""оказывают токсическое действие"", что обусловливает их применение для орошения только после дополнительной подготовки.","Домашенко Юлия Евгеньевна, Суровикина Анастасия Петровна, Ляшков Максим Анатольевич ОЦЕНКА ТОКСИЧНОСТИ ОЧИЩЕННЫХ ХОЗЯЙСТВЕННО-БЫТОВЫХ СТОЧНЫХ ВОД С ЦЕЛЬЮ ИХ ИСПОЛЬЗОВАНИЯ ДЛЯ ОРОШЕНИЯ // Природообустройство. 2022. №4. URL: https://cyberleninka.ru/article/n/otsenka-toksichnosti-ochischennyh-hozyaystvenno-bytovyh-stochnyh-vod-s-tselyu-ih-ispolzovaniya-dlya-orosheniya (дата обращения: 25.10.2024).","Домашенко Юлия Евгеньевна, Суровикина Анастасия Петровна, & Ляшков Максим Анатольевич (2022). ОЦЕНКА ТОКСИЧНОСТИ ОЧИЩЕННЫХ ХОЗЯЙСТВЕННО-БЫТОВЫХ СТОЧНЫХ ВОД С ЦЕЛЬЮ ИХ ИСПОЛЬЗОВАНИЯ ДЛЯ ОРОШЕНИЯ. Природообустройство,  (4), 31-36.",https://cyberleninka.ru/article/n/otsenka-toksichnosti-ochischennyh-hozyaystvenno-bytovyh-stochnyh-vod-s-tselyu-ih-ispolzovaniya-dlya-orosheniya
