Title,Authors,Journal,Year,Field of Science,Russian Keywords,English Keywords,Annotation,GOST,APA,Link
ГОРОДСКИЕ ПОЧВЫ ОДНОГО ИЗ РАЙОНОВ НОВОЙ МОСКВЫ КАК ИСТОЧНИКИ ПОСТУПЛЕНИЯ МЕТАНА И УГЛЕКИСЛОГО ГАЗА В АТМОСФЕРУ,"Кулачкова Светлана Александровна, Коваленко А.В.",Вестник Московского университета. Серия 17. Почвоведение,2021,Науки о Земле и смежные экологические науки,"парниковые газы, метаногенез, метанокисление, дыхание почв, эмиссия газов из почв, городские почвы (urbic technosols)",,"В поселке Коммунарка (Новая Москва) на участках застройки 1938-2014 гг. и в рекреационной зоне исследованы закономерности эмиссии СН4и СО2из почв и определяющие их факторы. Показано, что интенсивность образования и окисления метана и, как следствие, содержание этого газа в почвах и эмиссия в атмосферу зависят от времени создания реплантоземов и возраста городских почв. В летний период эмиссия метана из почв селитебной зоны по медианным значениям отсутствовала или не превышала 0,01 мг СН4· м-2· ч-1. Происходило поглощение метана из атмосферы. Однако наблюдалась локальная эмиссия СН4из некоторых почв.В период с достаточным увлажнением ее максимальная интенсивность из самых молодых реплантоземов достигала 5,25 мг СН4· м-2· ч-1и уменьшалась на порядок из почв у домов 2001 г. постройки и старше. В засушливый период локальная эмиссия из молодых реплантоземов составляла всего 0,03 мг СН4· м-2· ч-1 и снижалась в 3 раза у домов 1938 г. постройки. Наиболее опасным источником метана в атмосферу были переувлажненные городские почвы, содержащие бытовой мусор. Максимальная эмиссия СН4из них составила 57,15 мг СН4· м-2· ч-1. Содержание углекислого газа в техногенных горизонтах реплантоземов и серогумусовых техногенных почв уменьшалось с увеличением возраста застройки. Эмиссия углекислого газа в меньшей степени, чем метана, зависела от времени формирования почв. Тем не менее в условиях достаточного увлажнения максимальное выделение СО2в атмосферу происходило из молодых реплантоземов (до 3606 мг СО2· м-2· ч-1), а в условиях недостаточного - из почв более старых микрорайонов (до 664 мг СО2· м-2· ч-1) и из перегнойно-глеевых почв (до 1901 мг СО2· м-2· ч-1).","Кулачкова Светлана Александровна, Коваленко А. В. ГОРОДСКИЕ ПОЧВЫ ОДНОГО ИЗ РАЙОНОВ НОВОЙ МОСКВЫ КАК ИСТОЧНИКИ ПОСТУПЛЕНИЯ МЕТАНА И УГЛЕКИСЛОГО ГАЗА В АТМОСФЕРУ // Вестник Московского университета. Серия 17. Почвоведение. 2021. №4. URL: https://cyberleninka.ru/article/n/gorodskie-pochvy-odnogo-iz-rayonov-novoy-moskvy-kak-istochniki-postupleniya-metana-i-uglekislogo-gaza-v-atmosferu (дата обращения: 16.11.2024).","Кулачкова Светлана Александровна, & Коваленко А.В. (2021). ГОРОДСКИЕ ПОЧВЫ ОДНОГО ИЗ РАЙОНОВ НОВОЙ МОСКВЫ КАК ИСТОЧНИКИ ПОСТУПЛЕНИЯ МЕТАНА И УГЛЕКИСЛОГО ГАЗА В АТМОСФЕРУ. Вестник Московского университета. Серия 17. Почвоведение,  (4), 31-46.",https://cyberleninka.ru/article/n/gorodskie-pochvy-odnogo-iz-rayonov-novoy-moskvy-kak-istochniki-postupleniya-metana-i-uglekislogo-gaza-v-atmosferu
АГРОПЕЙЗАЖ НИЖНЕГО ПОВОЛЖЬЯ В XVIII-XX ВЕКАХ ПО ДАННЫМ ПАЛЕОПОЧВЕННЫХ ИССЛЕДОВАНИЙ,"Ковалева Наталия Олеговна, Решетникова Радислава Андреевна",Аграрная история,2021,Науки о Земле и смежные экологические науки,"агроландшафты, палеопочвоведение, реликтовые и современные признаки, средневековый климатический оптимум, эволюция поселений поволжья",,"Агроландшафты Нижнего Поволжья претерпевали изменения в течение позднего голоцена в результате воздействия естественных и антропогенных факторов. Смена климатических условий и почвообразующих процессов накладывались на строительство поселений и сельскохозяйственное использование земли в XVIII веке а также на устройство водохранилищ на Волге в XX веке. Средневековый климатический оптимум характеризовался гумидными условиями почвообразования в степной и сухостепной зонах, что способствовало расцвету золотоордынских поселений, рассолению степных почв и благоприятствовало ведению сельского хозяйства. Последующий за ним с XVI в. малый ледниковый период привел к упадку поселений и негативным почвенным процессам. Почвы и культурные слои поселений поволжских немцев, занявших эти территории в XVIII в., характеризуются увеличением морфологических признаков солонцеватости и засоленности по содержанию карбонатов. Кроме того, из-за климатических изменений и последствий сведений лесов произошла интенсификация эрозии почв. Активизация склоновых и оползневых процессов в результате строительства водохранилищ на Волге в XX веке привела к усилению деградации поселений и сельских ландшафтов Правобережья.","Ковалева Наталия Олеговна, Решетникова Радислава Андреевна АГРОПЕЙЗАЖ НИЖНЕГО ПОВОЛЖЬЯ В XVIII-XX ВЕКАХ ПО ДАННЫМ ПАЛЕОПОЧВЕННЫХ ИССЛЕДОВАНИЙ // Аграрная история. 2021. №8. URL: https://cyberleninka.ru/article/n/agropeyzazh-nizhnego-povolzhya-v-xviii-xx-vekah-po-dannym-paleopochvennyh-issledovaniy (дата обращения: 16.11.2024).","Ковалева Наталия Олеговна, & Решетникова Радислава Андреевна (2021). АГРОПЕЙЗАЖ НИЖНЕГО ПОВОЛЖЬЯ В XVIII-XX ВЕКАХ ПО ДАННЫМ ПАЛЕОПОЧВЕННЫХ ИССЛЕДОВАНИЙ. Аграрная история,  (8), 104-114.",https://cyberleninka.ru/article/n/agropeyzazh-nizhnego-povolzhya-v-xviii-xx-vekah-po-dannym-paleopochvennyh-issledovaniy
КЛИМАТИЧЕСКИЕ ИССЛЕДОВАНИЯ НА ООПТ КАК НЕОТЪЕМЛЕМАЯ ЧАСТЬ КОМПЛЕКСНОГО МОНИТОРИНГА,Рыбак Е.А.,Труды Мордовского государственного природного заповедника им. П. Г. Смидовича,2021,Науки о Земле и смежные экологические науки,"изменение климата, особо охраняемые природные территории, климатические исследования, мониторинг, микроклиматические исследования",,"В статье рассматриваются проблемы, возникающие при организации климатического мониторинга на особо охраняемых природных территориях. Средние климатические условия достаточно хорошо изучены, однако глобальные и региональные изменения климата одновременно с долговременными тенденциями в естественной климатической изменчивости требуют регулярного обновления соответствующих вариаций. Это важно, в первую очередь, для отслеживания и объяснения причин изменений биоразнообразия, а также для разработки мер по адаптации к изменению климата на ООПТ.",Рыбак Е. А. КЛИМАТИЧЕСКИЕ ИССЛЕДОВАНИЯ НА ООПТ КАК НЕОТЪЕМЛЕМАЯ ЧАСТЬ КОМПЛЕКСНОГО МОНИТОРИНГА // Труды Мордовского государственного природного заповедника им. П. Г. Смидовича. 2021. №28. URL: https://cyberleninka.ru/article/n/klimaticheskie-issledovaniya-na-oopt-kak-neotemlemaya-chast-kompleksnogo-monitoringa (дата обращения: 16.11.2024).,"Рыбак Е.А. (2021). КЛИМАТИЧЕСКИЕ ИССЛЕДОВАНИЯ НА ООПТ КАК НЕОТЪЕМЛЕМАЯ ЧАСТЬ КОМПЛЕКСНОГО МОНИТОРИНГА. Труды Мордовского государственного природного заповедника им. П. Г. Смидовича,  (28), 216-221.",https://cyberleninka.ru/article/n/klimaticheskie-issledovaniya-na-oopt-kak-neotemlemaya-chast-kompleksnogo-monitoringa
АНАЛИТИЧЕСКИЙ ОБЗОР: ЭМИССИЯ И ПОГЛОЩЕНИЕ ПАРНИКОВЫХ ГАЗОВ ПОЧВАМИ. ЭКОЛОГИЧЕСКИЕ ПРОБЛЕМЫ,"Федоров Юрий Александрович, Сухоруков Виктор Владимирович, Трубник Роман Геннадьевич",Антропогенная трансформация природной среды,2021,Науки о Земле и смежные экологические науки,"парниковые газы, диоксид углерода, метан, закись азота, потоки, эмиссия, почвы",,"Почвы являются источником и поглотителем парниковых газов (ПГ), таких как углекислый газ (CO2), метан (CH4) и закись азота (N2O). Поскольку объемы концентрации и потоков могут быть большими, необходимы точные количественные оценки для получения данных по глобальным потокам ПГ, необходимых для прогнозирования глобальных изменений и исследований климата. В данном обзоре показана роль почв как одного из важных источников и регуляторов содержания CH4, CO2, N2O в тропосфере, а также описаны основные методы мониторинга парниковых газов. Проанализировано влияние природных и антропогенных факторов на эмиссию и поглощение CH4, CO2, N2O почвенным покровом. Представлены оригинальные диаграммы, демонстрирующие глобальные потоки CH4, CO2, N2O различными экосистемами, включая педосферу. Выполнена оценка эмиссии метана и распределения его содержания в основных типах почв Ростовской области. Рассмотрены механизмы генерации CH4, CO2, N2O в почвах и их возможное влияние на карбонатно-кальциевое равновесие, которое играет большую роль в регулировании биогеохимических процессов в педосфере. Анализ и обобщение данных исследований по различным типам почв позволяет пролить свет не только на их вклад в глобальную эмиссию метана, но и подойти к пониманию важных с точки зрения агрохимии процессов и параметров, таких как, собственно, карбонатно-кальциевое равновесие и окислительно-восстановительный потециал в современных почвах. Инвентаризация источников и оценка межрезервуарного массопереноса газа в системе педосфера - атмосфера позволяет приступить к разработке стратегии по снижению эмиссии парниковых газов, способствующей сдерживанию темпов глобального изменения климата.","Федоров Юрий Александрович, Сухоруков Виктор Владимирович, Трубник Роман Геннадьевич АНАЛИТИЧЕСКИЙ ОБЗОР: ЭМИССИЯ И ПОГЛОЩЕНИЕ ПАРНИКОВЫХ ГАЗОВ ПОЧВАМИ. ЭКОЛОГИЧЕСКИЕ ПРОБЛЕМЫ // АТПС. 2021. №1. URL: https://cyberleninka.ru/article/n/analiticheskiy-obzor-emissiya-i-pogloschenie-parnikovyh-gazov-pochvami-ekologicheskie-problemy (дата обращения: 16.11.2024).","Федоров Юрий Александрович, Сухоруков Виктор Владимирович, & Трубник Роман Геннадьевич (2021). АНАЛИТИЧЕСКИЙ ОБЗОР: ЭМИССИЯ И ПОГЛОЩЕНИЕ ПАРНИКОВЫХ ГАЗОВ ПОЧВАМИ. ЭКОЛОГИЧЕСКИЕ ПРОБЛЕМЫ. Антропогенная трансформация природной среды,  (1), 6-34.",https://cyberleninka.ru/article/n/analiticheskiy-obzor-emissiya-i-pogloschenie-parnikovyh-gazov-pochvami-ekologicheskie-problemy
"ДИНАМИКА РАЗВИТИЯ ТЕРМОЦИРКА, ВМЕЩАЮЩЕГО ЗАЛЕЖЬ ПЛАСТОВОГО ЛЬДА, ВБЛИЗИ СЕЛА ЛАВРЕНТИЯ (ЧУКОТСКИЙ АО) ЗА 2018-2021 ГГ.","Маслаков Алексей Алексеевич, Кузякин Лев Павлович, Комова Нина Николаевна",Арктика и Антарктика,2021,Науки о Земле и смежные экологические науки,"многолетняя мерзлота, пластовый лёд, чукотка, термоцирк, климатические изменения, криолитозона, криолитологический анализ, динамика многолетней мерзлоты, криогенные оползни, палеокриология",,"Пластовые льды являются уникальными природными образованиями криолитозоны. Вместе с тем, залежи пластового льда являются важными объектами исследования в области реконструкции палеогеографических условий и при решении задач инженерной геологии. На территории равнин Чукотского полуострова пластовые льды имеют широкое распространение и являются региональной особенностью. В статье рассмотрена динамика отступания бровки термоцирка и эволюция морфологии обнажения пластового льда в 7 км к югу от села Лаврентия (Чукотский АО) на протяжении 2018-2021 гг. По результатам полевых наблюдений изучаемый термоцирк активно развивался в течение 4 лет: его задняя стенка в обоих кулуарах отступила на 50-60 метров, увеличив площадь термоцирка в 3-4 раза. Скорость отступания бровки термоцирка была равномерной. Форма обнажающейся залежи пластового льда изменялась с течением времени: в 2018 г. основная её часть вскрывалась в северном кулуаре, в последующие годы залежь вскрывалась преимущественно в северном кулуаре со стороны перемычки (южный борт) и в южном кулуаре. Ширина залежи варьировала от 5 м в 2018 году до 15-20 м в 2019 и 2021 гг. Мощность льда также менялась в северном кулуаре от 2 м в 2018 г. до 6 м в 2019 г., а в южном кулуаре она оставалась стабильной в 2020-2021 гг. - около 5 м. Выдвинута гипотеза о механизме и времени формирования льда. Результаты исследований позволяют предположить, что залежь может иметь гетерогенный сегрегационно-инъекционный генезис. Выявлено, что изучаемая залежь является частью более крупного ледяного тела и была обнажена в результате циклических колебаний климатических характеристик, определяющих глубину сезонного оттаивания почвы.","Маслаков Алексей Алексеевич, Кузякин Лев Павлович, Комова Нина Николаевна ДИНАМИКА РАЗВИТИЯ ТЕРМОЦИРКА, ВМЕЩАЮЩЕГО ЗАЛЕЖЬ ПЛАСТОВОГО ЛЬДА, ВБЛИЗИ СЕЛА ЛАВРЕНТИЯ (ЧУКОТСКИЙ АО) ЗА 2018-2021 ГГ. // Арктика и Антарктика. 2021. №4. URL: https://cyberleninka.ru/article/n/dinamika-razvitiya-termotsirka-vmeschayuschego-zalezh-plastovogo-lda-vblizi-sela-lavrentiya-chukotskiy-ao-za-2018-2021-gg (дата обращения: 16.11.2024).","Маслаков Алексей Алексеевич, Кузякин Лев Павлович, & Комова Нина Николаевна (2021). ДИНАМИКА РАЗВИТИЯ ТЕРМОЦИРКА, ВМЕЩАЮЩЕГО ЗАЛЕЖЬ ПЛАСТОВОГО ЛЬДА, ВБЛИЗИ СЕЛА ЛАВРЕНТИЯ (ЧУКОТСКИЙ АО) ЗА 2018-2021 ГГ.. Арктика и Антарктика,  (4), 32-46.",https://cyberleninka.ru/article/n/dinamika-razvitiya-termotsirka-vmeschayuschego-zalezh-plastovogo-lda-vblizi-sela-lavrentiya-chukotskiy-ao-za-2018-2021-gg
РОЛЬ БОЛОТ В ДЕПОНИРОВАНИИ УГЛЕРОДА,Залесов С.В.,Международный научно-исследовательский журнал,2021,Науки о Земле и смежные экологические науки,"изменение климата, парниковые газы, депонирование углерода, углекислый газ, болота, органическая масса",,"На основании литературных и ведомственных материалов, а также результатов собственных исследований предпринята попытка оценки роли болот в депонировании углерода из воздуха. Отмечается, что содержание углерода в торфяной залежи зависит от типа и вида торфа. В отличие от лугов, сельскохозяйственных угодий и лесов болота депонируют углерод в органической массе на многие сотни и даже тысячи лет. Скорость торфоотложения зависит от лесорастительной зоны (подзоны). В лесостепи она в 5,5 раза превышает таковую в тундре. Последнее свидетельствует, что при повышении температуры и сохранении гидрологического режима накопление торфа, а следовательно, и депонирование углерода усилится. Имея данные о запасах торфа, можно легко подсчитать объемы задепонированного в них углерода. В плане недопущения ускорения разложения верхних слоёв торфа можно рекомендовать минимизацию антропогенного воздействия на болота. В частности, нецелесообразно осушение верховых болот с низким содержанием в торфе питательных элементов. Недопустимо повреждение живого напочвенного покрова болотных экосистем, поскольку последний восстанавливается довольно медленно, а отсутствие живого напочвенного покрова способствует изменению температурного режима и высыханию верхних слоев торфа. В конечном счете, это приводит к ускоренному разложению торфа и выделению углекислого газа.",Залесов С. В. РОЛЬ БОЛОТ В ДЕПОНИРОВАНИИ УГЛЕРОДА // МНИЖ. 2021. №7-2 (109). URL: https://cyberleninka.ru/article/n/rol-bolot-v-deponirovanii-ugleroda (дата обращения: 16.11.2024).,"Залесов С.В. (2021). РОЛЬ БОЛОТ В ДЕПОНИРОВАНИИ УГЛЕРОДА. Международный научно-исследовательский журнал,  (7-2 (109)), 6-9.",https://cyberleninka.ru/article/n/rol-bolot-v-deponirovanii-ugleroda
