Title,Authors,Journal,Year,Field of Science,Russian Keywords,English Keywords,Annotation,GOST,APA,Link
ОЦЕНКА ЭКСТРЕМАЛЬНЫХ ГИДРОЛОГИЧЕСКИХ ХАРАКТЕРИСТИК В УСЛОВИЯХ НЕОПРЕДЕЛЕННОСТИ КЛИМАТИЧЕСКИХ ИЗМЕНЕНИЙ,"Болгов Михаил Васильевич, Арефьева Елена Валентиновна",Технологии гражданской безопасности,2021,Науки о Земле и смежные экологические науки,"изменения климата, экстремальные гидрологические характеристики, вероятностные модели, байесовские оценки, наводнения, ливневые осадки",,"Изменения климата значительно влияют на рост и масштаб гидрологических процессов и явлений, приводящих к росту количества чрезвычайных ситуаций. В статье предлагаются подходы к оценке гидрологических характеристик, таких как максимальные значения расходов воды в условиях неопределенностей, вызванных, в том числе, климатическими изменениями. Для статистической обработки и оценки нестационарной последовательности гидрологических характеристик предлагается подход на основе теоремы Байеса, основанный на предположении о том, что в определенные моменты происходит смена состояния случайного процесса, а наблюдаемая выборка представляет собой набор однородных временных последовательностей, характеризуемый случайной сменой состояний","Болгов Михаил Васильевич, Арефьева Елена Валентиновна ОЦЕНКА ЭКСТРЕМАЛЬНЫХ ГИДРОЛОГИЧЕСКИХ ХАРАКТЕРИСТИК В УСЛОВИЯХ НЕОПРЕДЕЛЕННОСТИ КЛИМАТИЧЕСКИХ ИЗМЕНЕНИЙ // Технологии гражданской безопасности. 2021. №1 (67). URL: https://cyberleninka.ru/article/n/otsenka-ekstremalnyh-gidrologicheskih-harakteristik-v-usloviyah-neopredelennosti-klimaticheskih-izmeneniy (дата обращения: 16.11.2024).","Болгов Михаил Васильевич, & Арефьева Елена Валентиновна (2021). ОЦЕНКА ЭКСТРЕМАЛЬНЫХ ГИДРОЛОГИЧЕСКИХ ХАРАКТЕРИСТИК В УСЛОВИЯХ НЕОПРЕДЕЛЕННОСТИ КЛИМАТИЧЕСКИХ ИЗМЕНЕНИЙ. Технологии гражданской безопасности, 18 (1 (67)), 54-59.",https://cyberleninka.ru/article/n/otsenka-ekstremalnyh-gidrologicheskih-harakteristik-v-usloviyah-neopredelennosti-klimaticheskih-izmeneniy
ВЛИЯНИЕ ОПАСНЫХ ПРИРОДНЫХ ПРОЦЕССОВ И ЯВЛЕНИЙ НА БЕЗОПАСНОСТЬ ХОЗЯЙСТВЕННОЙ ДЕЯТЕЛЬНОСТИ В АРКТИЧЕСКОЙ ЗОНЕ РФ,Хвостова М.С.,Российская Арктика,2021,Науки о Земле и смежные экологические науки,"арктическая зона российской федерации, опасные природные процессы и явления, чрезвычайные ситуации, глобальное потепление","arctic zone of the russian federation, dangerous natural processes and phenomena, emergencies, global warming","В статье изложены современное положение и перспективы развития хозяйственной деятельности в Арктической зоне Российской Федерации, а также риски, связанные с глобальными климатическими изменениями. На основе анализа новейших исследований российских и зарубежных ученых рассмотрены происходящие и прогнозируемые опасные природные процессы и явления Арктической зоны Российской Федерации, такие как геоморфологические, биологические, гидрологические, сейсмические и другие. Климатические условия Арктики, их изменения следует рассматривать не только как источник участившихся опасных природных явлений, а как отражение негативных изменений в окружающей среде, наносящих ущерб условиям проживания населения, его здоровью, работе предприятий, транспорта, социальной инфраструктуре.",Хвостова М. С. ВЛИЯНИЕ ОПАСНЫХ ПРИРОДНЫХ ПРОЦЕССОВ И ЯВЛЕНИЙ НА БЕЗОПАСНОСТЬ ХОЗЯЙСТВЕННОЙ ДЕЯТЕЛЬНОСТИ В АРКТИЧЕСКОЙ ЗОНЕ РФ // Российская Арктика. 2021. №1 (12). URL: https://cyberleninka.ru/article/n/vliyanie-opasnyh-prirodnyh-protsessov-i-yavleniy-na-bezopasnost-hozyaystvennoy-deyatelnosti-v-arkticheskoy-zone-rf (дата обращения: 16.11.2024).,"Хвостова М.С. (2021). ВЛИЯНИЕ ОПАСНЫХ ПРИРОДНЫХ ПРОЦЕССОВ И ЯВЛЕНИЙ НА БЕЗОПАСНОСТЬ ХОЗЯЙСТВЕННОЙ ДЕЯТЕЛЬНОСТИ В АРКТИЧЕСКОЙ ЗОНЕ РФ. Российская Арктика,  (1 (12)), 5-22. doi: 10.24412/2658-4255-2021-1-05-22",https://cyberleninka.ru/article/n/vliyanie-opasnyh-prirodnyh-protsessov-i-yavleniy-na-bezopasnost-hozyaystvennoy-deyatelnosti-v-arkticheskoy-zone-rf
ОБЗОР МЕТОДОВ И ОСНОВНЫХ РЕЗУЛЬТАТОВ ИЗМЕРЕНИЯ ТОЛЩИНЫ МОРСКОГО ЛЬДА В АРКТИКЕ,"Т.А. Алексеева, С.В. Фролов, С.С. Сероветников",Российская Арктика,2021,Науки о Земле и смежные экологические науки,"бурение льда, климатические изменения, судовые ледовые наблюдения, толщина припая, толщина морского льда, электромагнитный толщиномер","drill-hole measurements, climate changes, visual ice observations, fast ice thickness, ice thickness, em sea ice thickness measurements","В статье приводится обзор основных методов измерения толщины ледяного покрова и результаты опубликованных в научной отечественной и зарубежной литературе исследований климатической и межгодовой изменчивости этого параметра ледяного покрова в морях Северного ледовитого океана и Арктическом бассейне. В настоящее время разработаны и активно применяются в полевых условиях несколько методов: бурение льда, акустический метод (эхолокация), электромагнитный метод, визуальные и телевизионные судовые наблюдения. Наибольшее площадное покрытие данными о толщине морского льда в СЛО в настоящее время может производится путем акустического подледного зондирования с подводных лодок, а также с помощью визуальных специальных судовых наблюдений и, одновременно, с помощью судового телевизионного комплекса с борта судов ледового класса и ледоколов. Измерения толщины льда, результаты которых представлены в настоящем обзоре, выполнены в различных районах Арктики, в различные сезоны года, различными методами и с различными временными периодами обобщений, а, следовательно, не позволяют дать однозначной оценки климатической и межгодовой изменчивости толщины льда. Сделан вывод, что, несмотря на неоднозначные оценки, на изменения средних значений толщины льда в Арктическом бассейне в основном влияют динамические процессы, обусловленные изменениями атмосферной циркуляции. Кроме того, разработанный в ААНИИ судовой телевизионный комплекс является перспективным направлением для автоматизации процесса наблюдений за толщиной льда с борта судов.","Т А. Алексеева, С В. Фролов, С С. Сероветников ОБЗОР МЕТОДОВ И ОСНОВНЫХ РЕЗУЛЬТАТОВ ИЗМЕРЕНИЯ ТОЛЩИНЫ МОРСКОГО ЛЬДА В АРКТИКЕ // Российская Арктика. 2021. №1 (12). URL: https://cyberleninka.ru/article/n/obzor-metodov-i-osnovnyh-rezultatov-izmereniya-tolschiny-morskogo-lda-v-arktike (дата обращения: 16.11.2024).","Т.А. Алексеева, С.В. Фролов, & С.С. Сероветников (2021). ОБЗОР МЕТОДОВ И ОСНОВНЫХ РЕЗУЛЬТАТОВ ИЗМЕРЕНИЯ ТОЛЩИНЫ МОРСКОГО ЛЬДА В АРКТИКЕ. Российская Арктика,  (1 (12)), 33-49. doi: 10.24412/2658-4255-2021-1-33-49",https://cyberleninka.ru/article/n/obzor-metodov-i-osnovnyh-rezultatov-izmereniya-tolschiny-morskogo-lda-v-arktike
ВЛИЯНИЕ КЛИМАТИЧЕСКИХ ИЗМЕНЕНИЙ НА МАКСИМАЛЬНЫЕ УРОВНИ ПЕРИОДА ПОЛОВОДЬЯ РЕКИ АБАКАН,"Галахов Владимир Прокопьевич, Ловцкая Ольга Вольфовна, Мардасова Елена Владимировна",Известия Томского политехнического университета. Инжиниринг георесурсов,2021,Науки о Земле и смежные экологические науки,"бассейн реки абакан, зимние осадки, орографическая добавка, скорость вертикальных движений, максимальные уровни",,"Актуальность работы обусловлена воздействием изменений климата на гидрологические режимы рек южной Сибири, увеличением повторяемости опасных гидрологических явлений. Наблюдаемые и прогнозируемые изменения в режимах половодий вызываются множеством факторов и требуют различных подходов для характеристики типов этих изменений.Цель: стохастическое моделирование сумм твердых осадков в исследуемом бассейне р. Абакан, установление их связи с максимальными уровнями воды в р. Абакан периода половодья в условиях пространственно-временной изменчивости гидрометеорологических факторов.Методы: комплексный географо-гидрометеорологический анализ, выявление зависимостей по данным многолетних гидрометеорологических наблюдений с использованием методов математической статистики, а также методики оценки количества осадков в бассейне с учетом орографический добавки к скорости вертикальных движений во фронтальной зоне, разработанной В.П. Галаховым.Результаты. Основным фактором формирования максимальных уровней периода половодья является количество зимних осадков. Обильные жидкие осадки на спаде половодья могут вносить значительные коррективы в максимальные уровни. Однако для бассейнов горных рек юга Западной и Восточной Сибири в последние десятилетия в связи с климатическими изменениями отмечается влияние условий промерзания почвогрунтов в осенний период на формирование максимальных уровней вследствие снеготаяния. Для бассейнов со значительной долей предгорных равнин в отдельные годы возможно уменьшениемаксимальных уровней периода половодья. Для бассейнов, имеющих в основном горный ландшафт, подобного эффекта не наблюдается. Разработана методика расчета сумм зимних ежегодных осадков в бассейне Абакана, учитывающая физические особенности формирования осадков в горах, в частности орографическую добавку к скорости вертикальных движений. На примере независимых данных показано, что алгоритмы расчета максимальных уровней за счет снеготаяния, основанные на регрессионных зависимостях, не всегда дают адекватные результаты. Необходима их корректировка с учетом процессов промерзания на предгорной равнине. Для получения общей статистической зависимости требуются дополнительные данные наблюдений.","Галахов Владимир Прокопьевич, Ловцкая Ольга Вольфовна, Мардасова Елена Владимировна ВЛИЯНИЕ КЛИМАТИЧЕСКИХ ИЗМЕНЕНИЙ НА МАКСИМАЛЬНЫЕ УРОВНИ ПЕРИОДА ПОЛОВОДЬЯ РЕКИ АБАКАН // Известия ТПУ. 2021. №3. URL: https://cyberleninka.ru/article/n/vliyanie-klimaticheskih-izmeneniy-na-maksimalnye-urovni-perioda-polovodya-reki-abakan (дата обращения: 16.11.2024).","Галахов Владимир Прокопьевич, Ловцкая Ольга Вольфовна, & Мардасова Елена Владимировна (2021). ВЛИЯНИЕ КЛИМАТИЧЕСКИХ ИЗМЕНЕНИЙ НА МАКСИМАЛЬНЫЕ УРОВНИ ПЕРИОДА ПОЛОВОДЬЯ РЕКИ АБАКАН. Известия Томского политехнического университета. Инжиниринг георесурсов, 332 (3), 219-228.",https://cyberleninka.ru/article/n/vliyanie-klimaticheskih-izmeneniy-na-maksimalnye-urovni-perioda-polovodya-reki-abakan
ПОТЕПЛЕНИЕ В АРКТИКЕ: ВОЗМОЖНОСТИ И РИСКИ,Жилина Ирина Юрьевна,Экономические и социальные проблемы России,2021,Науки о Земле и смежные экологические науки,"глобальное потепление, арктика, россия, северный морской путь, углеводороды, туризм, рыболовство, окружающая среда, коренные народы севера",,"Рассматриваются динамика и прогнозы климатических изменений в Арктике в результате роста глобальной температуры на планете. Анализируется воздействие климатических изменений на природную среду, некоторые сектора экономики и социальной сферы Арктической зоны России, образ жизни коренных народов Севера.",Жилина Ирина Юрьевна ПОТЕПЛЕНИЕ В АРКТИКЕ: ВОЗМОЖНОСТИ И РИСКИ // ЭСПР. 2021. №1 (45). URL: https://cyberleninka.ru/article/n/poteplenie-v-arktike-vozmozhnosti-i-riski (дата обращения: 16.11.2024).,"Жилина Ирина Юрьевна (2021). ПОТЕПЛЕНИЕ В АРКТИКЕ: ВОЗМОЖНОСТИ И РИСКИ. Экономические и социальные проблемы России,  (1 (45)), 66-87.",https://cyberleninka.ru/article/n/poteplenie-v-arktike-vozmozhnosti-i-riski
СТОХАСТИЧЕСКАЯ ГИДРОЛОГИЯ: РАЗВИТИЕ ОСНОВНЫХ ИДЕЙ В РОССИИ,Болгов Михаил Васильевич,Вестник Санкт-Петербургского университета. Науки о Земле,2021,Науки о Земле и смежные экологические науки,"стохастическая гидрология, распределения вероятностей, случайные процессы, корреляционная теория, многолетние колебания, нестационарные процессы, байесовские методы",,"Целью работы является оценка современного состояния научных исследований и основных результатов в области стохастической гидрологии. Разнообразные задачи научной и прикладной гидрологии решаются с помощью стохастических моделей различного типа. На основе этих же моделей разрабатываются методы получения надежных расчетных гидрологических характеристик либо достоверных гидрологических прогнозов различной заблаговременности. Большая часть водохозяйственных, строительных, экологических и прочих задач решается сегодня в рамках вероятностных моделей и статистических методов. Основные задачи стохастической гидрологии можно разделить на несколько групп. Несмотря на имевшую место в гидрологии дискуссию по вопросу применимости теории вероятностей и случайных процессов для анализа колебаний гидрометеорологических величин, проблема выбора методологии исследований остается одной из важнейших и довольно часто обсуждается в связи с аномальными проявлениями гидрологических явлений (экстремальными наводнениями, продолжительными маловодьями). Важной прикладной и теоретической задачей гидрологии является выбор одномерного распределения вероятностей. В этой части важны дискуссии как по проблеме типа новых распределений, так и по методам оценивания параметров. Рассматриваются идеи и гипотезы, позволяющие существенно увеличить надежность статистических характеристик. Климатические изменения во многих случаях являются причиной нарушений стационарности временных рядов гидрологических характеристик. Прогресс в развитии новых подходов к вероятностному моделированию связан как с известной задачей о достаточности марковской гипотезы, так и с необходимостью введения новых, более сложных моделей и байесовских методов оценивания. Статья посвящена обсуждению современного состояния этих проблем в форме научного обзора.",Болгов Михаил Васильевич СТОХАСТИЧЕСКАЯ ГИДРОЛОГИЯ: РАЗВИТИЕ ОСНОВНЫХ ИДЕЙ В РОССИИ // Вестник СПбГУ. Науки о Земле. 2021. №1. URL: https://cyberleninka.ru/article/n/stohasticheskaya-gidrologiya-razvitie-osnovnyh-idey-v-rossii (дата обращения: 16.11.2024).,"Болгов Михаил Васильевич (2021). СТОХАСТИЧЕСКАЯ ГИДРОЛОГИЯ: РАЗВИТИЕ ОСНОВНЫХ ИДЕЙ В РОССИИ. Вестник Санкт-Петербургского университета. Науки о Земле, 66 (1), 19-40.",https://cyberleninka.ru/article/n/stohasticheskaya-gidrologiya-razvitie-osnovnyh-idey-v-rossii
