Title,Authors,Journal,Year,Field of Science,Russian Keywords,English Keywords,Annotation,GOST,APA,Link
ФИТОИНДИКАЦИОННАЯ ОЦЕНКА СОВРЕМЕННЫХ ЛАНДШАФТНО - ЭКОЛОГИЧЕСКИХ ТЕНДЕНЦИЙ В ГЕОСИСТЕМАХ ЛОКАЛЬНОГО УРОВНЯ,Гусев А.П.,Российский журнал прикладной экологии,2021,Науки о Земле и смежные экологические науки,"ландшафтно-экологические тенденции, геосистемы, фитоиндикаторы, растительный покров, беларусь",,"Цель работы - оценка ландшафтно - экологических тенденций в геосистемах локального уровня на примере юго - востока Беларуси. Объекты исследования - природно - антропогенные ландшафты, представленные 5 тестовыми участками. Для оценки современных ландшафтно - экологических тенденций разработан комплекс показателей, получаемых на основе наземных и дистанционных исследований растительного покрова. Дается анализ и оценка экологической стабильности, фрагментации лесного покрова, процессов дигрессивной динамики растительности, восстановительных сукцессий на территории тестовых участков. Изучено влияние климатических факторов на биопродуктивность геосистем тестовых участков. Наиболее чувствительными к климатическим изменениями являются пахотные геосистемы. При потеплении климата в регионе наибольший рост напряженности ландшафтно - экологической тенденции прогнозируется на участке «Поколюбичи».",Гусев А. П. ФИТОИНДИКАЦИОННАЯ ОЦЕНКА СОВРЕМЕННЫХ ЛАНДШАФТНО - ЭКОЛОГИЧЕСКИХ ТЕНДЕНЦИЙ В ГЕОСИСТЕМАХ ЛОКАЛЬНОГО УРОВНЯ // Российский журнал прикладной экологии. 2021. №3 (27). URL: https://cyberleninka.ru/article/n/fitoindikatsionnaya-otsenka-sovremennyh-landshaftno-ekologicheskih-tendentsiy-v-geosistemah-lokalnogo-urovnya (дата обращения: 16.11.2024).,"Гусев А.П. (2021). ФИТОИНДИКАЦИОННАЯ ОЦЕНКА СОВРЕМЕННЫХ ЛАНДШАФТНО - ЭКОЛОГИЧЕСКИХ ТЕНДЕНЦИЙ В ГЕОСИСТЕМАХ ЛОКАЛЬНОГО УРОВНЯ. Российский журнал прикладной экологии,  (3 (27)), 4-10.",https://cyberleninka.ru/article/n/fitoindikatsionnaya-otsenka-sovremennyh-landshaftno-ekologicheskih-tendentsiy-v-geosistemah-lokalnogo-urovnya
АНАЛИЗ И ОЦЕНКА МНОГОЛЕТНИХ ИЗМЕНЕНИЙ ОСНОВНЫХ ГИДРОМЕТЕОРОЛОГИЧЕСКИХ ХАРАКТЕРИСТИК НА ВАЛДАЕ,Гуревич Елена Витальевна,Гидросфера. Опасные процессы и явления ,2021,Науки о Земле и смежные экологические науки,"температура воздуха, осадки, глубина промерзания, снежный покров, уровни подземных вод, расходы воды",,"Актуальность темы обусловлена непрекращающимся интересом к региональным последствиям потепления климата и обновлением оценок многолетних изменений по удлиненным рядам гидрометеорологических наблюдений. Целью исследования являлся анализ многолетних изменений температуры воздуха, атмосферных осадков, максимальной глубины промерзания почвы, высоты снежного покрова, режима подземных вод и речного стока за общий период наблюдений 1939-2018 годы по материалам Валдайской научно-исследовательской гидрологической лаборатории. В результате анализа набора данных метеорологических и гидрологических наблюдений, были даны оценки климатических изменений. Установлено повышение средней годовой температуры воздуха с 1988 года на 1,4°С с наиболее значительным ростом температуры воздуха в холодный период года в январе-феврале и в марте. Годовые суммы осадков выросли в среднем на 114 мм по сравнению с 1939-1979 годами, увеличение осадков произошло преимущественно в холодные месяцы года. Максимальная глубина промерзания почвы уменьшилась в среднем в 2 раза. При этом на исследованных малых водотока (лог Таежный и река Полометь) средний годовой сток рек существенно не изменился. В многолетних колебаниях максимального весеннего стока рек наблюдаются разнонаправленные тенденции. Уровни подземных вод в 1991-2016 годах не повышались, а в отдельных верхних водоносных слоях - понижались. Наибольшее пополнение запасов подземных вод весной стало происходить в среднем на 2 недели раньше. За последние 30 лет минимальные 30-суточные зимние расходы воды не росли, увеличилась вариация колебаний минимальных 30-суточных летне-осенних расходов воды рек.",Гуревич Елена Витальевна АНАЛИЗ И ОЦЕНКА МНОГОЛЕТНИХ ИЗМЕНЕНИЙ ОСНОВНЫХ ГИДРОМЕТЕОРОЛОГИЧЕСКИХ ХАРАКТЕРИСТИК НА ВАЛДАЕ // Гидросфера. Опасные процессы и явления . 2021. №1. URL: https://cyberleninka.ru/article/n/analiz-i-otsenka-mnogoletnih-izmeneniy-osnovnyh-gidrometeorologicheskih-harakteristik-na-valdae (дата обращения: 16.11.2024).,"Гуревич Елена Витальевна (2021). АНАЛИЗ И ОЦЕНКА МНОГОЛЕТНИХ ИЗМЕНЕНИЙ ОСНОВНЫХ ГИДРОМЕТЕОРОЛОГИЧЕСКИХ ХАРАКТЕРИСТИК НА ВАЛДАЕ. Гидросфера. Опасные процессы и явления , 3 (1), 87-104.",https://cyberleninka.ru/article/n/analiz-i-otsenka-mnogoletnih-izmeneniy-osnovnyh-gidrometeorologicheskih-harakteristik-na-valdae
ЭКОЛОГИЧЕСКИЕ НИШИ РЕГИОНАЛЬНЫХ ЭКОСИСТЕМ КРЫМСКОГО ПОЛУОСТРОВА В УСЛОВИЯХ ИЗМЕНЕНИЯ КЛИМАТА,"Горбунов Р.В., Табунщик В.А., Горбунова Т.Ю., Дрыгваль А.В.",Ученые записки Крымского федерального университета имени В. И. Вернадского. География. Геология,2021,Науки о Земле и смежные экологические науки,"экологическая ниша, экосистема, ландшафт, изменение климата, крымский полуостров, циркуляционная эпоха, циркуляционный период, типизация б. л. дзердзеевского",,"В статье рассмотрена реакция региональных экосистем на климатические изменения с использованием концепции экологической ниши. На примере ключевых участков детально показано, как изменяются экологические ниши в пространстве факторов «Температура, °C» и «Осадки, мм» при смене циркуляционных эпох и периодов Северного полушария, а также рассчитаны и проанализированы основные характеристики двухмерных экологических ниш в пространстве факторов «Температура,°C» и «Осадки, мм» - минимальное и максимальное значение фактора, факторная амплитуда, центральное значение амплитуды (медиана), среднее значение амплитуды, мера перекрытия ниш и объем экологических ниш. Установлено, что в результате климатических изменений с 1916 по 2013 г. происходит сдвиг экологических ниш региональных экосистем, общий тренд которых по осям факторного пространства направлен в сторону увеличения показателей температуры воздуха и количества выпадающих осадков. Также выявлено, что в различных региональных экосистемах равнинного и горного Крыма проявление климатических изменений происходит с большими отличиями, о чем свидетельствуют большие различия в факторных амплитудах и объемах экологических ниш.","Горбунов Р. В., Табунщик В. А., Горбунова Т. Ю., Дрыгваль А. В. ЭКОЛОГИЧЕСКИЕ НИШИ РЕГИОНАЛЬНЫХ ЭКОСИСТЕМ КРЫМСКОГО ПОЛУОСТРОВА В УСЛОВИЯХ ИЗМЕНЕНИЯ КЛИМАТА // Ученые записки Крымского федерального университета имени В. И. Вернадского. География. Геология. 2021. №2. URL: https://cyberleninka.ru/article/n/ekologicheskie-nishi-regionalnyh-ekosistem-krymskogo-poluostrova-v-usloviyah-izmeneniya-klimata (дата обращения: 16.11.2024).","Горбунов Р.В., Табунщик В.А., Горбунова Т.Ю., & Дрыгваль А.В. (2021). ЭКОЛОГИЧЕСКИЕ НИШИ РЕГИОНАЛЬНЫХ ЭКОСИСТЕМ КРЫМСКОГО ПОЛУОСТРОВА В УСЛОВИЯХ ИЗМЕНЕНИЯ КЛИМАТА. Ученые записки Крымского федерального университета имени В. И. Вернадского. География. Геология, 7 (2), 249-278.",https://cyberleninka.ru/article/n/ekologicheskie-nishi-regionalnyh-ekosistem-krymskogo-poluostrova-v-usloviyah-izmeneniya-klimata
ВЛИЯНИЕ КЛИМАТИЧЕСКИХ И АНТРОПОГЕННЫХ ФАКТОРОВ НА ВЕСЕННИЙ СТОК В БАССЕЙНЕ ДОНА,"Варенцова Н. А., Гречушникова М. Г., Повалишникова Е. С., Киреева М. Б., Харламов М. А., Фролова Н. Л.",Вестник Московского университета. Серия 5. География,2021,Науки о Земле и смежные экологические науки,"внутригодовое распределение стока, водохранилище, техногенный потенциал регулирования, половодье, изменение климата",,"В статье рассмотрены современные особенности стока весеннего половодья в бассейне Дона за 1930-2017 гг. Его масштабные изменения за последние полвека приурочены к 1980 и 2006-2010 гг. В эти периоды наблюдались наиболее существенные климатические изменения, усугубленные в XX в. значительно возросшим антропогенным регулированием стока многочисленными водохранилищами. Применение метода интегральных кривых совместно со статистическим анализом слоя весеннего стока по данным 50 гидрологических постов позволило разделить вклад климатических изменений и антропогенной составляющей в формирование современных тенденций сокращения половодного стока на реках бассейна Дона. По результатам проведенных исследований установлено его сокращение за последние 40 лет в среднем на 30-40%: от 10% в верховьях Воронежа, Хопра и Медведицы до более чем 50-60% в бассейнах рек Северский Донец и Оскол. По характеру изменения весеннего стока реки бассейна Дона разделены на три группы: с началом периода сокращения стока после 1980 г., после 2006-2010 гг. и без изменений весеннего стока. По проведенным оценкам величина видимого испарения с поверхности водохранилищ в бассейне Дона выше Цимлянского водохранилища сравнительно невелика и составляет 0,09 км3 или 0,5% от среднегодового стока Дона в створе города Калач-на-Дону. Однако в маловодные годы на водосборах с интенсивной хозяйственной деятельностью этот фактор может значительно усиливать дефицит водных ресурсов. Подсчитано, что доля суммарного полезного объема водохранилищ в бассейнах крупнейших притоков Дона составляет в среднем 43% от сокращения объема их стока в период половодья, что свидетельствует о значительной возможности сезонного перераспределения стока воды водохранилищами объемом более 0,1 км3 . Проведена оценка техногенного потенциала регулирования (ТПР) водохранилищ бассейна объемом более 0,1 км3 . Отмечено сокращение весеннего стока на реках при росте ТПР водохранилищ в их бассейнах.","Варенцова Н. А., Гречушникова М. Г., Повалишникова Е. С., Киреева М. Б., Харламов М. А., Фролова Н. Л. ВЛИЯНИЕ КЛИМАТИЧЕСКИХ И АНТРОПОГЕННЫХ ФАКТОРОВ НА ВЕСЕННИЙ СТОК В БАССЕЙНЕ ДОНА // Вестник Московского университета. Серия 5. География. 2021. №5. URL: https://cyberleninka.ru/article/n/vliyanie-klimaticheskih-i-antropogennyh-faktorov-na-vesenniy-stok-v-basseyne-dona (дата обращения: 16.11.2024).","Варенцова Н. А., Гречушникова М. Г., Повалишникова Е. С., Киреева М. Б., Харламов М. А., & Фролова Н. Л. (2021). ВЛИЯНИЕ КЛИМАТИЧЕСКИХ И АНТРОПОГЕННЫХ ФАКТОРОВ НА ВЕСЕННИЙ СТОК В БАССЕЙНЕ ДОНА. Вестник Московского университета. Серия 5. География,  (5), 91-108.",https://cyberleninka.ru/article/n/vliyanie-klimaticheskih-i-antropogennyh-faktorov-na-vesenniy-stok-v-basseyne-dona
ВЛИЯНИЕ ПАРНИКОВЫХ ГАЗОВ В ТЕХНОСФЕРЕ г. ТОЛЬЯТТИ НА ФОРМИРОВАНИЕ ФОТОХИМИЧЕСКОГО СМОГА,"Афанасьев Сергей Васильевич, Шевченко Юлия Николаевна, Мельникова Дарья Анатольевна","Устойчивое развитие, экоинновации и «зеленые» экономика и технологии: III Всероссийская научно-практическая конференция с международным участием, посвященная 90-летию СГЭУ",2021,Науки о Земле и смежные экологические науки,"загрязнители атмосферы, оксиды азота, озон, формальдегид, пан, коэффициент трансформации, фотохимический смог","atmospheric pollutants, nitrogen oxides, ozone, formaldehyde, pan, transformation coefficient, photochemical smog","В работе проанализированы основные причины образования фотохимического смога в городском округе Тольятти Самарской области, на территории которого сосредоточены крупные источники выбросов монои диоксида азота в виде двух ТЭЦ, девяти агрегатов аммиака и двух крупнотоннажных установок метилового спирта, а также источники загрязнения атмосферы углеводородами и летучими органическими соединениями, в качестве которых выступают производства синтетических каучуков в ООО «Сибур-Тольятти», капролактама в ПАО «КуйбышевАзот», метанола в ООО «Томет» и окраски автомобилей в АО «АвтоВАЗ». Оценён вклад каждого из них в формирование агрессивной воздушной среды и фотохимического смога. С привлечением результатов наблюдений по другим городам Российской Федерации объяснено накопление в тропосфере г.о. Тольятти формальдегида, озона и ПАН. Сделан важный практический вывод о наличии тесной взаимосвязи между концентрациями первичных и вторичных загрязнителей в тропосфере.","Афанасьев Сергей Васильевич, Шевченко Юлия Николаевна, Мельникова Дарья Анатольевна ВЛИЯНИЕ ПАРНИКОВЫХ ГАЗОВ В ТЕХНОСФЕРЕ г. ТОЛЬЯТТИ НА ФОРМИРОВАНИЕ ФОТОХИМИЧЕСКОГО СМОГА // Устойчивое развитие, экоинновации и «зеленые» экономика и технологии: III Всероссийская научно-практическая конференция с международным участием, посвященная 90-летию СГЭУ. 2021. №. URL: https://cyberleninka.ru/article/n/vliyanie-parnikovyh-gazov-v-tehnosfere-g-tolyatti-na-formirovanie-fotohimicheskogo-smoga (дата обращения: 16.11.2024).","Афанасьев Сергей Васильевич, Шевченко Юлия Николаевна, & Мельникова Дарья Анатольевна (2021). ВЛИЯНИЕ ПАРНИКОВЫХ ГАЗОВ В ТЕХНОСФЕРЕ г. ТОЛЬЯТТИ НА ФОРМИРОВАНИЕ ФОТОХИМИЧЕСКОГО СМОГА. Устойчивое развитие, экоинновации и «зеленые» экономика и технологии: III Всероссийская научно-практическая конференция с международным участием, посвященная 90-летию СГЭУ, 3 , 16-24. doi: 10.24412/cl-36578-2021-3-16-24",https://cyberleninka.ru/article/n/vliyanie-parnikovyh-gazov-v-tehnosfere-g-tolyatti-na-formirovanie-fotohimicheskogo-smoga
