Title,Authors,Journal,Year,Field of Science,Russian Keywords,English Keywords,Annotation,GOST,APA,Link
МОДЕЛЬ ОБЪЕМА СТВОЛА ИВЫ: МЕТА-АНАЛИЗ,"Усольцев В.А., Парамонов А.А., Третьяков С.В., Коптев С.В., Цепордей И.С.",Известия высших учебных заведений. Лесной журнал,2021,Биологические науки,"род salix l, объем ствола, всеобщая модель, мета-анализ, регрессионный анализ",,"Прогнозы последствий глобального потепления стимулируют исследования углероддепонирующей способности растительного покрова. Ствол представляет собой основную часть биомассы дерева, и от точности характеристики объема ствола зависит возможность корректного мониторинга и предварительной оценки будущего состояния лесных ресурсов. В российском лесоустройстве ива не входила в число основных лесообразующих видов, и поэтому необходимости в разработке таксационных нормативов для нее не было. Однако в связи с возросшей актуальностью оценки углероддепонирующей функции лесов России и необходимостью учета вклада в углеродный баланс всех видов растительности возникла потребность в создании подобных нормативов. Это может быть обеспечено разработкой всеобщей модели (или таблицы), учитывающей морфологию ив в пределах всего рода Salix L. и построенной по опубликованным в разных регионах и странах данным. Объект исследования - данные об объемах стволов ивы, размещенные в свободном доступе в России, Казахстане, Болгарии и Норвегии в виде таблиц или регрессионных моделей. Насколько каждая локальная модель применима в других регионах неизвестно. Для снятия этой неопределенности нами использован мета-анализ как статистическая процедура, объединяющая результаты нескольких независимых исследований с целью нахождения общей закономерности. Получена универсальная модель объема стволов рода Salix, которая характеризуется высоким коэффициентом детерминации и может быть применена для оценки объема ствола любого вида данного рода с минимальными отклонениями от расчетных значений. Результаты направлены на повышение точности учета лиственных насаждений при проведении лесоустроительных и мониторинговых работ, таксации древостоев на постоянных и временных пробных площадях. Применение унифицированных нормативов при использовании, воспроизводстве, охране и защите древостоев ивы древовидной при всем многообразии ее видов позволит решить ряд практических вопросов. Для цитирования: Усольцев В.А., Парамонов А.А., Третьяков С.В., Коптев С.В., Цепордей И.С. Модель объема ствола ивы: мета-анализ // Изв. вузов. Лесн. журн. 2021.  № 3. С. 49-58. DOI: 10.37482/0536-1036-2021-3-49-58","Усольцев В. А., Парамонов А. А., Третьяков С. В., Коптев С. В., Цепордей И. С. МОДЕЛЬ ОБЪЕМА СТВОЛА ИВЫ: МЕТА-АНАЛИЗ // Известия ВУЗов. Лесной журнал. 2021. №3 (381). URL: https://cyberleninka.ru/article/n/model-obema-stvola-ivy-meta-analiz (дата обращения: 14.11.2024).","Усольцев В.А., Парамонов А.А., Третьяков С.В., Коптев С.В., & Цепордей И.С. (2021). МОДЕЛЬ ОБЪЕМА СТВОЛА ИВЫ: МЕТА-АНАЛИЗ. Известия высших учебных заведений. Лесной журнал,  (3 (381)), 49-58.",https://cyberleninka.ru/article/n/model-obema-stvola-ivy-meta-analiz
"СОВРЕМЕННЫЕ КЛИМАТИЧЕСКИЕ ИЗМЕНЕНИЯ, ДИНАМИКА АРЕАЛОВ И РАЗНООБРАЗИЕ ПТИЦ АРИДНЫХ ТЕРРИТОРИЙ ВНУТРЕННЕЙ АЗИИ",Ю.И. Мельников,Степи Северной Евразии: материалы IХ международного симпозиума,2021,Биологические науки,"внутренняя азия, потепление климата, прибрежные птицы, динамика ареалов и видового разнообразия, степные виды птиц","inner asia, climate warming, coastal birds, dynamics of habitats and species diversity, steppe bird species","Смена атмосферной циркуляции, вызванная повышением солнечной активности, с широтной на меридиональную привела в середине XX столетия к формированию во Внутренней Азии обширных и сильных засух. Они сопровождались смещением ареалов птиц к северу и резким сокращением их обилия в южных регионах, представленных зонами пустыни и степи. Однако подобные изменения были характерны для птиц интразональных местообитаний водно-болотных экосистем. Исконно степные виды птиц реагировали на потепление климата в меньшей степени. У них отмечены только залеты к северным границам ареалов, частота которых постепенно увеличивалась, обеспечивая рост разнообразия птиц в северных регионах Азии.","Ю И. Мельников СОВРЕМЕННЫЕ КЛИМАТИЧЕСКИЕ ИЗМЕНЕНИЯ, ДИНАМИКА АРЕАЛОВ И РАЗНООБРАЗИЕ ПТИЦ АРИДНЫХ ТЕРРИТОРИЙ ВНУТРЕННЕЙ АЗИИ // Степи Северной Евразии: материалы IХ международного симпозиума. 2021. №. URL: https://cyberleninka.ru/article/n/sovremennye-klimaticheskie-izmeneniya-dinamika-arealov-i-raznoobrazie-ptits-aridnyh-territoriy-vnutrenney-azii (дата обращения: 14.11.2024).","Ю.И. Мельников (2021). СОВРЕМЕННЫЕ КЛИМАТИЧЕСКИЕ ИЗМЕНЕНИЯ, ДИНАМИКА АРЕАЛОВ И РАЗНООБРАЗИЕ ПТИЦ АРИДНЫХ ТЕРРИТОРИЙ ВНУТРЕННЕЙ АЗИИ. Степи Северной Евразии: материалы IХ международного симпозиума, 9 , 548-554. doi: 10.24412/cl-36359-2021-548-554",https://cyberleninka.ru/article/n/sovremennye-klimaticheskie-izmeneniya-dinamika-arealov-i-raznoobrazie-ptits-aridnyh-territoriy-vnutrenney-azii
ВОССТАНОВЛЕНИЕ СТЕПНЫХ ЛАНДШАФТОВ В РЕЖИМЕ ЗАПОВЕДОВАНИЯ НА ПРИМЕРЕ ЗАПОВЕДНИКА «АРКАИМ»,"А.Л. Плаксина, Л.М. Маркова, К.С. Макарова",Степи Северной Евразии: материалы IХ международного симпозиума,2021,Биологические науки,"степные экосистемы, ландшафт, метод дешифрирования аэрои космоматериалов, гис, климатические изменения, пастбищная нагрузка","steppe ecosystems, landscape, interpretation remote sensing data, gis, climate change, pasture load","В статье описаны изменения степных экосистем участка заповедника «Аркаим» по материалам аэрои космоматериалов за разные годы с 1978 по 2018 год. С применением картографического и полевого описания получены площадные, геоморфологические, почвенные и ботанические характеристики территории исследования. Проанализировано влияние климата и пастбищной нагрузки на восстановление степей в заповеднике на протяжении последних 40 лет.","А Л. Плаксина, Л М. Маркова, К С. Макарова ВОССТАНОВЛЕНИЕ СТЕПНЫХ ЛАНДШАФТОВ В РЕЖИМЕ ЗАПОВЕДОВАНИЯ НА ПРИМЕРЕ ЗАПОВЕДНИКА «АРКАИМ» // Степи Северной Евразии: материалы IХ международного симпозиума. 2021. №. URL: https://cyberleninka.ru/article/n/vosstanovlenie-stepnyh-landshaftov-v-rezhime-zapovedovaniya-na-primere-zapovednika-arkaim (дата обращения: 14.11.2024).","А.Л. Плаксина, Л.М. Маркова, & К.С. Макарова (2021). ВОССТАНОВЛЕНИЕ СТЕПНЫХ ЛАНДШАФТОВ В РЕЖИМЕ ЗАПОВЕДОВАНИЯ НА ПРИМЕРЕ ЗАПОВЕДНИКА «АРКАИМ». Степи Северной Евразии: материалы IХ международного симпозиума, 9 , 642-649. doi: 10.24412/cl-36359-2021-642-649",https://cyberleninka.ru/article/n/vosstanovlenie-stepnyh-landshaftov-v-rezhime-zapovedovaniya-na-primere-zapovednika-arkaim
ЭФФЕКТИВНОСТЬ РЕАБИЛИТАЦИИ ЭКОСИСТЕМ ОБВОДНЕННЫХ ТОРФЯНИКОВ В ПОЙМЕ РЕКИ ДУБНЫ НА ОСНОВЕ АНАЛИЗА ДИНАМИКИ ГНЕЗДОВОЙ ПОПУЛЯЦИИ СЕРОГО ЖУРАВЛЯ (ТАЛДОМСКИЙ ГОРОДСКОЙ ОКРУГ МОСКОВСКОЙ ОБЛАСТИ),"О.С. Гринченко , А.В. Дулин , К. Цоклер , Т. Теннхардт , Н.В. Мокиевский",Экосистемы: экология и динамика,2021,Биологические науки,"обводнение торфяников, серый журавль, пойменные экосистемы, река дубна, заказник «журавлиная родина», вид-индикатор биоразнообразия",,"Большинство болот и многие заболоченные земли в Московской области претерпели полную хозяйственную трансформацию, пик которой пришёлся на 1920-1980-х гг. Сильному воздействию подверглись долины рек, где русла были зарегулированы для эффективного сброса избытка воды из дренажных систем. Проблемы деградации экосистем осушенных торфяников и окружающих их территорий, на которые это осушение влияет, поставили задачи обводнения и дальнейшей экологической реабилитации. Это важно для борьбы с тростниковыми и торфяными пожарами и для сохранения биоразнообразия на ООПТ и окружающих их осушенных торфяниках, подверженных этим пожарам. Исследования проводились в Талдомском городском округе Московской области в 2001-2020 гг. в Дубненском болотном массиве. В этот период здесь были реализованы проекты по удержанию воды на нарушенных участках поймы р. Дубны. Финансовую поддержку проекту оказал фонд Манфреда Хермсена (Германия). Одним из видов-индикаторов состояния водно-болотных экосистем является серый журавль, так как гнездование этого вида находится в тесной зависимости от гидрологических условий. В 2020 г. в пойме р. Дубны отмечено увеличение численности гнездовой популяции. Этому способствуют климатические изменения, в результате которых увеличивается заболачиваемость долинных территорий и повышается, стабилизируясь, уровень безнапорных грунтовых вод. Появление территориальных пар серого журавля в гнездовой период и ночёвочных стаций в осенний период на обводнённом участке пойменных болот, где журавли ранее не отмечались, указывает на эффективность принятых мер по удержанию воды в старичных озёрах р. Дубны путём строительства дамб. Изучение динамики распределения территориальных пар серых журавлей в водно-болотных ландшафтах даёт возможность делать выводы об изменениях условий среды и прогнозировать изменения состава животного населения для решения проблемы управления водно-болотными экосистемами для сохранения их биоразнообразия.","О С. Гринченко, А В. Дулин, К Цоклер, Т Теннхардт, Н В. Мокиевский ЭФФЕКТИВНОСТЬ РЕАБИЛИТАЦИИ ЭКОСИСТЕМ ОБВОДНЕННЫХ ТОРФЯНИКОВ В ПОЙМЕ РЕКИ ДУБНЫ НА ОСНОВЕ АНАЛИЗА ДИНАМИКИ ГНЕЗДОВОЙ ПОПУЛЯЦИИ СЕРОГО ЖУРАВЛЯ (ТАЛДОМСКИЙ ГОРОДСКОЙ ОКРУГ МОСКОВСКОЙ ОБЛАСТИ) // Экосистемы: экология и динамика. 2021. №2. URL: https://cyberleninka.ru/article/n/effektivnost-reabilitatsii-ekosistem-obvodnennyh-torfyanikov-v-poyme-reki-dubny-na-osnove-analiza-dinamiki-gnezdovoy-populyatsii (дата обращения: 14.11.2024).","О.С. Гринченко , А.В. Дулин , К. Цоклер , Т. Теннхардт , & Н.В. Мокиевский (2021). ЭФФЕКТИВНОСТЬ РЕАБИЛИТАЦИИ ЭКОСИСТЕМ ОБВОДНЕННЫХ ТОРФЯНИКОВ В ПОЙМЕ РЕКИ ДУБНЫ НА ОСНОВЕ АНАЛИЗА ДИНАМИКИ ГНЕЗДОВОЙ ПОПУЛЯЦИИ СЕРОГО ЖУРАВЛЯ (ТАЛДОМСКИЙ ГОРОДСКОЙ ОКРУГ МОСКОВСКОЙ ОБЛАСТИ). Экосистемы: экология и динамика, 5 (2), 86-101. doi: 10.24411/2542-2006-2021-10085",https://cyberleninka.ru/article/n/effektivnost-reabilitatsii-ekosistem-obvodnennyh-torfyanikov-v-poyme-reki-dubny-na-osnove-analiza-dinamiki-gnezdovoy-populyatsii
ПОЖАРЫ КАК ФАКТОР УТРАТЫ БИОРАЗНООБРАЗИЯ И ФУНКЦИЙ ЛЕСНЫХ ЭКОСИСТЕМ,"Гераськина А.П., Тебенькова Д.Н., Ершов Д.В., Ручинская Е.В., Сибирцева Н.В., Лукина Н.В.",Вопросы лесной науки,2021,Биологические науки,"лес, пожары, растительность, животные, ключевые виды, парниковые газы, почва, климат, углерод, экосистемные услуги, эмиссии",,"В связи с возрастающим антропогенным воздействием и глобальными климатическими изменениями, частота и интенсивность пожаров возрастают по всему миру. Пирогенный фактор становится всё более острой проблемой для лесных стран, требующей незамедлительных решений, так как происходят катастрофические сокращения площади лесных экосистем, невосполнимая утрата биоразнообразия - провайдера экосистемных функций и услуг лесов. Многие биологи рассматривают пожары как губительный для биоты фактор, приводящий к безвозвратной утере части видов и групп живых организмов, а если после действия пожаров восстановление и возможно, для этого требуется продолжительный период времени. Однако в настоящее время появляется время всё больше научных работ, авторы которых утверждают, что пожары не только не сокращают, но и повышают биоразнообразие лесных экосистем, а также способствуют сохранению видов и устойчивому функционированию лесов.Данная статья направлена на анализ результатов исследований влияния пожаров на основные компоненты лесных экосистем, их биоразнообразие и функции. Авторы дают ответ на вопрос, почему пожар как очевидно деструктивный фактор иногда рассматривается как фактор повышения биоразнообразия. Большинство «положительных» эффектов пожаров на биоразнообразие сводится к возникновению мозаичности, прорывов в пологе леса после пожара. Однако проведенный анализ литературы показывает, что устойчивое мнение в ряде работ о необходимости определенной периодичности пожаров для поддержания лесных сообществ связано с игнорированием или недопониманием роли биотических факторов в функционировании лесов. В современных лесных экосистемах утрачены или сильно сокращены популяции ключевых видов крупных млекопитающих, а следовательно, отсутствуют и формируемые ими микросайты, включая большие прорывы в пологе леса (окна, поляны), обеспечивающие возможности поддержания светолюбивой флоры, насекомых-опылителей и в целом поддержания условий для развития разновозрастных полидоминантных лесных экосистем с высоким биологическим разнообразием. В практике ведения лесного хозяйства известны подходы по поддержанию мозаичности (специальные виды рубок, поддержание популяций ключевых видов животных и др.), которые существенно менеекатастрофичны в сравнении с пирогенным фактором и биологически обоснованы. Даны рекомендации по сохранению и поддержанию биоразнообразия и экосистемных функций лесов в современных лесах.","Гераськина А. П., Тебенькова Д. Н., Ершов Д. В., Ручинская Е. В., Сибирцева Н. В., Лукина Н. В. ПОЖАРЫ КАК ФАКТОР УТРАТЫ БИОРАЗНООБРАЗИЯ И ФУНКЦИЙ ЛЕСНЫХ ЭКОСИСТЕМ // Вопросы лесной науки. 2021. №2. URL: https://cyberleninka.ru/article/n/pozhary-kak-faktor-utraty-bioraznoobraziya-i-funktsiy-lesnyh-ekosistem (дата обращения: 14.11.2024).","Гераськина А.П., Тебенькова Д.Н., Ершов Д.В., Ручинская Е.В., Сибирцева Н.В., & Лукина Н.В. (2021). ПОЖАРЫ КАК ФАКТОР УТРАТЫ БИОРАЗНООБРАЗИЯ И ФУНКЦИЙ ЛЕСНЫХ ЭКОСИСТЕМ. Вопросы лесной науки, 4 (2).",https://cyberleninka.ru/article/n/pozhary-kak-faktor-utraty-bioraznoobraziya-i-funktsiy-lesnyh-ekosistem
