Title,Authors,Journal,Year,Field of Science,Russian Keywords,English Keywords,Annotation,GOST,APA,Link
Определение оптимальных сочетаний компонентов для получения ихтиоло-глиоксалевых суппозитроий,"Миннебаев Ш.Г., Юсупова Р.Х.",Ученые записки Казанской государственной академии ветеринарной медицины им. Н. Э. Баумана,2016,Агробиотехнологии,"глиоксаль, ихтиол, полиэтиленгликоль, глицерин, кишечная палочка, стафилококки, сенная палочка, суппозитории","glyoxal, ichthyol, polyethylene glycol, glycerinum, coli bacillus, staphylococcus, bacillus subtilis, suppositoria","В ходе проведенных исследований сохраняя соотношение ихтиола и глиоксаля 1:1 подобрали оптимальное количество полиэтиленгликоля 6000 для получения ихтиоло-глиоксалевых суппозиторий и установили, что они подавляют рост кишечной палочки М-17 (включительно) до разведения 1:128, стафилококков Р-209 до разведения 1:256 и сенную палочку П-2 до разведения 1:512.","Миннебаев Ш. Г., Юсупова Р. Х. Определение оптимальных сочетаний компонентов для получения ихтиоло-глиоксалевых суппозитроий // Ученые записки КГАВМ им. Н.Э. Баумана. 2016. №1. URL: https://cyberleninka.ru/article/n/opredelenie-optimalnyh-sochetaniy-komponentov-dlya-polucheniya-ihtiolo-glioksalevyh-suppozitroiy (дата обращения: 24.10.2024).","Миннебаев Ш.Г., & Юсупова Р.Х. (2016). Определение оптимальных сочетаний компонентов для получения ихтиоло-глиоксалевых суппозитроий. Ученые записки Казанской государственной академии ветеринарной медицины им. Н. Э. Баумана, 225 (1), 53-55.",https://cyberleninka.ru/article/n/opredelenie-optimalnyh-sochetaniy-komponentov-dlya-polucheniya-ihtiolo-glioksalevyh-suppozitroiy
Полноценный растительный белок как средство повышения продуктивности сельскохозяйственных животных,"Гасимова Г.А., Дегтярева И.А.",Ученые записки Казанской государственной академии ветеринарной медицины им. Н. Э. Баумана,2016,Агробиотехнологии,"амарант, фитомасса, растительный белок, белковые фракции, незаменимые аминокислоты, сельскохозяйственные животные","the amaranth phytomass, plant protein, protein fraction, essential amino acids, farm animals","В процессе производственной интродукции амаранта перспективной сельскохозяйственной культуры универсального использования (кормового, пищевого, лекарственного) получены экспериментальные данные для Поволжского региона. Проведены разработки технологий получения из фитомассы амаранта белковых кормовых добавок, а также использования белковой витаминно-травяной муки из амаранта в рационах кормления кур-несушек. Повышенное содержание лизина в белке амаранта является главной причиной значительного увеличения продуктивности при введении его в рационы кормления различных животных.","Гасимова Г. А., Дегтярева И. А. Полноценный растительный белок как средство повышения продуктивности сельскохозяйственных животных // Ученые записки КГАВМ им. Н.Э. Баумана. 2016. №2. URL: https://cyberleninka.ru/article/n/polnotsennyy-rastitelnyy-belok-kak-sredstvo-povysheniya-produktivnosti-selskohozyaystvennyh-zhivotnyh (дата обращения: 24.10.2024).","Гасимова Г.А., & Дегтярева И.А. (2016). Полноценный растительный белок как средство повышения продуктивности сельскохозяйственных животных. Ученые записки Казанской государственной академии ветеринарной медицины им. Н. Э. Баумана, 226 (2), 199-202.",https://cyberleninka.ru/article/n/polnotsennyy-rastitelnyy-belok-kak-sredstvo-povysheniya-produktivnosti-selskohozyaystvennyh-zhivotnyh
Эффективность совместного применения препаратов на семенах гороха,"Ерохин А.И., Павловская Н.Е.",Земледелие,2016,Агробиотехнологии,"препарат, флоргумат универсальный, семена, растения, обработка, урожайность","preparation, florgumat universal, seeds, plants, treatment, yield","Цель данной работы состояла в изучении влияния совместной предпосевной обработки семян гороха сортов Фараон и Софья препаратом на основе лектинов зернобобовых культур и гуминовым препаратом ФлорГумат универсальный на посевные качества семян и урожайность. Опыты с обработанными семенами гороха проведены в 2011-2013 гг. в севообороте лаборатории семеноведения и первичного семеноводства ВНИИЗБК на темно-серых, лесных, среднесуглинистых почвах, с мощностью гумусового горизонта 25-30 см и содержанием гумуса в почве 4,2-4,6%. Норма высева обработанных и контрольных семян гороха -1,2 млн всхожих семян на гектар, размер опытных делянок 10 м2, повторность шестикратная. Во время вегетации растений проведены наблюдения, учеты всхожести семян и отбор образцов растений для определения структуры урожая. Убранный урожай гороха учитывали поделяночно, полученные данные обрабатывали методом дисперсионного анализа. В наших исследованиях установлено, что совместное применение препарата в 10-4% концентрации и ФлорГумата универсального в дозе 200 мл/т на семенах увеличивает длину проростков обработанных семян гороха сорта Фараон на 10,7-19,2%, гороха сорта Софья на 11,7-15,4%, по сравнению с контролем. Зеленая масса растений гороха Фараон при обработке семян препаратами превышала контроль на 27,9%, гороха Софья на 16,2%; сухая масса растений, соответственно на 25,5% и 15,7%. Полевая всхожесть обработанных препаратами семян гороха Фараон была выше контроля на 4%, гороха Софья 5%. Прибавка в урожайности сорта Фараон составила к контролю 0,21 т/ га (10,2%), гороха Софья 0,20 т/га (10,3%). Отмечено увеличение количества бобов, зерен и массы зерна гороха с одного растения на 9,5-11,1%, по сравнению с вариантом без обработки.","Ерохин А. И., Павловская Н. Е. Эффективность совместного применения препаратов на семенах гороха // Земледелие. 2016. №4. URL: https://cyberleninka.ru/article/n/effektivnost-sovmestnogo-primeneniya-preparatov-na-semenah-goroha (дата обращения: 24.10.2024).","Ерохин А.И., & Павловская Н.Е. (2016). Эффективность совместного применения препаратов на семенах гороха. Земледелие,  (4), 17-19.",https://cyberleninka.ru/article/n/effektivnost-sovmestnogo-primeneniya-preparatov-na-semenah-goroha
Вклад отраслевых академических учреждений украинской ССР в развитие научных основ механизации животноводства,Бей Роман Васильевич,Манускрипт,2016,Агробиотехнологии,"механизация, автоматизация, животноводство, машинное доение, технология производства","mechanization, automatization, machine milking, production engineering, cattle production","Автором обосновано, что предпосылкой становления и развития теоретических и методологических основ механизации животноводства являлась институционализация отраслевой науки. Освещены этапы становления системных научных исследований по механизации и автоматизации животноводства на базе отраслевых академических учреждений УССР в 30-80-е годы ХХ столетия. Обобщены основные разработки по механизации и автоматизации доения, приготовления и раздачи кормов, водоснабжения, уборки и утилизации навоза на фермах и промышленных комплексах.",Бей Роман Васильевич Вклад отраслевых академических учреждений украинской ССР в развитие научных основ механизации животноводства // Манускрипт. 2016. №2 (64). URL: https://cyberleninka.ru/article/n/vklad-otraslevyh-akademicheskih-uchrezhdeniy-ukrainskoy-ssr-v-razvitie-nauchnyh-osnov-mehanizatsii-zhivotnovodstva (дата обращения: 24.10.2024).,"Бей Роман Васильевич (2016). Вклад отраслевых академических учреждений украинской ССР в развитие научных основ механизации животноводства. Манускрипт,  (2 (64)), 45-48.",https://cyberleninka.ru/article/n/vklad-otraslevyh-akademicheskih-uchrezhdeniy-ukrainskoy-ssr-v-razvitie-nauchnyh-osnov-mehanizatsii-zhivotnovodstva
Механизированная технология силосования соломы злаковых с полевыми отходами бахчевых культур,"Нурматов А.А., Рузиев Р.И., Мансуров О.М., Жаббаров Ш.Ш., Безверхов А.П.",Техника и технологии в животноводстве,2016,Агробиотехнологии,"солома, полевые отходы бахчевых культур, силосование, качество кормосмеси, миксер, молодняк крупного рогатого скота","straw, waste field of gourds, silage, feed mixture quality, mixer, cattle youth","Солома хлебных злаков малопитательный корм, и в натуральном виде она плохо поедается крупным рогатым скотом. Обычно с целью улучшения поедаемости соломы жвачными животными на фермах Узбекистана применяют различные простые физико-механические приемы: измельчение, запаривание, заваривание, сдабривание, гранулирование. Однако при этом эффект повышения продуктивности животных часто значительно ниже вложенных затрат. Нами разработан и испытан новый простой, но высокоэкономичный, биологический способ обработки соломы с использованием полевых отходов бахчевых культур. Сущность биологической обработки соломы заключается в том, что ее механизированным способом, с помощью миксера, смешивали с высоковлажными полевыми отходами арбузами и кормовой тыквой в разных пропорциях, в 15 вариантах солома:арбузы (3:1, 4:1,:6:1); солома:тыква (3:1, 4:1, 6:1) по массе ингредиентов, затем солому со смесью арбузов с тыквой в таких же пропорциях. Причем арбузы и тыквы были незрелые, битые и так далее, то есть нестандартные. Для механизированного проведения технологического процесса измельчения и смешивания, использовали кормораздатчик-смеситель с вертикальным шнеком производства германской фирмы HIMEL, снабженный взвешивающим устройством, имеющим емкость бункера 9 м3. Качество измельчения и смешивания в течение 5-10 минут полностью удовлетворительное. Из миксера смесь закладывали в емкости для созревания в течение 20-23 дней. Такой способ улучшил вкусовые качества смеси, обеспечил почти 100% поедаемость и повысил питательность силосованной соломы на 15%. Скармливание молодняку крупного рогатого скота (возрастом 8-10 месяцев) готовой кормосмеси (силосованной соломы) по 3 кг каждому животному в день значительно (на 15%) увеличило их продуктивность по сравнению с животными контрольной группы.","Нурматов А. А., Рузиев Р. И., Мансуров О. М., Жаббаров Ш. Ш., Безверхов А. П. Механизированная технология силосования соломы злаковых с полевыми отходами бахчевых культур // Техника и технологии в животноводстве. 2016. №3 (23). URL: https://cyberleninka.ru/article/n/mehanizirovannaya-tehnologiya-silosovaniya-solomy-zlakovyh-s-polevymi-othodami-bahchevyh-kultur (дата обращения: 24.10.2024).","Нурматов А.А., Рузиев Р.И., Мансуров О.М., Жаббаров Ш.Ш., & Безверхов А.П. (2016). Механизированная технология силосования соломы злаковых с полевыми отходами бахчевых культур. Техника и технологии в животноводстве,  (3 (23)), 193-195.",https://cyberleninka.ru/article/n/mehanizirovannaya-tehnologiya-silosovaniya-solomy-zlakovyh-s-polevymi-othodami-bahchevyh-kultur
Технология и комплект оборудования для приготовления комплексных минеральных добавок на основе сапропелей,"Передня В.И., Башко Ю.А., Кувшинов А.А., Радчиков В.Ф.",Техника и технологии в животноводстве,2016,Агробиотехнологии,"сапропели, биологически активные вещества, гуминовые кислоты, легкогидрализуемые вещества, комплект оборудования, перевариваемость, корм","sapropels, biologically active substances, humic acids, easy hydrolyzed substances, equipment set, digestibility, feed","Рассмотрен дефицит важнейших биологически активных веществ в рационах животных, за счет чего происходит перерасход зерновых компонентов в составе комбикормов. Показано, что одним из путей сокращения зерна могут стать сапропели. Приведен компонентный состав органического вещества сапропелей и показано, что гуминовые кислоты являются основной группой биологически активных веществ, в которых содержатся и витамины групп В, С и Е. Важным компонентом сапропелей является фракция легкогидрализируемых веществ, представленная углеводно-белковым комплексом. Азот, находящийся в сапропелях, белкового происхождения, что обуславливает присутствие в нем жизненно важных незаменимых аминокислот, таких, как лизин, метионин, цистин, триптофан и др. Сапропели представляют собой уникальный природный источник органического, минерального и витаминного сырья. Разработка месторождений сапропелей, залегающих под слоем торфа, является технически более простым и экономически более выгодным, чем добыча сырья из озер. Изложены технологии добычи и сушки сапропелей, залегающих под слоем торфа в зимний и летний периоды. Описан комплект оборудования для приготовления минеральной кормовой добавки на основе сапропелей и приведены его технико-экономи-ческие показатели. Исследована эффективность использования в кормлении сельскохозяйственных животных минеральных кормовых добавок с включением сапропелей в комбикорма в количестве 2, 4, 6 и 8%. В результате исследований установлено, что реакция среды рубцового содержимого была нейтральной у животных всех групп с незначительным отклонениями между ними. Поедаемость комбикорма во всех группах практически одинакова. Поскольку важнейшим показателем, определяющим питательную ценность и продуктивное действие корма, является переваримость, то были проведены исследования по определению коэффициента переваримости основных питательных веществ. Лучшие результаты по исследуемым показателям получены у животных, которые получали 8% сапропелей. Переваримость всех питательных веществ у них оказалась выше.","Передня В. И., Башко Ю. А., Кувшинов А. А., Радчиков В. Ф. Технология и комплект оборудования для приготовления комплексных минеральных добавок на основе сапропелей // Техника и технологии в животноводстве. 2016. №4 (24). URL: https://cyberleninka.ru/article/n/tehnologiya-i-komplekt-oborudovaniya-dlya-prigotovleniya-kompleksnyh-mineralnyh-dobavok-na-osnove-sapropeley (дата обращения: 24.10.2024).","Передня В.И., Башко Ю.А., Кувшинов А.А., & Радчиков В.Ф. (2016). Технология и комплект оборудования для приготовления комплексных минеральных добавок на основе сапропелей. Техника и технологии в животноводстве,  (4 (24)), 32-37.",https://cyberleninka.ru/article/n/tehnologiya-i-komplekt-oborudovaniya-dlya-prigotovleniya-kompleksnyh-mineralnyh-dobavok-na-osnove-sapropeley
У истоков селекции клевера лугового в России,Зарьянова З.А.,Зернобобовые и крупяные культуры,2016,Агробиотехнологии,"клевер луговой, биология, селекция, семеноводство, сорта","red clover, biology, selection, seed-growing, varieties","Селекционная работа с клевером луговым была начата Шатиловской сельскохозяйственной опытной станцией одной из первых в России. Здесь была проведена работа по изучению биологии этой культуры, разработаны методы селекции и создан первый в России сорт клевера лугового Среднерусский, уникальный по хозяйственно-биологическим характеристикам, с 1931 года до настоящего времени допущенный к использованию в 3 регионах РФ (3, 5, 7). Представлены итоги непрерывной 104-летней селекционной работы с клевером луговым в Орловской области, дана характеристика новых районированных сортов",Зарьянова З. А. У истоков селекции клевера лугового в России // Зернобобовые и крупяные культуры. 2016. №2 (18). URL: https://cyberleninka.ru/article/n/u-istokov-selektsii-klevera-lugovogo-v-rossii (дата обращения: 24.10.2024).,"Зарьянова З.А. (2016). У истоков селекции клевера лугового в России. Зернобобовые и крупяные культуры,  (2 (18)), 67-73.",https://cyberleninka.ru/article/n/u-istokov-selektsii-klevera-lugovogo-v-rossii
