Title,Authors,Journal,Year,Field of Science,Russian Keywords,English Keywords,Annotation,GOST,APA,Link
Обоснование применения биологически активных компонентов в рецептуре кормов для дальневосточного трепанга в условиях искусственного разведения на предприятиях марикультуры,"Ковалев Николай Николаевич, Позднякова Юлия Михайловна, Лескова Светлана Евгеньевна",Вестник Астраханского государственного технического университета. Серия: Рыбное хозяйство,2018,Агробиотехнологии,"трепанг, корма, садки, биологически активные вещества, холестерин, днк из молок лососевых","trepang, feeds, cages, bioactive substances, cholesterol, dna of salmon milt","Проведены апробация и оценка эффективности кормов для садкового выращивания дальневосточного трепанга с использованием биостимулирующих компонентов: холестерина и ДНК из молок лососевых. Эксперимент проводился на 6 группах животных (соответственно корма №№ 1-6) с начальной массой 50-70 г, контрольные замеры осуществлялись через 60 и 103 дня после начала эксперимента. Экспериментально установлено, что наибольшие привесы массы тела трепанга (22,4 г) наблюдались при использовании корма, в состав которого был включен холестерин в дозировке 40 г/кг корма (корм № 2). Также эффективными оказались рецептуры кормов с включением холестерина в дозировке 20 г/кг корма (корм № 1), ДНК молок лососевых в дозировке 1 г/кг (корм № 3) и корма со смешанным составом биологически активных веществ (БАВ) (корм № 6). В ходе исследования химического состава тканей трепанга установлено, что наибольший эффект применения экспериментальных кормов выразился в увеличении количества миофибриллярных белков. Менее всего влиянию БАВ оказались подвержены щелочерастворимые белки, к которым относится коллаген. Накопление саркоплазматических белков наиболее активно происходило при использовании высокобелкового корма (корм-контроль) и корма № 6 с внесением смеси БАВ: увеличение в 7,5 и 7,2 раза соответственно. Также высокоэффективными оказались корма с использованием ДНК в дозировках 1 и 5 г/кг корма (№ 3 и 4), скармливание которых способствовало увеличению водорастворимых белков в 6,0 и 6,6 раз соответственно. Рецептура, отличающаяся высоким содержанием холестерина, практически не приводила к увеличению количества саркоплазматических белков. При увеличении концентрации холестерина в корме количество гексозаминов в тканях трепанга возрастает в 2,7 раз. Увеличение содержания ДНК в корме приводит к увеличению количества гексозаминов в 1,5 раза. Такая тенденция наблюдается и при сравнении кормов со смесью БАВ. Экспериментальные данные свидетельствуют о высокой эффективности кормов для трепанга с добавлением БАВ холестерина и ДНК из молок лососевых.","Ковалев Николай Николаевич, Позднякова Юлия Михайловна, Лескова Светлана Евгеньевна Обоснование применения биологически активных компонентов в рецептуре кормов для дальневосточного трепанга в условиях искусственного разведения на предприятиях марикультуры // Вестник АГТУ. Серия: Рыбное хозяйство. 2018. №1. URL: https://cyberleninka.ru/article/n/obosnovanie-primeneniya-biologicheski-aktivnyh-komponentov-v-retsepture-kormov-dlya-dalnevostochnogo-trepanga-v-usloviyah (дата обращения: 24.10.2024).","Ковалев Николай Николаевич, Позднякова Юлия Михайловна, & Лескова Светлана Евгеньевна (2018). Обоснование применения биологически активных компонентов в рецептуре кормов для дальневосточного трепанга в условиях искусственного разведения на предприятиях марикультуры. Вестник Астраханского государственного технического университета. Серия: Рыбное хозяйство,  (1), 90-97.",https://cyberleninka.ru/article/n/obosnovanie-primeneniya-biologicheski-aktivnyh-komponentov-v-retsepture-kormov-dlya-dalnevostochnogo-trepanga-v-usloviyah
"Экспериментальная оценка гиполипидемических свойств белков сои, риса и их ферментативных гидролизатов. Краткий обзор литературы","Сидорова Юлия Сергеевна, Мазо Владимир Кимович, Кочеткова Алла Алексеевна",Вопросы питания,2018,Агробиотехнологии,"растительные белки, ферментативные гидролизаты, ожирение, метаболический синдром, гиперлипидемия, устойчивость к инсулину","plant proteins, enzymatic hydrolysates, obesity, metabolic syndrome, dyslipidemia, insulin resistance","Метаболический синдром (МС) характеризуется высокой распространенностью, постоянным ростом числа больных и высокой частотой сердечно-сосудистых осложнений. По современным представлениям, ключевыми факторами, приводящими к развитию нарушений обмена веществ при МС, являются увеличение массы висцерального жира и снижение чувствительности периферических тканей к инсулину, которые ассоциируются с нарушениями углеводного, липидного, пуринового обмена и артериальной гипертонией. В представленном обзоре кратко обсуждаются основные результаты исследований по оценке гиполипидемических свойств белка сои, белка рисовых отрубей и их ферментативных гидролизатов в опытах in vivo на лабораторных животных (крысах и мышах) с экспериментально индуцированной или генетически обусловленной дислипидемией. Анализ представленных в обзоре публикаций свидетельствует о том, что потребление белка сои обеспечивает снижение массы тела, нормализует липидный обмен, снижает резистентность к инсулину. Потребление лабораторными животными рисового белка наряду с соевым приводит к снижению концентрации холестерина в сыворотке крови, а также способствует выведению стероидов, таких как холестерин и желчные кислоты, с калом. Ферментативный гидролиз пищевых белков позволяет получать пептидные смеси, которые обладают высокой биологической ценностью и улучшенными функциональными свойствами: растворимостью в воде и всасыванием в кишечнике. В свою очередь, гиполипидемические пептиды в составе гидролизатов могут играть ключевую роль в эндогенном гомеостазе холестерина, нарушая его мицеллярную растворимость, всасывание в кишечнике, изменяя энтерогепатическую циркуляцию желчных кислот, а также снижая экспрессию некоторых генов белков – медиаторов липидного транспорта. Авторы пришли к заключению, что гиполипидемические свойства целенаправленно получаемых ферментативных гидролизатов пищевых белков определяют перспективы их использования в составе специализированных пищевых продуктов для профилактики нарушений метаболизма.","Сидорова Юлия Сергеевна, Мазо Владимир Кимович, Кочеткова Алла Алексеевна Экспериментальная оценка гиполипидемических свойств белков сои, риса и их ферментативных гидролизатов. Краткий обзор литературы // Вопросы питания. 2018. №2 . URL: https://cyberleninka.ru/article/n/eksperimentalnaya-otsenka-gipolipidemicheskih-svoi-stv-belkov-soi-risa-i-ih-fermentativnyh-gidrolizatov-kratkii-obzor-literatury (дата обращения: 24.10.2024).","Сидорова Юлия Сергеевна, Мазо Владимир Кимович, & Кочеткова Алла Алексеевна (2018). Экспериментальная оценка гиполипидемических свойств белков сои, риса и их ферментативных гидролизатов. Краткий обзор литературы. Вопросы питания, 87 (2 ), 77-84. doi: 10.24411/0042-8833-2018-10021",https://cyberleninka.ru/article/n/eksperimentalnaya-otsenka-gipolipidemicheskih-svoi-stv-belkov-soi-risa-i-ih-fermentativnyh-gidrolizatov-kratkii-obzor-literatury
Исследование аминокислотного состава кормовой добавки методом ионообменной хроматографии,"Волнин А.А., Мишуров А.В., Михина А.А., Коротаева А.А., Севко А.В.",Вестник Воронежского государственного университета инженерных технологий,2018,Агробиотехнологии,"аминокислоты, ионообменная хроматография, аминокислотный скор, постколоночная дериватизация, кормовая добавка","amino acids, ion-exchange chromatography, post-colum derivatization, amino acid score, feed-stuff component","Определение содержания аминокислот в кормах для сельскохозяйственных животных имеет большую научно-практическую значимость. Это необходимо для более точной детализации норм кормления и балансирования рационов животных по содержанию аминокислот и белка, а, следовательно, способствует повышению продуктивности животных. В данной работе рассмотрены вопросы применения ионообменной хроматографии с постколоночной дериватизацией проб нингидрином для исследования аминокислотного состава кормов для сельскохозяйственных животных. Определено общее содержание аминокислот (кроме триптофана) в кормовой добавке. Концентрация треонина составила 3,26 г/100г протеина, лейцина – 6,43, изолейцина – 3,24, валина – 4,77, метионина – 2,18, лизина – 2,90, фенилаланина – 3,16, гистидина – 2,03, тирозина – 2,33, суммы аспарагина и аспарагиновой кислоты – 6,76, серина – 3,97, суммы глутамина и глутаминовой кислоты – 12,04, глицина – 6,00, аланина – 6,71, аргинина – 6,93, пролина – 3,08, суммы цистина и цистеина – 1,38. Выполнена оценка полноценности добавки по содержанию незаменимых аминокислот в сравнении с референтным белком ФАО/ВОЗ и определены лимитирующие аминокислоты. Аминокислотный скор треонина составил 81,5%, лейцина – 91,9%, изолейцина – 81%, валина – 95,4%, лизина – 52,7%, суммы фенилаланина и тирозина – 91,5%, суммы метионина и цистеина – 101,7%. Определено соотношение незаменимых и заменимых аминокислот: 0,57. Установлена относительно низкая биологическая ценность (относительно референтного белка ФАО/ВОЗ) исследованной кормовой добавки по содержанию незаменимых аминокислот. Данная добавка может быть использована в кормлении сельскохозяйственных животных в комплексе с другими кормовыми компонентами, содержащими свободные аминокислоты и / или белки, в составе рациона, сбалансированного по содержанию незаменимых аминокислот.","Волнин А. А., Мишуров А. В., Михина А. А., Коротаева А. А., Севко А. В. Исследование аминокислотного состава кормовой добавки методом ионообменной хроматографии // Вестник ВГУИТ. 2018. №1 (75). URL: https://cyberleninka.ru/article/n/issledovanie-aminokislotnogo-sostava-kormovoy-dobavki-metodom-ionoobmennoy-hromatografii (дата обращения: 24.10.2024).","Волнин А.А., Мишуров А.В., Михина А.А., Коротаева А.А., & Севко А.В. (2018). Исследование аминокислотного состава кормовой добавки методом ионообменной хроматографии. Вестник Воронежского государственного университета инженерных технологий, 80 (1 (75)), 199-205.",https://cyberleninka.ru/article/n/issledovanie-aminokislotnogo-sostava-kormovoy-dobavki-metodom-ionoobmennoy-hromatografii
"Получение ржаного солода, обогащенного селеном","К. Ю. Муравьев, Н. В. Баракова, Ю. В. Хомяков, Г. Г. Панова",Научный журнал НИУ ИТМО. Серия «Процессы и аппараты пищевых производств»,2018,Агробиотехнологии,"солодоращение, селен и его соединения, ржаной солод, скорость роста зерна, способность к прорастанию, яровая рожь","malting, selenium and its compounds, rye malt, grain growth rate, ability to germinate, spring rye","Исследовали влияние селената натрия на способность зерна ржи сорта Вятка к прорастанию в процессе солодоращения и определяли его воздействие на накопление селена в солоде. Растворы селената натрия концентрацией 0,5 и 1 мг · дм−3 вносили в процессе получения неферментированного ржаного солода на двух стадиях: замачивания и проращивания. Влияние селената натрия на способность к прорастанию зерна ржи определяли по количеству проросших зерен; скорость прорастания – по средней длине ростков и корешков. Солод получали по следующей технологии: режим замачивания – в течение 19,5 ч с тремя воздушными паузами; режим проращивания – при температуре 14°C при постоянном доступе кислорода, периодическом увлажнении и перемешиванием зерна каждые 12 ч. Сушка солода состояла из трех этапов: первый – 40°C в течение 10 ч, второй этап – 70°C в течение 10 ч, третий этап – 100°C в течение 0,5 ч. Количество селена в солоде определяли с помощью атомно-абсорбционной спектрометрии. Установлено, что при получении ржаного солода, обогащенного селеном, раствор селената натрия необходимо вносить на стадии замачивания зерна при концентрации не более 0,5 мг · дм−3. Накопление селена в солоде приводит к снижению экстрактивности солода. Этот результат необходимо учитывать при получении солода, обогащенного селеном, из других сортов ржи.","К Ю. Муравьев, Н В. Баракова, Ю В. Хомяков, Г Г. Панова Получение ржаного солода, обогащенного селеном // Научный журнал НИУ ИТМО. Серия «Процессы и аппараты пищевых производств». 2018. №1. URL: https://cyberleninka.ru/article/n/poluchenie-rzhanogo-soloda-obogaschennogo-selenom (дата обращения: 24.10.2024).","К. Ю. Муравьев, Н. В. Баракова, Ю. В. Хомяков, & Г. Г. Панова (2018). Получение ржаного солода, обогащенного селеном. Научный журнал НИУ ИТМО. Серия «Процессы и аппараты пищевых производств»,  (1), 15-20.",https://cyberleninka.ru/article/n/poluchenie-rzhanogo-soloda-obogaschennogo-selenom
"Влияние предпосевной обработки эвкалиптом и чистотелом на прорастание семян свеклы, пшеницы и кукурузы","Бондарев Юрий Платонович, Зубкова Татьяна Александровна, Ашинов Юнус Нухович, Мамсиров Нурбий Ильясович",Новые технологии,2018,Агробиотехнологии,"стимуляторы роста, эвкалипт, чистотел, длина корней и стеблей, всхожесть семян, пшеница, свекла, кукуруза","rowth stimulants, eucalyptus, celandine, root and stem length, seed germination, wheat, beet, maize","Регуляторы роста растительного происхождения относятся к наиболее безопасным и проявляющим стимулирующее действие на широкий спектр растений. Научная работа посвящена исследованию влияния предпосевной обработки эвкалиптом (Folium Eucalypti) и чистотелом (Herba Chelidonii) на развитие проростков пшеницы, свеклы и кукурузы. Показано повышение всхожести семян на 2-12 %. На рост корней эвкалипт проявил максимальный эффект: длина корней увеличилась на 3,7% для пшеницы, 15% свеклы и 80% для кукурузы по сравнению с контролем.","Бондарев Юрий Платонович, Зубкова Татьяна Александровна, Ашинов Юнус Нухович, Мамсиров Нурбий Ильясович Влияние предпосевной обработки эвкалиптом и чистотелом на прорастание семян свеклы, пшеницы и кукурузы // Новые технологии. 2018. №1. URL: https://cyberleninka.ru/article/n/vliyanie-predposevnoy-obrabotki-evkaliptom-i-chistotelom-na-prorastanie-semyan-svekly-pshenitsy-i-kukuruzy (дата обращения: 24.10.2024).","Бондарев Юрий Платонович, Зубкова Татьяна Александровна, Ашинов Юнус Нухович, & Мамсиров Нурбий Ильясович (2018). Влияние предпосевной обработки эвкалиптом и чистотелом на прорастание семян свеклы, пшеницы и кукурузы. Новые технологии,  (1), 114-127.",https://cyberleninka.ru/article/n/vliyanie-predposevnoy-obrabotki-evkaliptom-i-chistotelom-na-prorastanie-semyan-svekly-pshenitsy-i-kukuruzy
