Title,Authors,Journal,Year,Field of Science,Russian Keywords,English Keywords,Annotation,GOST,APA,Link
ВОЗДЕЙСТВИЕ АНТТЕЛЬМИНТИКОВ НА СОСТАВ БИОЦЕНОЗА РУБЦА КРУПНОГО РОГАТОГО СКОТА,"Крючкова Е.Н., Короткова А.А.",Теория и практика борьбы с паразитарными болезнями,2018,Агробиотехнологии,,,We analysied effect of different anthelmintics on quantitative composition of ciliates of the rumen biocenosis in cattle. One found out that application of Albene forte decreased the number of infusorians by no more than 2.5%. Other drugs caused a decreased of the number of infusorians by no less than 11 % as compared to the control group. It was proved that anthelmintics slightly injured rumen microflora but its complete restoration took place three days after application of the drugs.,"Крючкова Е. Н., Короткова А. А. ВОЗДЕЙСТВИЕ АНТТЕЛЬМИНТИКОВ НА СОСТАВ БИОЦЕНОЗА РУБЦА КРУПНОГО РОГАТОГО СКОТА // Теория и практика борьбы с паразитарными болезнями. 2018. №19. URL: https://cyberleninka.ru/article/n/vozdeystvie-anttelmintikov-na-sostav-biotsenoza-rubtsa-krupnogo-rogatogo-skota (дата обращения: 24.10.2024).","Крючкова Е.Н., & Короткова А.А. (2018). ВОЗДЕЙСТВИЕ АНТТЕЛЬМИНТИКОВ НА СОСТАВ БИОЦЕНОЗА РУБЦА КРУПНОГО РОГАТОГО СКОТА. Теория и практика борьбы с паразитарными болезнями,  (19), 237-239.",https://cyberleninka.ru/article/n/vozdeystvie-anttelmintikov-na-sostav-biotsenoza-rubtsa-krupnogo-rogatogo-skota
СРАВНИТЕЛЬНАЯ ЭФФЕКТИВНОСТЬ ФЕБТАЛ ГРАНУЛЯТА И ГЕЛЬМИЦИД ГРАНУЛЯТА ПРИ МОНИЕЗИОЗЕ ЯГНЯТ МЕТОДОМ ГРУППОВОГО НАЗНАЧЕНИЯ,"Магомедов О.А., Газаева А.А., Кабардиев С.Ш., Биттиров А.М., Карпущенко К.А., Калабеков М.И., Кабардиев Ш.С., Бегиева С.А., Биттиров И.А., Бегиев С.Ж., Мусаев З.Г., Чилаев А.С., Биттирова А.А.",Теория и практика борьбы с паразитарными болезнями,2018,Агробиотехнологии,,,Febtal granulate and Helmicide granulate at the dose level of 1.2 g / 10 kg of body weight used by a group method showed EE - 100% and IE - 100% at Moniezia sp. infection in lambs. There were no M. expansa eggs in faces of lambs on the 5th and 7th days after treatment with the drugs. Febtal granulate and Helmicide granulate proved to be highly effactive cestodocidal drugs without side effects and were recommended for treatment and prevention of Moniezia sp. infection of lambs and other Anoplocephala spp. infections in sheep.,"Магомедов О. А., Газаева А. А., Кабардиев С. Ш., Биттиров А. М., Карпущенко К. А., Калабеков М. И., Кабардиев Ш. С., Бегиева С. А., Биттиров И. А., Бегиев С. Ж., Мусаев З. Г., Чилаев А. С., Биттирова А. А. СРАВНИТЕЛЬНАЯ ЭФФЕКТИВНОСТЬ ФЕБТАЛ ГРАНУЛЯТА И ГЕЛЬМИЦИД ГРАНУЛЯТА ПРИ МОНИЕЗИОЗЕ ЯГНЯТ МЕТОДОМ ГРУППОВОГО НАЗНАЧЕНИЯ // Теория и практика борьбы с паразитарными болезнями. 2018. №19. URL: https://cyberleninka.ru/article/n/sravnitelnaya-effektivnost-febtal-granulyata-i-gelmitsid-granulyata-pri-moniezioze-yagnyat-metodom-gruppovogo-naznacheniya (дата обращения: 24.10.2024).","Магомедов О.А., Газаева А.А., Кабардиев С.Ш., Биттиров А.М., Карпущенко К.А., Калабеков М.И., Кабардиев Ш.С., Бегиева С.А., Биттиров И.А., Бегиев С.Ж., Мусаев З.Г., Чилаев А.С., & Биттирова А.А. (2018). СРАВНИТЕЛЬНАЯ ЭФФЕКТИВНОСТЬ ФЕБТАЛ ГРАНУЛЯТА И ГЕЛЬМИЦИД ГРАНУЛЯТА ПРИ МОНИЕЗИОЗЕ ЯГНЯТ МЕТОДОМ ГРУППОВОГО НАЗНАЧЕНИЯ. Теория и практика борьбы с паразитарными болезнями,  (19), 268-270.",https://cyberleninka.ru/article/n/sravnitelnaya-effektivnost-febtal-granulyata-i-gelmitsid-granulyata-pri-moniezioze-yagnyat-metodom-gruppovogo-naznacheniya
ОБ ЭПИЗООТИЧЕСКОЙ СИТУАЦИИ ПАРАМФИСТОМИДОЗОВ КРУПНОГО РОГАТОГО СКОТА В ГРУЗИИ,"Поцхверия Ш.О., Авалиани Л.З.",Теория и практика борьбы с паразитарными болезнями,2018,Агробиотехнологии,,,"One revealed Paramphistomum spp. infections almost in 60,2% of cattle in Georgia. In West Georgia with its mild subtropical climate Paramphistomum spp. infections were registered in 75,5% of cattle, in East Georgia with dry continental climate - in 46,2%. The infection rate of cattle in lowland reached 79,1%, in subalpine zone - 23,9%.","Поцхверия Ш. О., Авалиани Л. З. ОБ ЭПИЗООТИЧЕСКОЙ СИТУАЦИИ ПАРАМФИСТОМИДОЗОВ КРУПНОГО РОГАТОГО СКОТА В ГРУЗИИ // Теория и практика борьбы с паразитарными болезнями. 2018. №19. URL: https://cyberleninka.ru/article/n/ob-epizooticheskoy-situatsii-paramfistomidozov-krupnogo-rogatogo-skota-v-gruzii (дата обращения: 24.10.2024).","Поцхверия Ш.О., & Авалиани Л.З. (2018). ОБ ЭПИЗООТИЧЕСКОЙ СИТУАЦИИ ПАРАМФИСТОМИДОЗОВ КРУПНОГО РОГАТОГО СКОТА В ГРУЗИИ. Теория и практика борьбы с паразитарными болезнями,  (19), 405-407.",https://cyberleninka.ru/article/n/ob-epizooticheskoy-situatsii-paramfistomidozov-krupnogo-rogatogo-skota-v-gruzii
К ВОПРОСУ О КРАТНОСТИ ПРИМЕНЕНИЯ ЛЕЧЕБНОГО КОРМА С МИКРОСАЛОМ ПРИ БОТРИОЦЕФАЛЕЗЕ КАРПОВ В САДКОВОМ ХОЗЯЙСТВЕ,"Скачков Д.П., Кочетков П.П., Пуховский Ю.А., Орлов В.Т.",Теория и практика борьбы с паразитарными болезнями,2018,Агробиотехнологии,,,"One carried out dehelminthization of carp by medicated granulated feed containing 0,8% of microsal at Cherepetskaya Fish farm. Approximately 170 000 two-year-old caip of the total weight 9700 kg were in 34 cages. Fish were fed for 5 consecutive days and every day received 230 kg of medicated feed that was 2,3% of fish ichthyomass in the cages. The dose level according to the active substance was 6,9 mg/kg per a day. Efficacy of treatments proved to be 100% according to the results of helminthological dissection of fish from the cages №№ 5, 25 and 36. In the cage № 21 EE was 83,3 % and IE - 76,9%.","Скачков Д. П., Кочетков П. П., Пуховский Ю. А., Орлов В. Т. К ВОПРОСУ О КРАТНОСТИ ПРИМЕНЕНИЯ ЛЕЧЕБНОГО КОРМА С МИКРОСАЛОМ ПРИ БОТРИОЦЕФАЛЕЗЕ КАРПОВ В САДКОВОМ ХОЗЯЙСТВЕ // Теория и практика борьбы с паразитарными болезнями. 2018. №19. URL: https://cyberleninka.ru/article/n/k-voprosu-o-kratnosti-primeneniya-lechebnogo-korma-s-mikrosalom-pri-botriotsefaleze-karpov-v-sadkovom-hozyaystve (дата обращения: 24.10.2024).","Скачков Д.П., Кочетков П.П., Пуховский Ю.А., & Орлов В.Т. (2018). К ВОПРОСУ О КРАТНОСТИ ПРИМЕНЕНИЯ ЛЕЧЕБНОГО КОРМА С МИКРОСАЛОМ ПРИ БОТРИОЦЕФАЛЕЗЕ КАРПОВ В САДКОВОМ ХОЗЯЙСТВЕ. Теория и практика борьбы с паразитарными болезнями,  (19), 446-450.",https://cyberleninka.ru/article/n/k-voprosu-o-kratnosti-primeneniya-lechebnogo-korma-s-mikrosalom-pri-botriotsefaleze-karpov-v-sadkovom-hozyaystve
Влияние транскраниальной электростимуляции на гистологическую структуру аденогипофиза у овец,"Сеин О.Б., Саргсян Э.Г., Холоша А.С.",Вестник Курской государственной сельскохозяйственной академии,2018,Агробиотехнологии,"аденогипофиз, гистоструктура, гонадотропоциты, гистологические исследования, овцы, транскраниальная электростимуляция, тиреотропоциты",,"В статье приводятся результаты исследования гистологической структуры аденогипофиза у овец после транскраниальной электростимуляции (ТЭС). Показано, что применение ТЭС в выбранных режимах включающих подачу на электроды с гидрофильными прокладками закреплёнными в области лобной (катод) и затылочной (анод) костей вначале постоянного тока, плавно нарастающего от 0 до 6,0 мА, а затем подачу в той же полярности прямоугольных импульсов с частотой 70-80 Гц, длительностью 3 мс и амплитудой 3 мА, не оказывает отрицательного влияния на организм подопытных животных. Масса и объём гипофизов у овец подвергавшихся электростимуляции не имели достоверных различий по сравнению с контролем. При гистологических исследованиях были выявлены аденоциты, ацидофилы и базофилы. Аденоциты располагаются в виде рядов между которыми находятся капилляры. Ацидофилы имеют округлую или многоугольную форму и овальные ядра. Базофилы представлены крупными клетками с чёткими границами и относительно большими слабо окрашивающимися ядрами. Наиболее существенные изменения отмечались в морфологической структуре гонадотропоцитов. Характерной особенностью для этих клеток являлся тесный контакт с капиллярами. Гонадотропоциты прилегали к стенке сосудов как отдельно, так и в виде небольших групп по 2-3 клетки, которые располагались близко друг к другу. Установлено, что у овец подвергавшихся электростимуляции площадь ядер в гонадотропоцитах была меньше по сравнению с контрольными животными, что свидетельствует о более низкой их функциональной активности. Полученные данные в ходе проведённых исследований можно использовать при разработке новых способов регуляции физиологических функций у домашних животных с использованием ТЭС.","Сеин О. Б., Саргсян Э. Г., Холоша А. С. Влияние транскраниальной электростимуляции на гистологическую структуру аденогипофиза у овец // Вестник Курской государственной сельскохозяйственной академии. 2018. №1. URL: https://cyberleninka.ru/article/n/vliyanie-transkranialnoy-elektrostimulyatsii-na-gistologicheskuyu-strukturu-adenogipofiza-u-ovets (дата обращения: 24.10.2024).","Сеин О.Б., Саргсян Э.Г., & Холоша А.С. (2018). Влияние транскраниальной электростимуляции на гистологическую структуру аденогипофиза у овец. Вестник Курской государственной сельскохозяйственной академии,  (1), 27-31.",https://cyberleninka.ru/article/n/vliyanie-transkranialnoy-elektrostimulyatsii-na-gistologicheskuyu-strukturu-adenogipofiza-u-ovets
Новый вакцинный штамм Mannheimia haemolytica для производства препаратов против манхеймиоза,"Лаишевцев А.И., Якимова Э.А., Капустин А.В.",Вестник Курской государственной сельскохозяйственной академии,2018,Агробиотехнологии,"вакцина, биопроизводство, биопрепараты",,"В работе представлены свойства нового производственного штамма Mannheimia haemolytica «КЛ-ВИЭВ», депонированного в Государственной коллекции ФБУН «ГНЦ ПМБ», с регистрационным номером B8139 от 25.07.2017. Культура обладает типичными для вида морфологическими, тинкториальными и ферментативными свойствами. При определении серологических свойств установлено, что культура относится к серотипу А1. Вирулентность штамма по показателю LD50 составляет 3,5*108 при интраназальном заражении белых мышей, предварительно подвергшихся иммуносупрессии. При определении антибиотикорезистентности было установлено, что высокая чувствительность проявляется в отношении стрептомицина, триметроприма, имипенема, амоксиклава, ампициллина, полимиксина-В, ко-тримоксазола, доксициклина, ципрофлоксацина, энрофлоксацина, моксифлоксацина, цефалексина, цефоперазона и цефтриаксона. При секвенировании последовательности гена 16S рРНК показана 100 % гомология анализируемой последовательности образца с нуклеотидной последовательностью гена 16S рРНК Mannheimia haemolytica (GenBank KU517779.1, CP005972.1 и др.). При определении антигенных свойств штамма было установлено, что использование монопрепарата выполненного на основе масляного адъюванта Montanide ISA 70 при подкожном способе введения на крупном рогатом скоте позволило получить средний титр антител равный 1:320, при повторной вакцинации средний титр антител составил 1:1360. Иммунизация мелкого рогатого скота монопрепаратом позволила получить средний титр антител равный 1:295, при повторной вакцинации средний титр антител составил 1:1080.","Лаишевцев А. И., Якимова Э. А., Капустин А. В. Новый вакцинный штамм Mannheimia haemolytica для производства препаратов против манхеймиоза // Вестник Курской государственной сельскохозяйственной академии. 2018. №6. URL: https://cyberleninka.ru/article/n/novyy-vaktsinnyy-shtamm-mannheimia-haemolytica-dlya-proizvodstva-preparatov-protiv-manheymioza (дата обращения: 24.10.2024).","Лаишевцев А.И., Якимова Э.А., & Капустин А.В. (2018). Новый вакцинный штамм Mannheimia haemolytica для производства препаратов против манхеймиоза. Вестник Курской государственной сельскохозяйственной академии,  (6), 117-121.",https://cyberleninka.ru/article/n/novyy-vaktsinnyy-shtamm-mannheimia-haemolytica-dlya-proizvodstva-preparatov-protiv-manheymioza
Распространение эймериоза у телят в условиях юга Европейской части России,Нафис Табрисович Сафиуллин,Российский паразитологический журнал,2018,Агробиотехнологии,"крупный рогатый скот, телята, эймериоз, сезон, возраст, зараженность","eimeria spp., cattle, calves, eimeria spp., eimeriosis, season, age, infection","Цель исследований: выявить степень распространения эймериоза у телят в условиях юга Европейской части России. Материалы и методы. Исследования проводили в 11 хозяйствах Краснодарского, Ставропольского краев и Ростовской области в 2016–2017 гг. Материалом для исследований служили пробы фекалий крупного рогатого скота из хозяйств разных форм собственности. Всего исследовано 975 проб фекалий. Пробы фекалий исследовали методом Фюллеборна. Определяли экстенсивность инвазии (ЭИ, %) и среднее число ооцист в 1 г фекалий. Сезонную динамику зараженности молодняка крупного рогатого скота изучали путем исследования проб фекалий 38 голов в январе–феврале, 43 голов в марте–мае, 64 голов летом и 55 голов в осенний период. Влияние плотности поголовья телят в станке на зараженность эймериями изучали на 249 телятах, из которых 62 головы содержали в индивидуальных станках, 25 телят – по 2–5 голов в станке, 28 – по 6–10, 55 – по 11–15 и 75 телят – по 16 голов и больше. Пробы фекалий исследовали трехкратно. Полученные результаты обработаны статистически. Результаты и обсуждение. Независимо от типа хозяйств животные были инвазированы эймериями. Средняя зараженность крупного рогатого скота по всем исследуемым хозяйствам составила 47,43% при обнаружении в 1 г фекалий, в среднем, 180,5±8,3 экз. ооцист. Зараженность молодняка крупного рогатого скота по хозяйствам колебалась от 0 до 100% с максимумом в ЗАО «Урожайное» Ставропольского края при обнаружении 362,3±9,7 экз. ооцист в 1 г фекалий. В наибольшей степени телята были заражены эймериями в возрасте 3-4 мес. (ЭИ 70,73%) при обнаружении в 1 г фекалий, в среднем, 364,3±8,2 экз. ооцист. Минимально оказались заражены взрослые животные (ЭИ 20,0%). Максимальной была зараженность животных весной и осенью – соответственно 53,49 и 61,81% при наличии 282,3±7,5 и 324,6±8,3 экз. ооцист в 1 г фекалий. Установлено, что с повышением плотности поголовья телят в станке зараженность их эймериями существенно повышается. Минимальной оказалась инвазированность телят при содержании в индивидуальных станках.",Нафис Табрисович Сафиуллин Распространение эймериоза у телят в условиях юга Европейской части России // Российский паразитологический журнал. 2018. №2. URL: https://cyberleninka.ru/article/n/rasprostranenie-eymerioza-u-telyat-v-usloviyah-yuga-evropeyskoy-chasti-rossii (дата обращения: 24.10.2024).,"Нафис Табрисович Сафиуллин (2018). Распространение эймериоза у телят в условиях юга Европейской части России. Российский паразитологический журнал, 12 (2), 33-37. doi: 10.31016/1998-8435-2018-12-2-33-37",https://cyberleninka.ru/article/n/rasprostranenie-eymerioza-u-telyat-v-usloviyah-yuga-evropeyskoy-chasti-rossii
