Title,Authors,Journal,Year,Field of Science,Russian Keywords,English Keywords,Annotation,GOST,APA,Link
Влияние биоантиоксидантов на посевные качества семян клевера лугового и люцерны изменчивой,"Перевозкина М.Г., Еремин Д.И., Белкина Р.И., Марченко Л.В., Губанова В.М., Губанов М.В.",Аграрный вестник Урала,2016,Агробиотехнологии,"клевер луговой, люцерна изменчивая, семена, энергия прорастания, лабораторная всхожесть, салициловая кислота, парацетамол, бис-[3-(3, 5-ди-трет-бутил-4-гидроксифенил)пропил]сульфид, стабилизатор со-3, тиофан, stabilizer сo-3","red clover, bastard alfalfa, seed, germination energy, germination laboratory, salicylic acid, paracetamol, bis-[3-(3, 5-di-tert-butyl-4-hydroxyphenyl)propyl]sulfide, thiophane","Изучению влияния биологически активных соединений на всхожесть семян многолетних бобовых трав уделяется большое значение в агропромышленном комплексе. Исследования проведены на семенах многолетних бобовых трав: клевере луговом (Trifolium pratense) и люцерне изменчивой (Medicago varia), для которых характерна твердосемянность. В качестве биоантиоксидантов использовали: салициловую кислоту, парацетамол, тиофан (стабилизатор СО-3). Для обработки семян расход рабочей жидкости брался из расчета: на 100 г семян 1 мл воды. Контроль обрабатывался дистиллированной водой. Салициловую кислоту и парацетамол растворяли в воде, тиофан растворяли в мицеллярной воде (подсолнечное масло : вода 3 : 7), в качестве поверхностно-активного вещества (ПАВ) использовали додецилсульфат натрия в критической концентрации мицеллообразования (ККМ) 8,3 моль/л. Парацетамол изучали в качестве действующего вещества и в виде таблетки (вспомогательные вещества: крахмал, стеариновая кислота, желатин). Определены посевные качества семян энергия прорастания и лабораторная всхожесть. Применение биоантиоксидантов снизило твердосемянность у многолетних бобовых трав на 2-21 %. Улучшились посевные качества семян: энергия прорастания повысилась на 1-15 %, показатель лабораторной всхожести увеличился на 2-21 %. Обработка парацетамолом (таблетка, 1%-й раствор) и мицеллярной водой способствовала повышению лабораторной всхожести на 19 и 21 % соответственно у люцерны изменчивой. Влияние 1%-го раствора парацетамола и мицеллярной воды способствовало повышению лабораторной всхожести также у семян клевера лугового на3 и 7 % соответственно. Обработка салициловой кислотой, парацетамолом и тиофаном приводит к появлению аномальных проростков. Следовательно, применение препаратов может снизить твердосемянность и повысить энергию прорастания и лабораторную всхожесть многолетних трав. Полученные в работе данные могут быть использованы в качестве методологической основы для решения вопросов, связанных с подбором биоантиоксидантов, влияющих на ранние этапы роста и развития растений.","Перевозкина М. Г., Еремин Д. И., Белкина Р. И., Марченко Л. В., Губанова В. М., Губанов М. В. Влияние биоантиоксидантов на посевные качества семян клевера лугового и люцерны изменчивой // АВУ. 2016. №8 (150). URL: https://cyberleninka.ru/article/n/vliyanie-bioantioksidantov-na-posevnye-kachestva-semyan-klevera-lugovogo-i-lyutserny-izmenchivoy (дата обращения: 24.10.2024).","Перевозкина М.Г., Еремин Д.И., Белкина Р.И., Марченко Л.В., Губанова В.М., & Губанов М.В. (2016). Влияние биоантиоксидантов на посевные качества семян клевера лугового и люцерны изменчивой. Аграрный вестник Урала,  (8 (150)), 52-57.",https://cyberleninka.ru/article/n/vliyanie-bioantioksidantov-na-posevnye-kachestva-semyan-klevera-lugovogo-i-lyutserny-izmenchivoy
"Сравнительный анализ частот аберраций хромосом в соматических клетках проростков кукурузы, содержащих и не содержащих ГМО","Крюков В.И., Павловская Н.Е.",Символ науки,2016,Агробиотехнологии,"кукуруза, мутагенез, анафазный метод, гмо",,"Исследованы частоты клеток с аберрациями хромосом в корневой меристеме проростков кукурузы ( Zea mays L.) двух сортов. Частоты аберраций составили 0,17% у геномодифицированного сорта «Pioneer» и 0,20% у не содержащего ГМО сорта Награда 97. Установлено отсутствие статистически достоверных различий между этими величинами.","Крюков В. И., Павловская Н. Е. Сравнительный анализ частот аберраций хромосом в соматических клетках проростков кукурузы, содержащих и не содержащих ГМО // Символ науки. 2016. №9-2. URL: https://cyberleninka.ru/article/n/sravnitelnyy-analiz-chastot-aberratsiy-hromosom-v-somaticheskih-kletkah-prorostkov-kukuruzy-soderzhaschih-i-ne-soderzhaschih-gmo (дата обращения: 24.10.2024).","Крюков В.И., & Павловская Н.Е. (2016). Сравнительный анализ частот аберраций хромосом в соматических клетках проростков кукурузы, содержащих и не содержащих ГМО. Символ науки,  (9-2), 12-17.",https://cyberleninka.ru/article/n/sravnitelnyy-analiz-chastot-aberratsiy-hromosom-v-somaticheskih-kletkah-prorostkov-kukuruzy-soderzhaschih-i-ne-soderzhaschih-gmo
Воспроизводительная способность уток при использовании ферментного препарата,"Ежова Оксана Юрьевна, Сенько Анна Яковлевна, Маслов Михаил Григорьевич",Известия Оренбургского государственного аграрного университета,2016,Агробиотехнологии,"птицеводство, утки, ферментный препарат, ровабио, репродуктивные качества сельскохозяйственной птицы, инкубационные качества яиц","poultry breeding, ducks, ferment preparation, rovabio, reproductive qualities, incubation, eggs quality","В статье приведены данные о влиянии ферментного препарата Ровабио на рост, количество и качество спермы селезней и воспроизводительные качества уток, оплодотворённых этими самцами. Ферментный препарат Ровабио добавляли в комбикорм селезней из расчёта 5 г/100 кг корма. Установлено, что качество спермопродукции селезней, получавших ферментный препарат, находилось на достаточно высоком уровне. Активность спермиев была на 10% выше, чем у самцов, находившихся на основном рационе питания, концентрация спермиев также была выше на 0,2 млрд/мл. Биологический контроль при инкубации позволил установить, что в группе уток, оплодотворённых селезнями, принимавшими с комбикормом препарат Ровабио, было меньше яиц с кровяным кольцом, задохликов, слабых и калек, что в свою очередь позволило повысить вывод здоровых утят. Включение ферментного препарата Ровабио селезням с суточного возраста, а уткам со 180-суточного обеспечило получение яиц с высокими инкубационными качествами.","Ежова Оксана Юрьевна, Сенько Анна Яковлевна, Маслов Михаил Григорьевич Воспроизводительная способность уток при использовании ферментного препарата // Известия ОГАУ. 2016. №5 (61). URL: https://cyberleninka.ru/article/n/vosproizvoditelnaya-sposobnost-utok-pri-ispolzovanii-fermentnogo-preparata (дата обращения: 24.10.2024).","Ежова Оксана Юрьевна, Сенько Анна Яковлевна, & Маслов Михаил Григорьевич (2016). Воспроизводительная способность уток при использовании ферментного препарата. Известия Оренбургского государственного аграрного университета,  (5 (61)), 93-95.",https://cyberleninka.ru/article/n/vosproizvoditelnaya-sposobnost-utok-pri-ispolzovanii-fermentnogo-preparata
Качество кормов из люцерны посевной и козлятника восточного,"Соболева Наталья Владимировна, Бабичева Ирина Андреевна, Карамаев Сергей Владимирович, Карамаева Анна Сергеевна",Известия Оренбургского государственного аграрного университета,2016,Агробиотехнологии,"корма, козлятник восточный, люцерна посевная, питательность, переваримость","feeds, caucasian goat's rue, alfalfa, nutritive value, digestibility","В статье представлены результаты сравнительного изучения бобовых кормовых культур люцерны посевной и козлятника восточного, которые используются в производстве кормов для крупного рогатого скота. Установлено, что козлятник восточный превосходит люцерну по урожайности зелёной массы на 24,1%. Зелёная масса козлятника восточного является хорошим сырьём для приготовления сена и сенажа. Питательная ценность готовых кормов из него выше по сравнению с люцерной посевной по всем основным питательным веществам, кроме сырого жира, сахара и кальция. Силос из козлятника восточного был хуже по всем показателям по сравнению с люцерновым.","Соболева Наталья Владимировна, Бабичева Ирина Андреевна, Карамаев Сергей Владимирович, Карамаева Анна Сергеевна Качество кормов из люцерны посевной и козлятника восточного // Известия ОГАУ. 2016. №5 (61). URL: https://cyberleninka.ru/article/n/kachestvo-kormov-iz-lyutserny-posevnoy-i-kozlyatnika-vostochnogo (дата обращения: 24.10.2024).","Соболева Наталья Владимировна, Бабичева Ирина Андреевна, Карамаев Сергей Владимирович, & Карамаева Анна Сергеевна (2016). Качество кормов из люцерны посевной и козлятника восточного. Известия Оренбургского государственного аграрного университета,  (5 (61)), 103-105.",https://cyberleninka.ru/article/n/kachestvo-kormov-iz-lyutserny-posevnoy-i-kozlyatnika-vostochnogo
Жирорастворимые биологически активные вещества желтка,"Ширяева Ольга Юрьевна, Карнаухова Ирина Владимировна",Известия Оренбургского государственного аграрного университета,2016,Агробиотехнологии,"желток куриного яйца, лецитин, витамин а, витамин е, каротиноиды","yolk of a poultry egg, lecithin, vitamin a, vitamin e, carotenoids","В сравнительном аспекте исследовано содержание жирорастворимых биологически активных веществ пищевого куриного яйца, полученного в условиях промышленного производства и домашнего хозяйства. Проанализирована их биологическая роль. Дано описание методики выделения лецитина из яичного желтка. Результаты исследования показали, что наибольшее содержание жирорастворимых биологически активных веществ (лецитина, каротиноидов, витамина А и витамина Е) содержится в желтке куриного яйца домашней птицы.","Ширяева Ольга Юрьевна, Карнаухова Ирина Владимировна Жирорастворимые биологически активные вещества желтка // Известия ОГАУ. 2016. №5 (61). URL: https://cyberleninka.ru/article/n/zhirorastvorimye-biologicheski-aktivnye-veschestva-zheltka (дата обращения: 24.10.2024).","Ширяева Ольга Юрьевна, & Карнаухова Ирина Владимировна (2016). Жирорастворимые биологически активные вещества желтка. Известия Оренбургского государственного аграрного университета,  (5 (61)), 162-163.",https://cyberleninka.ru/article/n/zhirorastvorimye-biologicheski-aktivnye-veschestva-zheltka
Оптимизация условий ПЦР для скрининга носительства генетической аномалии CVM,"Мачульская Елена Витальевна, Ковалюк Наталья Викторовна, Шахназарова Юлия Юрьевна, Гырнец Евгений Анатольевич.",Сборник научных трудов Краснодарского научного центра по зоотехнии и ветеринарии,2016,Агробиотехнологии,"полимеразная цепная реакция, скрининг, генетическая аномалия cvm","polymerase chain reaction, screening, cvm genetic anomaly","Оптимизирована методика постановки ПЦР при детекции генетической аномалии CVM, проведен скрининг 20 племенных коров.","Мачульская Елена Витальевна, Ковалюк Наталья Викторовна, Шахназарова Юлия Юрьевна, Гырнец Евгений Анатольевич Оптимизация условий ПЦР для скрининга носительства генетической аномалии CVM // Сборник научных трудов СКНИИЖ. 2016. №3. URL: https://cyberleninka.ru/article/n/optimizatsiya-usloviy-ptsr-dlya-skrininga-nositelstva-geneticheskoy-anomalii-cvm (дата обращения: 24.10.2024).","Мачульская Елена Витальевна, Ковалюк Наталья Викторовна, Шахназарова Юлия Юрьевна, & Гырнец Евгений Анатольевич. (2016). Оптимизация условий ПЦР для скрининга носительства генетической аномалии CVM. Сборник научных трудов Краснодарского научного центра по зоотехнии и ветеринарии, 5 (3), 31-36.",https://cyberleninka.ru/article/n/optimizatsiya-usloviy-ptsr-dlya-skrininga-nositelstva-geneticheskoy-anomalii-cvm
Выживаемость микроорганизмов пробиотика «Споротермин» при действии высоких температур,"Горковенко Леонид Григорьевич, Юрина Наталья Александровна",Сборник научных трудов Краснодарского научного центра по зоотехнии и ветеринарии,2016,Агробиотехнологии,"пробиотик ""споротермин"", микроорганизмы, выживаемость, температура","probiotic ""sporotermin"" microorganisms, survival, temperature",В статье анализируются результаты исследования на выживаемость микроорганизмов пробиотической кормовой добавки «Споротермин» при действии высоких температур.,"Горковенко Леонид Григорьевич, Юрина Наталья Александровна Выживаемость микроорганизмов пробиотика «Споротермин» при действии высоких температур // Сборник научных трудов СКНИИЖ. 2016. №3. URL: https://cyberleninka.ru/article/n/vyzhivaemost-mikroorganizmov-probiotika-sporotermin-pri-deystvii-vysokih-temperatur (дата обращения: 24.10.2024).","Горковенко Леонид Григорьевич, & Юрина Наталья Александровна (2016). Выживаемость микроорганизмов пробиотика «Споротермин» при действии высоких температур. Сборник научных трудов Краснодарского научного центра по зоотехнии и ветеринарии, 5 (3), 107-112.",https://cyberleninka.ru/article/n/vyzhivaemost-mikroorganizmov-probiotika-sporotermin-pri-deystvii-vysokih-temperatur
Корма из злаково-бобовых трав с использованием биоконсерванта «Альбит-корм»,"Марченко Александра Юрьевна, Забашта Николай Николаевич, Головко Елена Николаевна",Сборник научных трудов Краснодарского научного центра по зоотехнии и ветеринарии,2016,Агробиотехнологии,"злаково-бобовые травосмеси, сенаж, кормовая смесь, общесмешанные рационы (оср), энергетическая и кормовая ценность, обменная энергия (оэ), биологический консервант, лактобактерии, молочная кислота, кислотность, ""альбит-корм""","grass-legume mixtures, feed mix, obsecene rations (srf), energy and feeding value, the exchange energy (oe), ""biovet-ferment"", biological preservative, lactobacillus, lactic acid, acidity, ""albite-feed""","Проведены исследования по изучению качества процессов брожения сенажной массы, сохранности основных питательных веществ в сенажах из злаково-бобовых травосмесей (пшеница+вика, тритикале+вика) с биоконсервантом «Альбит-корм» в лабораторных условиях. Кормовую массу консервировали из расчёта 1 литр рабочего раствора на 20 тонн сырья.","Марченко Александра Юрьевна, Забашта Николай Николаевич, Головко Елена Николаевна Корма из злаково-бобовых трав с использованием биоконсерванта «Альбит-корм» // Сборник научных трудов СКНИИЖ. 2016. №3. URL: https://cyberleninka.ru/article/n/korma-iz-zlakovo-bobovyh-trav-s-ispolzovaniem-biokonservanta-albit-korm (дата обращения: 24.10.2024).","Марченко Александра Юрьевна, Забашта Николай Николаевич, & Головко Елена Николаевна (2016). Корма из злаково-бобовых трав с использованием биоконсерванта «Альбит-корм». Сборник научных трудов Краснодарского научного центра по зоотехнии и ветеринарии, 5 (3), 144-150.",https://cyberleninka.ru/article/n/korma-iz-zlakovo-bobovyh-trav-s-ispolzovaniem-biokonservanta-albit-korm
Применение комбинированных пробиотиков в свиноводстве,"Москаленко Елена Александровна, Забашта Николай Николаевич",Сборник научных трудов Краснодарского научного центра по зоотехнии и ветеринарии,2016,Агробиотехнологии,"кормление свиней, молочнокислые бактерии, пропионовокислые бактерии, кишечный микробиоценоз","nutrition of pigs, lactobacilus, bacteria of propionic acid, intestinal microbiocenosis","Исследования направлены на изучение влияния комбинированного пробиотика на основе молочнокислых и пропионовокислых бактерий на ростовые показатели, выживаемость свиней и показатели микробиоценоза их толстого кишечника.","Москаленко Елена Александровна, Забашта Николай Николаевич Применение комбинированных пробиотиков в свиноводстве // Сборник научных трудов СКНИИЖ. 2016. №3. URL: https://cyberleninka.ru/article/n/primenenie-kombinirovannyh-probiotikov-v-svinovodstve (дата обращения: 24.10.2024).","Москаленко Елена Александровна, & Забашта Николай Николаевич (2016). Применение комбинированных пробиотиков в свиноводстве. Сборник научных трудов Краснодарского научного центра по зоотехнии и ветеринарии, 5 (3), 150-155.",https://cyberleninka.ru/article/n/primenenie-kombinirovannyh-probiotikov-v-svinovodstve
