Title,Authors,Journal,Year,Field of Science,Russian Keywords,English Keywords,Annotation,GOST,APA,Link
Влияние питательной среды и спектрального состава света на размножение земляники in vitro,"Маркова Марина Геннадьевна, Сомова Елена Николаевна",Аграрная наука Евро-Северо-Востока,2018,Агробиотехнологии,"микроклональное размножение, микропобеги земляники садовой и ремонтантной, питательная среда, светодиодные фитооблучатели, пролиферация, укоренение","nutrient medium, proliferation, rooting, microclonal propagation, micro-shoots of garden and remontant strawberry, led phytoirradiators","Исследования проведены в 2016-2017 гг на базе меристемной лаборатории Объект исследований микропобеги земляники садовой сорта Фестивальная и ремонтантной сорта Брайтон на этапах микроразмножения и укоренения. Изучались питательные среды Мурасиге-Скуга (контроль), Мурасиге-Скуга модифицированная (микроэлементы заменены соответствующей дозой микроудобрения «Силиплант») и Боксю; светодиодные облучатели с соотношением в спектре красного (К), синего (С) и белого (Б) света 2К:1С:1Б и 1К:1С:1Б соответственно и программируемый с меняющимся спектром, контрольным служил люминесцентный с лампами белого света. Наибольший коэффициент размножения при культивировании земляники садовой in vitro получен с использованием модифицированной питательной среды Мурасиге-Скуга под светодиодным облучателем 1К:1С:1Б и облучателем с меняющимся спектральным составом: 6,0 и 6,2 шт/микрочеренок соответственно. Наибольший коэффициент размножения земляники ремонтантной обеспечило культивирование на питательной среде Мурасиге-Скуга с применением светодиодного облучателя 1К:1С:1Б и облучателя с меняющимся спектральным составом: 3,5 и 3,2 шт./ микрочеренок соответственно. Укоренение микропобегов земляники садовой на питательных средах МурасигеСкуга модифицированной и Боксю обеспечило существенное увеличение укореняемости до 100 и 97,5% соответственно. Культивирование на питательной среде Боксю увеличило укореняемость микропобегов земляники ремонтантной до 95,0%. Все светодиодные облучатели обеспечили существенное увеличение укореняемости микропобегов: по землянике садовой до 96,6-100%, по ремонтантной до 83,3-90,0%.","Маркова Марина Геннадьевна, Сомова Елена Николаевна Влияние питательной среды и спектрального состава света на размножение земляники in vitro // Аграрная наука Евро-Северо-Востока. 2018. №2 (63). URL: https://cyberleninka.ru/article/n/vliyanie-pitatelnoy-sredy-i-spektralnogo-sostava-sveta-na-razmnozhenie-zemlyaniki-in-vitro (дата обращения: 24.10.2024).","Маркова Марина Геннадьевна, & Сомова Елена Николаевна (2018). Влияние питательной среды и спектрального состава света на размножение земляники in vitro. Аграрная наука Евро-Северо-Востока,  (2 (63)), 35-41.",https://cyberleninka.ru/article/n/vliyanie-pitatelnoy-sredy-i-spektralnogo-sostava-sveta-na-razmnozhenie-zemlyaniki-in-vitro
Стимуляция ризогенеза красной и чёрной малин in vitro с использованием когерентного излучения,"Соловых Наталья Владимировна, Будаговский Андрей Валентинович",Аграрная наука Евро-Северо-Востока,2018,Агробиотехнологии,"клональное микроразмножение in vitro, ризогенез, фотостимуляция, система фитохромов, малина красная, малина чёрная","clonal micropropagation in vitro, rhizogenesis, photostimulation, system of phytochromes, red raspberry, black raspberry","Изучали влияние дополнительного красного светодиодного и лазерного освещения на ризогенез in vitro растений рода Rubus при разных уровнях базовой полихроматической освещённости. Актуальность данной работы обусловлена необходимостью совершенствования биотехнологических методов ускоренного размножения растений на всех этапах клонирования, в том числе на этапе корнеобразования Одним из путей решения этой задачи является использование когерентного излучения для стимуляции физиологических и морфогенетических процессов у растений и создание на основе разработанных методов энергосберегающих технологий культивирования. Микрочеренки ягодных культур, культивируемые при освещённости 1000 и 2000 Люкс, подвергали ежедневному дополнительному освещению в течение 20 минут светодиодами (λ = 638 нм, плотность мощности 5 Вт/м2) или гелий-неоновым лазером (λ = 632,8 нм, плотность мощности 3 Вт/м2). В условиях низкой освещённости (1000 Лк) отмечено снижение интенсивности ризогенеза у красной и чёрной малин по сравнению с освещённостью 2000 Лк. Светодиодное и лазерное дополнительное облучение повышали интенсивность ризогенеза ягодных культур in vitro. При низкой базовой освещённости (1000 Лк) наблюдался максимальный стимулирующий эффект дополнительного красного квазимонохроматического освещения. У красной и чёрной малин лазерная и светодиодная досветки при недостаточной базовой освещённости позволили получить число корней и суммарную их длину в расчёте на один эксплант, не отличающиеся статистически от таковых при полной освещённости, но без досветки.","Соловых Наталья Владимировна, Будаговский Андрей Валентинович Стимуляция ризогенеза красной и чёрной малин in vitro с использованием когерентного излучения // Аграрная наука Евро-Северо-Востока. 2018. №5 (66). URL: https://cyberleninka.ru/article/n/stimulyatsiya-rizogeneza-krasnoy-i-chyornoy-malin-in-vitro-s-ispolzovaniem-kogerentnogo-izlucheniya (дата обращения: 24.10.2024).","Соловых Наталья Владимировна, & Будаговский Андрей Валентинович (2018). Стимуляция ризогенеза красной и чёрной малин in vitro с использованием когерентного излучения. Аграрная наука Евро-Северо-Востока,  (5 (66)), 64-68.",https://cyberleninka.ru/article/n/stimulyatsiya-rizogeneza-krasnoy-i-chyornoy-malin-in-vitro-s-ispolzovaniem-kogerentnogo-izlucheniya
"Результативность эндогенного и экзогенного использования пробиотика ""Споротермин "" на разных этапах онтогенеза африканского клариевого сома","Любомирова Васелина Николаевна, Романов Василий Васильевич, Ракова Людмила Юрьевна",Вестник Ульяновской государственной сельскохозяйственной академии,2018,Агробиотехнологии,"аквакультура, африканский клариевый сом, пробиотики, гематология, биохимия, биомасса, выживаемость, исследования выполнялись по гранту рффи 18-416-730005","aquaculture, african catfish, probiotics, hematology, biochemistry, biomass, survivability","Одно из современных направлений исследований в рыборазведении это применение пробиотиков, которое повышает эффективность аквакультуры. Целью нашей работы была сравнительная оценка различных способов введения в организм рыб пробиотика «Споротермин» для повышения интенсивности роста и сохранности молоди африканского клариевого сома. В задачи работы входило: исследование ростовых и рыбоводных показателей молоди сомов при выращивании в условиях бассейнового содержания при эндогенном и экзогенном введении пробиотика «Споротермин»; оценка влияния пробиотика на гематологические показатели крови молоди сомов, выращенных при различных способах введения; обоснование наиболее эффективного способа применения пробиотика «Споротермин» при выращивании молоди клариевого сома. Результаты наших исследований показали, что эндогенное и экзогенное введение пробиотика «Споротермин» оказывает позитивное влияние на уровень гемоглобина, СОЭ, количество лимфоцитов, показатели углеводного и белкового обмена, активность ферментов, а в конечном итоге на выживаемость, ростовые характеристики рыб и скорость наращивания биомассы. Наиболее выраженное позитивное влияние «Споротермина» на организм рыб отмечалось в группе, в которой осуществлялось сочетанное эндогенное и экзогенное введение пробиотика. Полученные нами результаты позволяют рекомендовать пробиотик «Споротермин» в качестве пробиотической добавки, которую вполне обоснованно можно включать в состав кормов для рыб. Также в условиях индустриальной аквакультуры можно рекомендовать внесение «Споротермина» в воду для того, чтобы обеспечить наиболее полную реализацию генетического потенциала продуктивности рыб.","Любомирова Васелина Николаевна, Романов Василий Васильевич, Ракова Людмила Юрьевна Результативность эндогенного и экзогенного использования пробиотика \u0022Споротермин \u0022 на разных этапах онтогенеза африканского клариевого сома // Вестник Ульяновской ГСХА. 2018. №4 (44). URL: https://cyberleninka.ru/article/n/rezultativnost-endogennogo-i-ekzogennogo-ispolzovaniya-probiotika-sporotermin-na-raznyh-etapah-ontogeneza-afrikanskogo-klarievogo (дата обращения: 24.10.2024).","Любомирова Васелина Николаевна, Романов Василий Васильевич, & Ракова Людмила Юрьевна (2018). Результативность эндогенного и экзогенного использования пробиотика \u0022Споротермин \u0022 на разных этапах онтогенеза африканского клариевого сома. Вестник Ульяновской государственной сельскохозяйственной академии,  (4 (44)), 172-177.",https://cyberleninka.ru/article/n/rezultativnost-endogennogo-i-ekzogennogo-ispolzovaniya-probiotika-sporotermin-na-raznyh-etapah-ontogeneza-afrikanskogo-klarievogo
Агробактериальная трансформация культуры клеток василистника малого (Thalictrum minus L. ),Осипова Елена Александровна,Известия Самарского научного центра Российской академии наук,2018,Агробиотехнологии,"трансформация, культура клеток, протобербериновые алкалоиды.","agrobacterium tumefaciens, thalictrum minus, transformation, agrobacterium tumefaciens, thalictrum minus, cell culture, protoberberine alkaloids.","Разработан метод агробактериальной трансформации каллусной культуры клеток лекарственного растения василистник малый. Для трансформации использовали штамм Agrobacterium tumefaciens, содержащей коинтегративный вектор pGV 3850. Плазмида содержит целевой ген ipt, кодирующий ключевой фермент биосинтеза цитокининов изопентенилтрансферазу, под промотором 35S вируса мозайки цветной капусты и селективный ген nptII, кодирующий фермент неомицинфосфотрансферазу, придающий устойчивость к канамицину, под контролем NOS промотора. Трансформировали два штамма «В» и 233, различающихся по интенсивности роста и уровню биосинтеза протобербериновых алкалоидов. Оценивали эффективность влияния на трансформацию вакуумной инфильтрации и экстракта табака. Отбор трансформированных каллусов проводили на сублетальной концентрации канамицина: для штамма «В» 50 мг/л и штамма 233 20 мг/л. Устойчивые к канамицину клеточные линии оценивали методом ПЦР на наличие в них гена ipt. Отмечена отдаленная реакция на канамицин, то есть снижение жизнеспособности каллусов при отсутствии канамицина происходило к третьему пассажу. Наиболее низкая выживаемость каллусов отмечена в варианте с экстрактом табака. Однако методом ПЦР показано, что наиболее эффективным для трансформации был вариант с экстрактом табака без вакуумной инфильтрации. В результате были выделены ipt-положительные клеточные линии: пять клеточных линий из штамма 233 и одна клеточная линия из штамма «В». Эффективность трансформации (отбор на канамицине + ПЦР) для штамма 233 составила 14,6%, для штамма «В» 0,1%. Из пяти ipt-положительных линий от штамма 233 две из них имели более высокую интенсивность роста и уровень содержания протобербериновых алкалоидов, единственная ipt-положительная линия от «В» штамма имела, наоборот, более низкую интенсивность роста и низкий уровень протобербериновых алкалоидов. Cреди ipt-положительных линий отмечена вариабельность по интенсивности роста и уровню биосинтеза протобербериновых алкалоидов.",Осипова Елена Александровна Агробактериальная трансформация культуры клеток василистника малого (Thalictrum minus L. ) // Известия Самарского научного центра РАН. 2018. №5-3. URL: https://cyberleninka.ru/article/n/agrobakterialnaya-transformatsiya-kultury-kletok-vasilistnika-malogo-thalictrum-minus-l (дата обращения: 24.10.2024).,"Осипова Елена Александровна (2018). Агробактериальная трансформация культуры клеток василистника малого (Thalictrum minus L. ). Известия Самарского научного центра Российской академии наук, 20 (5-3), 447-455. doi: 10.24411/1990-5378-2018-00116",https://cyberleninka.ru/article/n/agrobakterialnaya-transformatsiya-kultury-kletok-vasilistnika-malogo-thalictrum-minus-l
Эффективность предпосевной обработки семян лофанта тибетского регуляторами роста,"Абрамчук А.В., Мингалев С.К., Карпухин М.Ю.",Аграрный вестник Урала,2018,Агробиотехнологии,"регуляторы роста растений: эпин-экстра, циркон, ортон-рост, обработка семян, лофант тибетский",,"Исследование проводилось в 2017-2018 гг. В течение двух лет изучалось влияние препаратов из различных классов соединений в концентрациях, рекомендованных производителем. Схема опыта включает четыре варианта: 1) контроль (семена замачивали в дистиллированной воде); 2) Эпин-экстра (концентрация 0,05 мл/100 мл воды); 3) Циркон (концентрация 0,05 мл/100 мл воды); 4) Ортон-Рост (концентрация 0,5 г/250 мл воды). Время замачивания семян в воде и обработки препаратами во всех изучаемых вариантах 4 ч. В процессе исследования установлено, что предпосевная обработка семян регуляторами роста оказывает существенное влияние на развитие растений лофанта тибетского: увеличиваются энергия прорастания и лабораторная всхожесть, возрастают все биометрические параметры растений, наблюдается рост надземной и подземной биомассы. Более высокие показатели отмечены в четвертом варианте: надземная биомасса (в среднем на один побег) увеличилась по сравнению с контрольным вариантом на 0,37 г (62,7 %), а подземная на 0,08 г (80,0 %). В структуре надземной биомассы побега во всех вариантах преобладают листья, на их долю приходится от 0,47 ± 0,03г (контроль) до 0,74 ± 0,02 г (Ортон-рост).","Абрамчук А. В., Мингалев С. К., Карпухин М. Ю. Эффективность предпосевной обработки семян лофанта тибетского регуляторами роста // АВУ. 2018. №6 (173). URL: https://cyberleninka.ru/article/n/effektivnost-predposevnoy-obrabotki-semyan-lofanta-tibetskogo-regulyatorami-rosta (дата обращения: 24.10.2024).","Абрамчук А.В., Мингалев С.К., & Карпухин М.Ю. (2018). Эффективность предпосевной обработки семян лофанта тибетского регуляторами роста. Аграрный вестник Урала,  (6 (173)), 5-10.",https://cyberleninka.ru/article/n/effektivnost-predposevnoy-obrabotki-semyan-lofanta-tibetskogo-regulyatorami-rosta
