Title,Authors,Journal,Year,Field of Science,Russian Keywords,English Keywords,Annotation,GOST,APA,Link
Оценка удовлетворения пищевых потребностей коренных малочисленных народов Севера в мясе морских млекопитающих,Гузь Юлия Николаевна,Вопросы науки и образования,2018,Агробиотехнологии,"морские млекопитающие, промысел морских млекопитающих, численность населения",,В статье анализируется оценка удовлетворения пищевых потребностей в продуктах убоя морских млекопитающих коренного населения Севера.,Гузь Юлия Николаевна Оценка удовлетворения пищевых потребностей коренных малочисленных народов Севера в мясе морских млекопитающих // Вопросы науки и образования. 2018. №26 (38). URL: https://cyberleninka.ru/article/n/otsenka-udovletvoreniya-pischevyh-potrebnostey-korennyh-malochislennyh-narodov-severa-v-myase-morskih-mlekopitayuschih (дата обращения: 24.10.2024).,"Гузь Юлия Николаевна (2018). Оценка удовлетворения пищевых потребностей коренных малочисленных народов Севера в мясе морских млекопитающих. Вопросы науки и образования,  (26 (38)), 32-34.",https://cyberleninka.ru/article/n/otsenka-udovletvoreniya-pischevyh-potrebnostey-korennyh-malochislennyh-narodov-severa-v-myase-morskih-mlekopitayuschih
Совершенствование технологии и рецептуры кормления уток,"Иванова Эльвира Сергеевна, Родионов Юрий Викторович, Кобзев Дмитрий Евгеньевич, Чиркина Александра Михайловна",Достижения науки и образования,2018,Агробиотехнологии,"корм, утки, свойства, состав корма, конвективная сушка, пастернак, растительное сырье",,"В статье описаны свойства пастернака, состав корма уток, с набором необходимых микроэлементов и сделаны выводы об использовании сушеного пастернака в корме для уток.","Иванова Эльвира Сергеевна, Родионов Юрий Викторович, Кобзев Дмитрий Евгеньевич, Чиркина Александра Михайловна Совершенствование технологии и рецептуры кормления уток // Достижения науки и образования. 2018. №12 (34). URL: https://cyberleninka.ru/article/n/sovershenstvovanie-tehnologii-i-retseptury-kormleniya-utok (дата обращения: 24.10.2024).","Иванова Эльвира Сергеевна, Родионов Юрий Викторович, Кобзев Дмитрий Евгеньевич, & Чиркина Александра Михайловна (2018). Совершенствование технологии и рецептуры кормления уток. Достижения науки и образования,  (12 (34)), 12-14.",https://cyberleninka.ru/article/n/sovershenstvovanie-tehnologii-i-retseptury-kormleniya-utok
Модификация питательных сред при депонировании березы в культуре in vitro,Концевая Ирина Ильинична,Достижения науки и образования,2018,Агробиотехнологии,"депонирование, культура in vitro, береза",,"Представленные результаты показали возможность хранения культуры разных видов березы в условиях in vitro в течение 12 месяцев при использовании питательных сред, дополненных абсцизовой кислотой (в том числе при включении в состав сред повышенной дозы сахарозы, активированного угля, 6-БАП).",Концевая Ирина Ильинична Модификация питательных сред при депонировании березы в культуре in vitro // Достижения науки и образования. 2018. №7 (29). URL: https://cyberleninka.ru/article/n/modifikatsiya-pitatelnyh-sred-pri-deponirovanii-berezy-v-kulture-in-vitro (дата обращения: 24.10.2024).,"Концевая Ирина Ильинична (2018). Модификация питательных сред при депонировании березы в культуре in vitro. Достижения науки и образования, 1 (7 (29)), 9-12.",https://cyberleninka.ru/article/n/modifikatsiya-pitatelnyh-sred-pri-deponirovanii-berezy-v-kulture-in-vitro
Оптимизация определения параметров генетической чистоты линий подсолнечника на основе микросателлитных локусов ДНК,"Гучетль С.З., Фролов С.С., Кузнецова Е.С.",Масличные культуры,2018,Агробиотехнологии,"подсолнечник, линии, генетическая чистота, днк, микросателлитные локусы","sunflower, lines, genetic purity, dna, microsatellite loci","Широкое внедрение гибридов в производство в основном сдерживается из-за сложного семеноводства, предусматривающего поддержание родительских линий на высоком уровне генетический чистоты. Поэтому целью работы была оптимизация определения параметров генетической чистоты линий подсолнечника на основе микросателлитных локусов ДНК. Материалом для исследования служили 12 линий коллекции подсолнечника Армавирской опытной станции ВНИИМК. Геномную ДНК выделяли из 100 отдельных 57-дневных этиолированных проростков подсолнечника каждого образца с использованием СТАВ-буфера. Показано, что 11 пар праймеров для ПЦР выявляют стабильный, воспроизводящийся полиморфизм фракций амплифицированной ДНК. В результате проведенных исследований для определения параметров генетической чистоты линий подсолнечника с помощью микросателлитных локусов ДНК с использованием критериев уровня полиморфизма были отобраны семь пар праймеров. Для оптимизации метода две пары праймеров (ORS 5 и Har 432) были объединены в мультиплексный набор. Остальные пять локусов (ORS 559, Har 432, ORS 5, ORS 815, ORS 1144) амплифицировались отдельно. Сократить количество анализов также позволяет создание смесей, состоящих из объединенных аликвот ДНК отдельных проростков в одной пробирке. В случае если после ПЦР на фореграмме обнаруживаются дорожки с несколькими фракциями, образцы ДНК, из которых собрана эта нетипичная смесь, амплифицируются отдельно, чтобы выяснить количество нетипичных семян.","Гучетль С. З., Фролов С. С., Кузнецова Е. С. Оптимизация определения параметров генетической чистоты линий подсолнечника на основе микросателлитных локусов ДНК // Масличные культуры. 2018. №3 (175). URL: https://cyberleninka.ru/article/n/optimizatsiya-opredeleniya-parametrov-geneticheskoy-chistoty-liniy-podsolnechnika-na-osnove-mikrosatellitnyh-lokusov-dnk (дата обращения: 24.10.2024).","Гучетль С.З., Фролов С.С., & Кузнецова Е.С. (2018). Оптимизация определения параметров генетической чистоты линий подсолнечника на основе микросателлитных локусов ДНК. Масличные культуры,  (3 (175)), 34-39.",https://cyberleninka.ru/article/n/optimizatsiya-opredeleniya-parametrov-geneticheskoy-chistoty-liniy-podsolnechnika-na-osnove-mikrosatellitnyh-lokusov-dnk
Укоренение микрочеренков vacc1nium corymbosum L. сорта Блю Берри в культуре in vitro и ex vitro,"Мохамед Гамил Ранян Абуэлдис, Хуснетдинова Ландыш Завдетовна, Тимофеева Ольга Арнольдовна",Самарский научный вестник,2018,Агробиотехнологии,"голубика высокорослая, растения-регенеранты, эксплант, сегменты стебля, среда wpm, апикальные части стебля, микроклональное размножение, сорт блю берри, адаптация, ризогенез, укоренение, биологические ресурсы","vaccinium corymbosum l., in vitro, ex vitro, vaccinium corymbosum l., highbush blueberry, regenerated plantlets, in vitro, ex vitro: explant, nodal segments, wpm medium, apical meristem, micropropagation, blue-berry variety, adaptation, rhizogenesis, rooting, biological resources","В данной статье рассматривается вопрос клонального микроразмножения Vaccinium corymbosum L. сорта Блю Берри, который позволяет на основе приемов культуры изолированных тканей и органов in vitro ускорить получение растения генетически идентичные исходным. Показано, что микроразмножение пазушных побегов голубики высокорослой было более эффективным на WPM с добавлением 1,0 мг/л зеатина и 0,1 мг/л индол ил-3-масляной кислоты. В течение пяти пассажей было показано, что максимальное увеличение количества здоровых пазушных побегов наблюдается на четвертом пассаже, тогда как с пятого пассажа начинает появляться феномен гипергидратации (витрификации). Установлено, что присутствие в составе питательной среды индолил-3-масляной кислоты и 1,0 г/л активированного угля приводило к хорошему формированию корневой системы голубики высокорослой. Наибольшее среднее количество сформированных корней на эксплантат было получено на среде WPM, дополненной 0,5 мг/л индолил-3масляной кислотой через 10 недель. Акклиматизация растений-регенерантов V. corymbosum, имеющих развитую корневую систему, при переносе в естественные условия ex vitro (pH 3,5-4) показала 100% выживаемость.","Мохамед Гамил Ранян Абуэлдис, Хуснетдинова Ландыш Завдетовна, Тимофеева Ольга Арнольдовна Укоренение микрочеренков vacc1nium corymbosum L. сорта Блю Берри в культуре in vitro и ex vitro // СНВ. 2018. №4 (25). URL: https://cyberleninka.ru/article/n/ukorenenie-mikrocherenkov-vacc1nium-corymbosum-l-sorta-blyu-berri-v-kulture-in-vitro-i-ex-vitro (дата обращения: 24.10.2024).","Мохамед Гамил Ранян Абуэлдис, Хуснетдинова Ландыш Завдетовна, & Тимофеева Ольга Арнольдовна (2018). Укоренение микрочеренков vacc1nium corymbosum L. сорта Блю Берри в культуре in vitro и ex vitro. Самарский научный вестник, 7 (4 (25)), 80-84. doi: 10.24411/2309-4370-2018-14114",https://cyberleninka.ru/article/n/ukorenenie-mikrocherenkov-vacc1nium-corymbosum-l-sorta-blyu-berri-v-kulture-in-vitro-i-ex-vitro
Оценка эффективности индукторов гаметогенеза африканского клариевого сома,"Любомирова Васелина Николаевна, Романова Елена Михайловна, Романов Василий Васильевич, Мухитова Минзифа Эминовна",Вестник Ульяновской государственной сельскохозяйственной академии,2018,Агробиотехнологии,"индукторы, гонады, сперматогенез, африканский клариевый сом","gonads, spermatogenesis, african sharptooth catfish, inducers","Приведены результаты сравнительного исследования ряда индукторов сперматогенеза африканского клариевого сома. Для стимуляции созревания половых клеток самцов использовались препараты, отличающиеся механизмом действия: хорионический гонадотропин, сурфагон и нерестин. Хорионический гонадотропин (ХГ) гонадотропный гормон, вырабатываемый плацентой, обладает гонадотропным действием, увеличивает вес семенников за счет разрастания интерстициальной ткани, стимулирует сперматогенез и продукцию половых стероидов. Нерестин 7А, является синтетическим препаратом, не относящимся к группе гонадотропинов, его применение основано на стимуляции собственной гонадотропной системы активными рилизинг-факторами и модификаторами рецепторов аденогипофиза. Сурфагон синтетический аналог люлиберина, гормональный регулятор, стимулирующий секрецию гипофизарных гонадотропинов лютеинизирующего гормона (ЛГ) и фолликулостимулирующего гормона. Исследования выполнялись на базе Лаборатории экспериментальной биологии и аквакультуры Ульяновского ГАУ, объектом исследования являлся африканский клариевый сом (Clarias gariepinus). Целью работы были сравнительные исследования влияния индукторов гаметогенеза, отличающихся механизмом действия, на созревание гонад и жизнеспособность половых клеток у африканского клариевого сома. В задачи исследования входило: сравнительная оценка влияния хорионического гонадотропина, сурфагона и нерестина на созревание гонад клариевого сома; исследование жизнеспособности половых клеток самцов при использовании различных индукторов сперматогенеза; исследование выживаемости половых клеток при длительном хранении семенников в условиях охлаждения. Было показано, что по эффективности воздействия сравниваемые препараты имеют отличия; наиболее выраженный индуцирующий эффект у африканского клариевого сома наблюдался при использовании сурфагона. У самцов, стимулированных сурфагоном вес семенников и объем спермы был выше, чем при использовании других препаратов. Также было показано, что половые клетки самцов клариевого сома в полной мере сохраняют свою активность при хранении в интактных семенниках при температуре 2 0С свыше 24 часов. Установлено, что выбор индуктора гаметогенеза не влиял на выживаемость половых клеток в условиях длительного хранения.","Любомирова Васелина Николаевна, Романова Елена Михайловна, Романов Василий Васильевич, Мухитова Минзифа Эминовна Оценка эффективности индукторов гаметогенеза африканского клариевого сома // Вестник Ульяновской ГСХА. 2018. №2 (42). URL: https://cyberleninka.ru/article/n/otsenka-effektivnosti-induktorov-gametogeneza-afrikanskogo-klarievogo-soma (дата обращения: 24.10.2024).","Любомирова Васелина Николаевна, Романова Елена Михайловна, Романов Василий Васильевич, & Мухитова Минзифа Эминовна (2018). Оценка эффективности индукторов гаметогенеза африканского клариевого сома. Вестник Ульяновской государственной сельскохозяйственной академии,  (2 (42)), 148-154.",https://cyberleninka.ru/article/n/otsenka-effektivnosti-induktorov-gametogeneza-afrikanskogo-klarievogo-soma
Анализ протеома протейного бактериофага,"Феоктистова Наталья Александровна, Васильев Дмитрий Аркадьевич, Мастиленко Андрей Владимирович, Сульдина Екатерина Владимировна",Вестник Ульяновской государственной сельскохозяйственной академии,2018,Агробиотехнологии,"бактериофаг, протеомный анализ, сиквенс, белок, молекулярная масса","proteus, bacteriophage, proteomic analysis, sequence, protein, molecular weight","В статье представлены результаты изучения протеомного анализа бактериофага протейного Pr 6 УГСХА (изучение аминокислотной последовательности протеинов, их качественного и количественного составов, изоэлектрической точки белков, молекулярного веса), выделенного и селекционированного в 2017 году из объектов внешней среды по показателям специфичности и литической активности. В экспериментах были использованы ресурсы систем SnapGene Viewer v.4.1.7 и ExPasy (https://web.expasy.org) и метод вертикального электрофореза в ПААГ. Анализ профилограмм был проведен с использованием программного обеспечения GelAnalyzer 2010.В результате проведенных исследований были сопоставлены данные протеомного анализа на основании проведенного сиквенса и электрофореза в ПААГ. Установлено, что качественный состав протеинов бактериофага Pr 6 УГСХА соответствует таковым у аннотированных аналогов, имеет четкие гомологии нуклеотидного и аминокислотного наборов. При анализе протеома бактериофага Pr 6 УГСХА и, соответственно, данных секвенирования его нуклеиновой кислоты было выявлено 50 белков с молекулярными массами от 5,5 до 140 кДа. При разделении выделенных и сконцентрированных белков фага в ПААГ методом вертикального электрофореза для Proteusphage Pr 6 УГСХА было выявлено 3 белка (67 кДа, 77 кДа и 94 кДа). Полученные данные о геноме бактериофага Pr 6 УГСХА, специфичного для бактерий рода Proteus, вызывающих зоонозные инфекции, приближает нас к созданию фаговых терапевтических препаратов нового поколения, приспособленных для парентерального введения, обладающих заданными параметрами фармакокинетики и соответствующих современным стандартам биобезопасности.","Феоктистова Наталья Александровна, Васильев Дмитрий Аркадьевич, Мастиленко Андрей Владимирович, Сульдина Екатерина Владимировна Анализ протеома протейного бактериофага // Вестник Ульяновской ГСХА. 2018. №2 (42). URL: https://cyberleninka.ru/article/n/analiz-proteoma-proteynogo-bakteriofaga (дата обращения: 24.10.2024).","Феоктистова Наталья Александровна, Васильев Дмитрий Аркадьевич, Мастиленко Андрей Владимирович, & Сульдина Екатерина Владимировна (2018). Анализ протеома протейного бактериофага. Вестник Ульяновской государственной сельскохозяйственной академии,  (2 (42)), 223-229.",https://cyberleninka.ru/article/n/analiz-proteoma-proteynogo-bakteriofaga
