Title,Authors,Journal,Year,Field of Science,Russian Keywords,English Keywords,Annotation,GOST,APA,Link
Влияние регуляторов роста нового поколения на развитие культурных растений,Мурсалимова Гульнара Рамильевна,Бюллетень Оренбургского научного центра УрО РАН,2016,Агробиотехнологии,"регуляторы роста, укоренение, корневая система, развитие","growth regulators, rooting, root system, development","Цель. Определить влияние физиологического эффекта регуляторов роста нового поколения на развитие культурных растений (на примере клонового подвоя) в условиях степной зоны Приуралья. Материалы и методы. Объект исследований регуляторы роста растений «Циркон», «Рибав-Экстра», испытания проводили на одревесневших черенках вегетативно размножаемых клоновых подвоях яблони Урал 56, Урал 8, в контролируемых условиях отапливаемой теплицы. Использовался субстрат, состоящий из земли и песка в соотношении 2:1. Раз в 10 дней проводили полив черенков растворами препаратов. Повторность опыта 3-х кратная, по 100 растений в каждом варианте. Исследования проводились в соответствии с общепринятой методикой. Результаты. Максимальный процент укоренения черенков отмечен при использовании стимулятора Циркон (24,0-41,6%). В варианте со стимулятором Рибав-Экстра увеличение показателя на 9,8-33,7%. Использование препаратов нового поколения (на примере препаратов Циркон и Рибав-Экстра) способствует увеличению выхода укорененных черенков. В опытах с применением регуляторов роста отмечается увеличение процента выхода стандартных саженцев для последующей прививки (81,2-95,6%). Наибольший процент черенков с развитой корневой системой наблюдается при использовании препарата Циркон. Заключение. На основании изучения новых перспективных регуляторов роста растений, аргументировано влияние стимуляторов Циркон и Рибав-Экстра. Исследуемые препараты способствуют регенерации, укоренению и одновременно стимулируют рост, развитие и физиологические процессы растений, повышают способность адаптироваться к неблагоприятным факторам среды. В ходе проведенных исследований влияния препаратов нового поколения на вегетативно размножаемых подвоях Урал 8 и Урал 11 выявлен суммарный положительный эффект на морфометрические показатели клоновых подвоев и качественные показатели развития саженцев.",Мурсалимова Гульнара Рамильевна Влияние регуляторов роста нового поколения на развитие культурных растений // БОНЦ УрО РАН. 2016. №4. URL: https://cyberleninka.ru/article/n/vliyanie-regulyatorov-rosta-novogo-pokoleniya-na-razvitie-kulturnyh-rasteniy (дата обращения: 24.10.2024).,"Мурсалимова Гульнара Рамильевна (2016). Влияние регуляторов роста нового поколения на развитие культурных растений. Бюллетень Оренбургского научного центра УрО РАН,  (4), 11.",https://cyberleninka.ru/article/n/vliyanie-regulyatorov-rosta-novogo-pokoleniya-na-razvitie-kulturnyh-rasteniy
Исследование пребиотических свойств маннозосодержащего гидролизата,"Черемушкина И.В., Корнеева О.С.",Технологии пищевой и перерабатывающей промышленности АПК – продукты здорового питания,2016,Агробиотехнологии,"маннозосодержащий гидролизат, пребиотические свойства, ^-маннаназа, манноза, микрофлора желудочно-кишечного тракта, дисбиоз","manozostera hydrolysate, prebiotic properties, (5-mannanase, mannose, microflora of the gastrointestinal tract, dysbiosis","Птицеводство является динамично развивающейся отраслью агропромышленного комплекса, обеспечивающей население биологически полноценной здоровой пищей. Опыт как российского, так и зарубежного птицеводства, свидетельствует о том, что рост конкурентоспособности отрасли на сегодняшний день находится в прямой зависимости от внедрения кормовых добавок, которые позволят максимально реализовать генетический потенциал продуктивности птицы. Важную роль в поддержании эффективного роста, здоровья и благополучия птицы играет микрофлора кишечника, дисбаланс которой приводит к нарушению продуктивности поголовья. Кроме того, недавние изменения законодательства стран ЕС, касающиеся использования антибактериальных препаратов, являются причиной повышенных требований к здоровью желудочно-кишечного тракта птицы. В работе идентифицирован и количественно определен состав маннозосодержащего гидролизата с помощью тонкослойной хроматографии с последующей обработкой хроматограмм с помощью денситометра CAMAG TLC Scanner 3 (Швейцария). Исследования активности маннозосодержащего гидролизата в опытах in vitro при культивировании бактерий Bifidobacterium bifidum на средах с различными углеводами, изучение интенсивности метаболических процессов и симбиотических отношений с представителем условно-патогенной микрофлоры бактериями E. coli. свидетельствуют о высокой пребиотической активности манноолигосахаридов. Исследование пребиотических свойств лиофилизированного маннозосодержащего гидролизата в опытах in vivo на цыплятах-бройлерах кросса «ROSS 308» в состоянии антибиотико-ассоциированного дисбиоза показало, что препарат оказывал положительное влияние на динамику восстановления популяционного уровня основных представителей нормофлоры, что выражалось в увеличении количества лактои бифидобактерий и сдерживании роста бактерий группы кишечной палочки.","Черемушкина И. В., Корнеева О. С. Исследование пребиотических свойств маннозосодержащего гидролизата //  ТППП АПК. 2016. №5 (13). URL: https://cyberleninka.ru/article/n/issledovanie-prebioticheskih-svoystv-mannozosoderzhaschego-gidrolizata (дата обращения: 24.10.2024).","Черемушкина И.В., & Корнеева О.С. (2016). Исследование пребиотических свойств маннозосодержащего гидролизата. Технологии пищевой и перерабатывающей промышленности АПК – продукты здорового питания,  (5 (13)), 113-119.",https://cyberleninka.ru/article/n/issledovanie-prebioticheskih-svoystv-mannozosoderzhaschego-gidrolizata
"Оценка влияния биологически активных препаратов на сорта сои приморской селекции, их рост и развитие на ранних этапах онтогенеза, урожайность и иммунитет","Лукьянчук Л.М., Хасбиуллина О.И.",Вестник Дальневосточного отделения Российской академии наук,2016,Агробиотехнологии,"соя, биологически активный препарат, корневая система, урожайность, грибные болезни, степень поражения","soybean, biologically active preparation, root system, yield, fungus diseases, degree of damage","Приводятся данные о влиянии биологически активных препаратов на сорта сои разных групп спелости в условиях муссонного климата Приморского края. Оценивается их действие на иммунитет и урожайность различных сортов, а также на развитие корневой системы на раннем этапе роста и развития растений. Показана целесообразность использования биологически активных препаратов в качестве элемента сортовой агротехники для различных генотипов сои.","Лукьянчук Л. М., Хасбиуллина О. И. Оценка влияния биологически активных препаратов на сорта сои приморской селекции, их рост и развитие на ранних этапах онтогенеза, урожайность и иммунитет // Вестник ДВО РАН. 2016. №2 (186). URL: https://cyberleninka.ru/article/n/otsenka-vliyaniya-biologicheski-aktivnyh-preparatov-na-sorta-soi-primorskoy-selektsii-ih-rost-i-razvitie-na-rannih-etapah-ontogeneza (дата обращения: 24.10.2024).","Лукьянчук Л.М., & Хасбиуллина О.И. (2016). Оценка влияния биологически активных препаратов на сорта сои приморской селекции, их рост и развитие на ранних этапах онтогенеза, урожайность и иммунитет. Вестник Дальневосточного отделения Российской академии наук,  (2 (186)), 50-56.",https://cyberleninka.ru/article/n/otsenka-vliyaniya-biologicheski-aktivnyh-preparatov-na-sorta-soi-primorskoy-selektsii-ih-rost-i-razvitie-na-rannih-etapah-ontogeneza
"Наноструктурный сапропель: изготовление, изучение физико-химических свойств и определение безопасных доз применения","Ежков В.О., Файзрахманов Р.Н., Семакина Е.В., Ежкова Д.В., Ежкова А.М.",Вестник Казанского технологического университета,2016,Агробиотехнологии,"сапропель, наноструктурныйсапропель, элементный состав, размер и форма частиц, нелинейные белые мыши, безопасные, токсичные и летальные дозы","sapropel, nanostructured sapropel, elemental composition, particle size and shape, nonlinear white mice, safe, toxic and lethal doses","В статье показано, что ультразвуковое диспергирование сапропеля способствует раздроблению составляющих его конгломератов и уменьшению размера частиц от 4,0 мкм до 45,0-180,0 нм. Установлено, что при этом происходит изменениеформы частиц, структуры и свойств модифицированного сапропеля. При однократном внутрижелудочном введении наноструктурного сапропеля белым мышам выявлены безопасная доза 0,6 г/кг, токсичная в диапазоне 1,2-2,4 г/кг, летальная 3,0 г/кгживой массы (гибель 8 % поголовья).","Ежков В. О., Файзрахманов Р. Н., Семакина Е. В., Ежкова Д. В., Ежкова А. М. Наноструктурный сапропель: изготовление, изучение физико-химических свойств и определение безопасных доз применения // Вестник Казанского технологического университета. 2016. №20. URL: https://cyberleninka.ru/article/n/nanostrukturnyy-sapropel-izgotovlenie-izuchenie-fiziko-himicheskih-svoystv-i-opredelenie-bezopasnyh-doz-primeneniya (дата обращения: 24.10.2024).","Ежков В.О., Файзрахманов Р.Н., Семакина Е.В., Ежкова Д.В., & Ежкова А.М. (2016). Наноструктурный сапропель: изготовление, изучение физико-химических свойств и определение безопасных доз применения. Вестник Казанского технологического университета, 19 (20), 172-176.",https://cyberleninka.ru/article/n/nanostrukturnyy-sapropel-izgotovlenie-izuchenie-fiziko-himicheskih-svoystv-i-opredelenie-bezopasnyh-doz-primeneniya
"Культурально-морфологические и биохимические свойства стрептококков, выделенных из различных животных","Тахавиев А.Г., Алимов А.М.",Ученые записки Казанской государственной академии ветеринарной медицины им. Н. Э. Баумана,2016,Агробиотехнологии,"бактерии, биохимические свойства, индикатор, питательная среда, стрептококки","bacteria, biochemical properties, indicator, nutrient medium, streptococcus","В данной работе были изучены культурально-морфологические и биохимические свойства штаммов выделенных от различных животных. Исследуемые штаммы в сывороточных средах не образуют газ, сероводород, индол, каталазотрицательны, в мазках окрашиваются по Граму положительно, располагаются в виде диплококков и коротких цепочек. Изолированные штаммы хорошо ферминтируют: галактозу, мальтозу, маннит. Два штамма ферминтируют инулин. По результатам исследований культурально-морфологических и биохимических свойств, культуры, выделенные из различных животных, отнесены к роду Streptococcus.","Тахавиев А. Г., Алимов А. М. Культурально-морфологические и биохимические свойства стрептококков, выделенных из различных животных // Ученые записки КГАВМ им. Н.Э. Баумана. 2016. №4. URL: https://cyberleninka.ru/article/n/kulturalno-morfologicheskie-i-biohimicheskie-svoystva-streptokokkov-vydelennyh-iz-razlichnyh-zhivotnyh (дата обращения: 24.10.2024).","Тахавиев А.Г., & Алимов А.М. (2016). Культурально-морфологические и биохимические свойства стрептококков, выделенных из различных животных. Ученые записки Казанской государственной академии ветеринарной медицины им. Н. Э. Баумана, 228 (4), 74-78.",https://cyberleninka.ru/article/n/kulturalno-morfologicheskie-i-biohimicheskie-svoystva-streptokokkov-vydelennyh-iz-razlichnyh-zhivotnyh
Влияния кормовой добавки «Гидрогемол» на микрофлору пищеварительного тракта медоносных пчел,"Сердюченко И.В., Кощаев А.Г.",Ученые записки Казанской государственной академии ветеринарной медицины им. Н. Э. Баумана,2016,Агробиотехнологии,"пчела медоносная, микроорганизмы, микрофлора, кишечник, годрогемол","apis mellifera, microorganisms, microflora, an intestines, gidrogemol","Изучено влияние кормовой добавки Гидрогемол на количественный и качественный состав микрофлоры пищеварительного тракта пчел. При этом установлено, что скармливание гидрогемола в смеси с канди вызывает снижение патогенной микрофлоры пищеварительного тракта пчел, что создает наиболее благоприятные условия для дальнейшего развития пчелиных семей.","Сердюченко И. В., Кощаев А. Г. Влияния кормовой добавки «Гидрогемол» на микрофлору пищеварительного тракта медоносных пчел // Ученые записки КГАВМ им. Н.Э. Баумана. 2016. №3. URL: https://cyberleninka.ru/article/n/vliyaniya-kormovoy-dobavki-gidrogemol-na-mikrofloru-pischevaritelnogo-trakta-medonosnyh-pchel (дата обращения: 24.10.2024).","Сердюченко И.В., & Кощаев А.Г. (2016). Влияния кормовой добавки «Гидрогемол» на микрофлору пищеварительного тракта медоносных пчел. Ученые записки Казанской государственной академии ветеринарной медицины им. Н. Э. Баумана, 227 (3), 78-81.",https://cyberleninka.ru/article/n/vliyaniya-kormovoy-dobavki-gidrogemol-na-mikrofloru-pischevaritelnogo-trakta-medonosnyh-pchel
"Масс-спектрометрия с лазерной десорбцией/ионизацией для сравнительной оценки содержания гиперицина, псевдогиперицина и гиперфорина в культурном и дикорастущем Hypericum perforatum l in vivo и in vitro","Овчинникова Вера Николаевна, Гончарова Ирина Сергеевна, Харченко Петр Николаевич, Леонова Татьяна Геннадиевна, Буряк Алексей Константинович",Химия растительного сырья,2016,Агробиотехнологии,"зверобой, микроклональное размножение, гиперицин, псевдогиперицин, гиперфорин, лазерная десорбция/ионизация (лди)",,"Исследовали способность к образованию гиперицина, псевдогиперицина и гиперфорина в интактных ( in vivo ) растениях Hypericum perforatum L. (зверобоя продырявленнего) и полученных методом микроклонального размножения ( in vitro ). В качестве объектов исследования использовали дикорастущие и культурные (сорт Солнечный) растения. Надземную часть растений, полученных in vivo, а также листья, стебли и каллусную ткань растений, полученных in vitro, подвергали лиофильной сушке. Перед началом измерений проводили экстракцию метанолом в течение 1 ч. Для обнаружения указанных химических соединений применяли времяпролетный масс-спектрометр с лазерной десорбцией/ионизацией (ЛДИ). В метанольном экстракте лиофильно высушенных дикорастущих и культурных растениях, выращенных in vivo, были обнаружены все исследуемые соединения. При выращивании in vitro в дикорастущем зверобое были также определены все вышеуказанные соединения, однако в растениях сорта Солнечный гиперфорин масс-спектрометрически идентифицировать не удалось. После хранения лиофильно высушенных растений в эксикаторе в темноте при 20 °С в течение 2,5 месяца в темноте удалось обнаружить все изучаемые соединения только у растений, выращенных in vivo. В растениях дикорастущего и культурного зверобоя, выращенных in vitro, был обнаружен только псевдогиперицин.","Овчинникова Вера Николаевна, Гончарова Ирина Сергеевна, Харченко Петр Николаевич, Леонова Татьяна Геннадиевна, Буряк Алексей Константинович Масс-спектрометрия с лазерной десорбцией/ионизацией для сравнительной оценки содержания гиперицина, псевдогиперицина и гиперфорина в культурном и дикорастущем Hypericum perforatum l in vivo и in vitro // Химия растительного сырья. 2016. №3. URL: https://cyberleninka.ru/article/n/mass-spektrometriya-s-lazernoy-desorbtsiey-ionizatsiey-dlya-sravnitelnoy-otsenki-soderzhaniya-giperitsina-psevdogiperitsina-i (дата обращения: 24.10.2024).","Овчинникова Вера Николаевна, Гончарова Ирина Сергеевна, Харченко Петр Николаевич, Леонова Татьяна Геннадиевна, & Буряк Алексей Константинович (2016). Масс-спектрометрия с лазерной десорбцией/ионизацией для сравнительной оценки содержания гиперицина, псевдогиперицина и гиперфорина в культурном и дикорастущем Hypericum perforatum l in vivo и in vitro. Химия растительного сырья,  (3), 35-40.",https://cyberleninka.ru/article/n/mass-spektrometriya-s-lazernoy-desorbtsiey-ionizatsiey-dlya-sravnitelnoy-otsenki-soderzhaniya-giperitsina-psevdogiperitsina-i
